[
  {
    "position": "CLINICAL PROGRAM COORDINATOR",
    "location": "Leratong Hospital",
    "package": "R 549 192 per annum (Plus Benefits)",
    "closing_date": "2026/01/16",
    "link": "https://jobs.gauteng.gov.za/Public/ViewJob.aspx?u=E7CSZ5GRR4E7dh6BW+s38Q==",
    "title": "CLINICAL PROGRAM COORDINATOR",
    "reference_number": "refs/034961",
    "directorate": "HUMAN RESOURCE (OHS)",
    "centre": "Leratong Hospital",
    "package_detail": "R 549 192 per annum (Plus Benefits)",
    "closing_date_detail": "16-01-2026",
    "enquiries": "Ms N Serobatse (011) 411-3563 / Ms M Mabiletse (011)411-3677",
    "requirements": "Grade12 or equivalent/NQF level/. A R425 qualification (i.e., diploma / degree in nursing) or equivalent qualification that allows registration with SANC as a professional nurse. Current registration with SANC. A minimum of 7 years appropriate/recognisable experience in nursing after registration as Professional Nurse with the SANC in General Nursing, of which 3 years must be relevant experience in Occupational Health and Safety environment. A post basic nursing qualification with duration of at least 1 year accredited by SANC in Occupational Health Safety. Current SANC registration. Basic computer literacy and driver\u2019s license are mandatory. Knowledge of Occupational Health AND safety Act 85 of 1993, COID Act 130 of 1993 including other related legal framework and PRAAD. Knowledge and application of policies governing the Public Service including Quality Assurance, PILIR, PRAAD and EHWP Strategic Framework. Be able to work independently. Skilled to develop on-going training in OHS principles to all categories of staff good communication, report writing and facilitation skills. Sound organizing, planning, presentation skills. Counselling, decision making, good communication skills.",
    "duties": "Implementation of Occupational Health and Safety Act 85 of 1993 and COID Act 130 of 1993. Conduct workplace hazard identification and risk assessment (HIRA) in liaison with managers and ensure there are safe operating procedures where necessary. Conduct training to all categories of personnel. Perform medical surveillance. Maintain all appropriate records and documents relevant to OHS. Participate in Institutions\u2019 and Province\u2019s determined Committees, Task Teams, and Forum for service improvement. Facilitate, implementation of National, Provincial legislation regarding OHS protocols and monitoring thereof. Develop and monitor the implementation of education and training programs in field. Active participation in Employees wellness program. Assist with waste management. Management of (IOD)injury on duty. Active participation in PILIR committee development and maintenance of OHS structure according to legal requirements. Working closely with IPC and EAP coordinators.",
    "notes": "Applications should be submitted strictly online at the following E-Recruitment portal: http://jobs.gauteng.gov.za. No hand-delivered, faxed, or emailed applications will be accepted. For assistance with online applications please email your query to healthjobqueries@gauteng.gov.za . NB: Where Driver\u2019s Licence is mandatory, exception will be granted for people with disabilities. Application should be accompanied by a fully completed and signed new Z83 application form obtainable from any Public Service Department or on the internet at www.dpsa.gov.za/documents plus a recently updated comprehensive Curriculum Vitae (CV), Registration Certificate with relevant professional body (HPCSA) and a proof of current registration (Annual Practicing Certificate/Card). Applications without proof of a new Z83 application form, a detailed CV, registration certificate and a proof of current registration card/certificate with relevant professional body will be disqualified. (Shortlisted candidates will receive communication from HR to submit certified copies of educational qualifications and other relevant documents not older than 6 months on or before the day of the interview). It is the applicant\u2019s responsibility to have foreign qualifications evaluated by the South African Qualifications Authority (SAQA). All foreign qualification must be accompanied by evaluation certificate from the South African Qualification Authority (SAQA). Correspondence will only be limited to shortlisted candidates. If you have not been contacted within 3 months of the closing date of this advertisement, please accept that your application was unsuccessful. Suitable candidates will be subjected to a personnel suitability check (criminal record, citizenship, credit record checks, qualification verification and employment verification). Where applicable, candidates will be subjected to a skills/knowledge test. The recommended candidate may be subjected to Medical Surveillance as required by the Occupational Health and Safety Act, Act 5/1993. It is Department\u2019s intention to promote representivity (race, gender, and disability) in the Public Service through the filling of these posts. The Department reserves the right not to appoint/fill this post. WOMEN AND PEOPLE WITH DISABILITY ARE ENCOURAGED TO APPLY.",
    "full_text": "HOME\nJOBS\nABOUT US\nACCOUNT\n\n\n\nJob Details\nDepartment of Health\nCLINICAL PROGRAM COORDINATOR\nReference Number : refs/034961\nDirectorate : HUMAN RESOURCE (OHS)\nNumber of Posts : 1\nPackage : R 549 192 per annum (Plus Benefits)\nEnquiries : Ms N Serobatse (011) 411-3563 / Ms M Mabiletse (011)411-3677\n\nRequirements :\n\nGrade12 or equivalent/NQF level/. A R425 qualification (i.e., diploma / degree in nursing) or equivalent qualification that allows registration with SANC as a professional nurse. Current registration with SANC. A minimum of 7 years appropriate/recognisable experience in nursing after registration as Professional Nurse with the SANC in General Nursing, of which 3 years must be relevant experience in Occupational Health and Safety environment. A post basic nursing qualification with duration of at least 1 year accredited by SANC in Occupational Health Safety. Current SANC registration. Basic computer literacy and driver\u2019s license are mandatory. Knowledge of Occupational Health AND safety Act 85 of 1993, COID Act 130 of 1993 including other related legal framework and PRAAD. Knowledge and application of policies governing the Public Service including Quality Assurance, PILIR, PRAAD and EHWP Strategic Framework. Be able to work independently. Skilled to develop on-going training in OHS principles to all categories of staff good communication, report writing and facilitation skills. Sound organizing, planning, presentation skills. Counselling, decision making, good communication skills.\n\nDuties :\n\nImplementation of Occupational Health and Safety Act 85 of 1993 and COID Act 130 of 1993. Conduct workplace hazard identification and risk assessment (HIRA) in liaison with managers and ensure there are safe operating procedures where necessary. Conduct training to all categories of personnel. Perform medical surveillance. Maintain all appropriate records and documents relevant to OHS. Participate in Institutions\u2019 and Province\u2019s determined Committees, Task Teams, and Forum for service improvement. Facilitate, implementation of National, Provincial legislation regarding OHS protocols and monitoring thereof. Develop and monitor the implementation of education and training programs in field. Active participation in Employees wellness program. Assist with waste management. Management of (IOD)injury on duty. Active participation in PILIR committee development and maintenance of OHS structure according to legal requirements. Working closely with IPC and EAP coordinators.\n\nNotes :\n\nApplications should be submitted strictly online at the following E-Recruitment portal: http://jobs.gauteng.gov.za. No hand-delivered, faxed, or emailed applications will be accepted. For assistance with online applications please email your query to healthjobqueries@gauteng.gov.za . NB: Where Driver\u2019s Licence is mandatory, exception will be granted for people with disabilities. Application should be accompanied by a fully completed and signed new Z83 application form obtainable from any Public Service Department or on the internet at www.dpsa.gov.za/documents plus a recently updated comprehensive Curriculum Vitae (CV), Registration Certificate with relevant professional body (HPCSA) and a proof of current registration (Annual Practicing Certificate/Card). Applications without proof of a new Z83 application form, a detailed CV, registration certificate and a proof of current registration card/certificate with relevant professional body will be disqualified. (Shortlisted candidates will receive communication from HR to submit certified copies of educational qualifications and other relevant documents not older than 6 months on or before the day of the interview). It is the applicant\u2019s responsibility to have foreign qualifications evaluated by the South African Qualifications Authority (SAQA). All foreign qualification must be accompanied by evaluation certificate from the South African Qualification Authority (SAQA). Correspondence will only be limited to shortlisted candidates. If you have not been contacted within 3 months of the closing date of this advertisement, please accept that your application was unsuccessful. Suitable candidates will be subjected to a personnel suitability check (criminal record, citizenship, credit record checks, qualification verification and employment verification). Where applicable, candidates will be subjected to a skills/knowledge test. The recommended candidate may be subjected to Medical Surveillance as required by the Occupational Health and Safety Act, Act 5/1993. It is Department\u2019s intention to promote representivity (race, gender, and disability) in the Public Service through the filling of these posts. The Department reserves the right not to appoint/fill this post. WOMEN AND PEOPLE WITH DISABILITY ARE ENCOURAGED TO APPLY.\n\nEmployer : Department of Health\n\nLocation : Leratong Hospital\n\nClosing Date : 16-01-2026\n\n\n\nCriteria Questions\nDo you have a R425 qualification (i.e., diploma / degree in nursing) or equivalent qualification that allows registration with SANC as a professional nurse?\nDo you have a minimum of 7 years appropriate/recognisable experience in nursing after registration as Professional Nurse with the SANC in General Nursing, of which 3 years must be relevant experience in Occupational Health and Safety environment?\n\n\n\nPlease Notes :\n\nDue to the large number of applications we envisage receiving, applications will not be acknowledged. If you do not receive any response within 3 months, please accept that your application was not successful.\n\n\nFind us\nAddress\n75 Fox Street, Mashalltown\nJohannesburg\n2000\n\nCall us\n\nPhone\n080 022 8827\nEmail\nsupport@gauteng.gov.za\n\nQuick Links\nAll Jobs\nAbout Us\n\n\u00a9 Gauteng Provincial Government 2026 . Powered by Department of e-Government"
  },
  {
    "position": "PORTERS LEVEL 2",
    "location": "Leratong Hospital",
    "package": "R 138 486 per annum (PLUS BENEFITS)",
    "closing_date": "2026/01/16",
    "link": "https://jobs.gauteng.gov.za/Public/ViewJob.aspx?u=57glvgJbW+LZ7A9Nhblgyw==",
    "title": "PORTERS LEVEL 2",
    "reference_number": "REFS/034960",
    "directorate": "PATIENT AFFAIRS",
    "centre": "Leratong Hospital",
    "package_detail": "R 138 486 per annum (PLUS BENEFITS)",
    "closing_date_detail": "16-01-2026",
    "enquiries": "Ms N Serobatse (011) 411-3563 / Ms M Mabiletse (011)411-3677",
    "requirements": "Grade 10/ABET level 4, vocational studies or equivalent. Must be able to read and write, be able to communicate in more than one official language. Knowledge of Batho Pele Principles and other legislated prescripts.",
    "duties": "Ensure transportation of patient from one point to the other, assist in off-loading of patients from private cars and ambulance, ensure availability of clean wheelchairs and stretchers for patient use, assist in mortuary during weekends, after hours and public holidays. Record mortuary temperatures during weekends, public holidays. Must be able to push patients on a stretcher or wheelchair. Be able to perform any other duties as requested by the supervisor.",
    "notes": "Applications should be submitted strictly online at the following E-Recruitment portal: http://jobs.gauteng.gov.za. No hand-delivered, faxed, or emailed applications will be accepted. For assistance with online applications please email your query to healthjobqueries@gauteng.gov.za. NB: Where Driver\u2019s Licence is mandatory, exception will be granted for people with disabilities. Application should be accompanied by a fully completed and signed new Z83 application form obtainable from any Public Service Department or on the internet at www.dpsa.gov.za/documents plus a recently updated comprehensive Curriculum Vitae (CV). Applications without proof of a new Z83 application form and detailed CV will be disqualified. (Shortlisted candidates will receive communication from HR to submit certified copies of educational qualifications and other relevant documents not older than 6 months on or before the day of the interview). It is the applicant\u2019s responsibility to have foreign qualifications evaluated by the South African Qualifications Authority (SAQA). All foreign qualification must be accompanied by evaluation certificate from the South African Qualification Authority (SAQA). Correspondence will only be limited to shortlisted candidates. Suitable candidates will be subjected to a personnel suitability check (criminal record, citizenship, credit record checks, qualification verification and employment verification). Where applicable, candidates will be subjected to a skills/knowledge test. The recommended candidate may be subjected to Medical Surveillance as required by the Occupational Health and Safety Act, Act 5/1993. It is Department\u2019s intention to promote representivity (race, gender, and disability) in the Public Service through the filling of these posts. The Department reserves the right not to appoint/fill this post. WOMEN AND PEOPLE WITH DISABILITY ARE ENCOURAGED TO APPLY.",
    "full_text": "HOME\nJOBS\nABOUT US\nACCOUNT\n\n\n\nJob Details\nDepartment of Health\nPORTERS LEVEL 2\nReference Number : REFS/034960\nDirectorate : PATIENT AFFAIRS\nNumber of Posts : 2\nPackage : R 138 486 per annum (PLUS BENEFITS)\nEnquiries : Ms N Serobatse (011) 411-3563 / Ms M Mabiletse (011)411-3677\n\nRequirements :\n\nGrade 10/ABET level 4, vocational studies or equivalent. Must be able to read and write, be able to communicate in more than one official language. Knowledge of Batho Pele Principles and other legislated prescripts.\n\nDuties :\n\nEnsure transportation of patient from one point to the other, assist in off-loading of patients from private cars and ambulance, ensure availability of clean wheelchairs and stretchers for patient use, assist in mortuary during weekends, after hours and public holidays. Record mortuary temperatures during weekends, public holidays. Must be able to push patients on a stretcher or wheelchair. Be able to perform any other duties as requested by the supervisor.\n\nNotes :\n\nApplications should be submitted strictly online at the following E-Recruitment portal: http://jobs.gauteng.gov.za. No hand-delivered, faxed, or emailed applications will be accepted. For assistance with online applications please email your query to healthjobqueries@gauteng.gov.za. NB: Where Driver\u2019s Licence is mandatory, exception will be granted for people with disabilities. Application should be accompanied by a fully completed and signed new Z83 application form obtainable from any Public Service Department or on the internet at www.dpsa.gov.za/documents plus a recently updated comprehensive Curriculum Vitae (CV). Applications without proof of a new Z83 application form and detailed CV will be disqualified. (Shortlisted candidates will receive communication from HR to submit certified copies of educational qualifications and other relevant documents not older than 6 months on or before the day of the interview). It is the applicant\u2019s responsibility to have foreign qualifications evaluated by the South African Qualifications Authority (SAQA). All foreign qualification must be accompanied by evaluation certificate from the South African Qualification Authority (SAQA). Correspondence will only be limited to shortlisted candidates. Suitable candidates will be subjected to a personnel suitability check (criminal record, citizenship, credit record checks, qualification verification and employment verification). Where applicable, candidates will be subjected to a skills/knowledge test. The recommended candidate may be subjected to Medical Surveillance as required by the Occupational Health and Safety Act, Act 5/1993. It is Department\u2019s intention to promote representivity (race, gender, and disability) in the Public Service through the filling of these posts. The Department reserves the right not to appoint/fill this post. WOMEN AND PEOPLE WITH DISABILITY ARE ENCOURAGED TO APPLY.\n\nEmployer : Department of Health\n\nLocation : Leratong Hospital\n\nClosing Date : 16-01-2026\n\n\n\nCriteria Questions\nDo you have a grade 10/ABET level 4, vocational studies or equivalent?\nAre you able to read and write?\n\n\n\nPlease Notes :\n\nDue to the large number of applications we envisage receiving, applications will not be acknowledged. If you do not receive any response within 3 months, please accept that your application was not successful.\n\n\nFind us\nAddress\n75 Fox Street, Mashalltown\nJohannesburg\n2000\n\nCall us\n\nPhone\n080 022 8827\nEmail\nsupport@gauteng.gov.za\n\nQuick Links\nAll Jobs\nAbout Us\n\n\u00a9 Gauteng Provincial Government 2026 . Powered by Department of e-Government"
  },
  {
    "position": "OPERATOR LEVEL 3",
    "location": "Leratong Hospital",
    "package": "R 163 680.00 per annum (plus benefits)",
    "closing_date": "2026/01/16",
    "link": "https://jobs.gauteng.gov.za/Public/ViewJob.aspx?u=57glvgJbW+Ku1vNSGU/jOg==",
    "title": "OPERATOR LEVEL 3",
    "reference_number": "REFS/034959",
    "directorate": "THEATRE AND CSSD",
    "centre": "Leratong Hospital",
    "package_detail": "R 163 680.00 per annum (plus benefits)",
    "closing_date_detail": "16-01-2026",
    "enquiries": "Ms N Serobatse (011) 411-3563 / Ms M Mabiletse (011)411-3677",
    "requirements": "Grade 10 or equivalent NQF Level 2. Be able to read and write English. Good communication and planning skills. Experience in CSSD and Theatre will be an added advantage. Must be prepared to work under pressure and in a team. Must be able to cope with physical demands of the positions. Good understanding of Batho Pele Principles. Be prepared to work shifts and be on rotations.",
    "duties": "Be able to maintain infection prevention and control. Knowledge of Principle of infection control in the working area and differentiate between a clean and dirty area. Dispose waste according to internal policy. Collect CSSD instruments from Emergency Department (Casualty), Maternity, ICU and Theatres. Responsible to ensure that the instruments and Loan Sets received are complete and in good working condition. Responsible for cleaning, sorting, compiling, packing and autoclaving of instruments. Packing of soft packs. Be able to operate instrument washer and autoclaves. Unpack clean linen from Linen Room, folding of linen and gowns according to principles. Attend to instruments register and daily stats. Run Attest and Bowie Dick tests for quality control. Maintain growth / ethical standard and self \u2013 development. Perform duties as required per job description. Ensure that Surgeons\u2019 boots are cleaned regularly. Perform any other lawful and reasonable duties as delegated by the Supervisor. Work under Supervision of a Professional Nurse.",
    "notes": "Applications should be submitted strictly online at the following E-Recruitment portal: http://jobs.gauteng.gov.za. No hand-delivered, faxed, or emailed applications will be accepted. For assistance with online applications please email your query to healthjobqueries@gauteng.gov.za. NB: Where Driver\u2019s Licence is mandatory, exception will be granted for people with disabilities. Application should be accompanied by a fully completed and signed new Z83 application form obtainable from any Public Service Department or on the internet at www.dpsa.gov.za/documents plus a recently updated comprehensive Curriculum Vitae (CV). Applications without proof of a new Z83 application form and detailed CV will be disqualified. (Shortlisted candidates will receive communication from HR to submit certified copies of educational qualifications and other relevant documents not older than 6 months on or before the day of the interview). It is the applicant\u2019s responsibility to have foreign qualifications evaluated by the South African Qualifications Authority (SAQA). All foreign qualification must be accompanied by evaluation certificate from the South African Qualification Authority (SAQA). Correspondence will only be limited to shortlisted candidates. Suitable candidates will be subjected to a personnel suitability check (criminal record, citizenship, credit record checks, qualification verification and employment verification). Where applicable, candidates will be subjected to a skills/knowledge test. The recommended candidate may be subjected to Medical Surveillance as required by the Occupational Health and Safety Act, Act 5/1993. It is Department\u2019s intention to promote representivity (race, gender, and disability) in the Public Service through the filling of these posts. The Department reserves the right not to appoint/fill this post. WOMEN AND PEOPLE WITH DISABILITY ARE ENCOURAGED TO APPLY.",
    "full_text": "HOME\nJOBS\nABOUT US\nACCOUNT\n\n\n\nJob Details\nDepartment of Health\nOPERATOR LEVEL 3\nReference Number : REFS/034959\nDirectorate : THEATRE AND CSSD\nNumber of Posts : 3\nPackage : R 163 680.00 per annum (plus benefits)\nEnquiries : Ms N Serobatse (011) 411-3563 / Ms M Mabiletse (011)411-3677\n\nRequirements :\n\nGrade 10 or equivalent NQF Level 2. Be able to read and write English. Good communication and planning skills. Experience in CSSD and Theatre will be an added advantage. Must be prepared to work under pressure and in a team. Must be able to cope with physical demands of the positions. Good understanding of Batho Pele Principles. Be prepared to work shifts and be on rotations.\n\nDuties :\n\nBe able to maintain infection prevention and control. Knowledge of Principle of infection control in the working area and differentiate between a clean and dirty area. Dispose waste according to internal policy. Collect CSSD instruments from Emergency Department (Casualty), Maternity, ICU and Theatres. Responsible to ensure that the instruments and Loan Sets received are complete and in good working condition. Responsible for cleaning, sorting, compiling, packing and autoclaving of instruments. Packing of soft packs. Be able to operate instrument washer and autoclaves. Unpack clean linen from Linen Room, folding of linen and gowns according to principles. Attend to instruments register and daily stats. Run Attest and Bowie Dick tests for quality control. Maintain growth / ethical standard and self \u2013 development. Perform duties as required per job description. Ensure that Surgeons\u2019 boots are cleaned regularly. Perform any other lawful and reasonable duties as delegated by the Supervisor. Work under Supervision of a Professional Nurse.\n\nNotes :\n\nApplications should be submitted strictly online at the following E-Recruitment portal: http://jobs.gauteng.gov.za. No hand-delivered, faxed, or emailed applications will be accepted. For assistance with online applications please email your query to healthjobqueries@gauteng.gov.za. NB: Where Driver\u2019s Licence is mandatory, exception will be granted for people with disabilities. Application should be accompanied by a fully completed and signed new Z83 application form obtainable from any Public Service Department or on the internet at www.dpsa.gov.za/documents plus a recently updated comprehensive Curriculum Vitae (CV). Applications without proof of a new Z83 application form and detailed CV will be disqualified. (Shortlisted candidates will receive communication from HR to submit certified copies of educational qualifications and other relevant documents not older than 6 months on or before the day of the interview). It is the applicant\u2019s responsibility to have foreign qualifications evaluated by the South African Qualifications Authority (SAQA). All foreign qualification must be accompanied by evaluation certificate from the South African Qualification Authority (SAQA). Correspondence will only be limited to shortlisted candidates. Suitable candidates will be subjected to a personnel suitability check (criminal record, citizenship, credit record checks, qualification verification and employment verification). Where applicable, candidates will be subjected to a skills/knowledge test. The recommended candidate may be subjected to Medical Surveillance as required by the Occupational Health and Safety Act, Act 5/1993. It is Department\u2019s intention to promote representivity (race, gender, and disability) in the Public Service through the filling of these posts. The Department reserves the right not to appoint/fill this post. WOMEN AND PEOPLE WITH DISABILITY ARE ENCOURAGED TO APPLY.\n\nEmployer : Department of Health\n\nLocation : Leratong Hospital\n\nClosing Date : 16-01-2026\n\n\n\nCriteria Questions\nDo you have a grade 10 or equivalent NQF Level 2?\nAre you able to read and write English?\n\n\n\nPlease Notes :\n\nDue to the large number of applications we envisage receiving, applications will not be acknowledged. If you do not receive any response within 3 months, please accept that your application was not successful.\n\n\nFind us\nAddress\n75 Fox Street, Mashalltown\nJohannesburg\n2000\n\nCall us\n\nPhone\n080 022 8827\nEmail\nsupport@gauteng.gov.za\n\nQuick Links\nAll Jobs\nAbout Us\n\n\u00a9 Gauteng Provincial Government 2026 . Powered by Department of e-Government"
  },
  {
    "position": "SECURITY LEVEL 3",
    "location": "Leratong Hospital",
    "package": "R 163 680.00 per annum (Plus Benefits)",
    "closing_date": "2026/01/16",
    "link": "https://jobs.gauteng.gov.za/Public/ViewJob.aspx?u=57glvgJbW+JhXqiPuI3QTw==",
    "title": "SECURITY LEVEL 3",
    "reference_number": "REFS/034958",
    "directorate": "SECURITY DEPARTMENT",
    "centre": "Leratong Hospital",
    "package_detail": "R 163 680.00 per annum (Plus Benefits)",
    "closing_date_detail": "16-01-2026",
    "enquiries": "Ms N Serobatse (011) 411-3563 / Ms M Mabiletse (011)411-3677",
    "requirements": "Grade 10 or equivalent qualification, Grade C security certificate with valid PSIRA registration. No criminal record. Ability to read and write. Applicants must be able to communicate in more than one official languages. Must be prepared to work shifts, weekends, and public holidays. Knowledge of security prescripts governing the public sector. Knowledge of Batho Pele principles",
    "duties": "Ensure safety and security of staff, assets and visitors, mending of the access control, searching of vehicles, staff and patients entering and leaving the institution. Perform hourly patrols within the institution, parking areas, around perimeter fence and report any abnormalities or suspicious moves. Monitor the CCTV camera. Attend sectional meetings and present reports. Assist in other units through backups.",
    "notes": "Applications should be submitted strictly online at the following E-Recruitment portal: http://jobs.gauteng.gov.za. No hand-delivered, faxed, or emailed applications will be accepted. For assistance with online applications please email your query to healthjobqueries@gauteng.gov.za. NB: Where Driver\u2019s Licence is mandatory, exception will be granted for people with disabilities. Application should be accompanied by a fully completed and signed new Z83 application form obtainable from any Public Service Department or on the internet at www.dpsa.gov.za/documents plus a recently updated comprehensive Curriculum Vitae (CV). Applications without proof of a new Z83 application form and detailed CV will be disqualified. (Shortlisted candidates will receive communication from HR to submit certified copies of educational qualifications and other relevant documents not older than 6 months on or before the day of the interview). It is the applicant\u2019s responsibility to have foreign qualifications evaluated by the South African Qualifications Authority (SAQA). All foreign qualification must be accompanied by evaluation certificate from the South African Qualification Authority (SAQA). Correspondence will only be limited to shortlisted candidates. Suitable candidates will be subjected to a personnel suitability check (criminal record, citizenship, credit record checks, qualification verification and employment verification). Where applicable, candidates will be subjected to a skills/knowledge test. The recommended candidate may be subjected to Medical Surveillance as required by the Occupational Health and Safety Act, Act 5/1993. It is Department\u2019s intention to promote representivity (race, gender, and disability) in the Public Service through the filling of these posts. The Department reserves the right not to appoint/fill this post. WOMEN AND PEOPLE WITH DISABILITY ARE ENCOURAGED TO APPLY.",
    "full_text": "HOME\nJOBS\nABOUT US\nACCOUNT\n\n\n\nJob Details\nDepartment of Health\nSECURITY LEVEL 3\nReference Number : REFS/034958\nDirectorate : SECURITY DEPARTMENT\nNumber of Posts : 3\nPackage : R 163 680.00 per annum (Plus Benefits)\nEnquiries : Ms N Serobatse (011) 411-3563 / Ms M Mabiletse (011)411-3677\n\nRequirements :\n\nGrade 10 or equivalent qualification, Grade C security certificate with valid PSIRA registration. No criminal record. Ability to read and write. Applicants must be able to communicate in more than one official languages. Must be prepared to work shifts, weekends, and public holidays. Knowledge of security prescripts governing the public sector. Knowledge of Batho Pele principles\n\nDuties :\n\nEnsure safety and security of staff, assets and visitors, mending of the access control, searching of vehicles, staff and patients entering and leaving the institution. Perform hourly patrols within the institution, parking areas, around perimeter fence and report any abnormalities or suspicious moves. Monitor the CCTV camera. Attend sectional meetings and present reports. Assist in other units through backups.\n\nNotes :\n\nApplications should be submitted strictly online at the following E-Recruitment portal: http://jobs.gauteng.gov.za. No hand-delivered, faxed, or emailed applications will be accepted. For assistance with online applications please email your query to healthjobqueries@gauteng.gov.za. NB: Where Driver\u2019s Licence is mandatory, exception will be granted for people with disabilities. Application should be accompanied by a fully completed and signed new Z83 application form obtainable from any Public Service Department or on the internet at www.dpsa.gov.za/documents plus a recently updated comprehensive Curriculum Vitae (CV). Applications without proof of a new Z83 application form and detailed CV will be disqualified. (Shortlisted candidates will receive communication from HR to submit certified copies of educational qualifications and other relevant documents not older than 6 months on or before the day of the interview). It is the applicant\u2019s responsibility to have foreign qualifications evaluated by the South African Qualifications Authority (SAQA). All foreign qualification must be accompanied by evaluation certificate from the South African Qualification Authority (SAQA). Correspondence will only be limited to shortlisted candidates. Suitable candidates will be subjected to a personnel suitability check (criminal record, citizenship, credit record checks, qualification verification and employment verification). Where applicable, candidates will be subjected to a skills/knowledge test. The recommended candidate may be subjected to Medical Surveillance as required by the Occupational Health and Safety Act, Act 5/1993. It is Department\u2019s intention to promote representivity (race, gender, and disability) in the Public Service through the filling of these posts. The Department reserves the right not to appoint/fill this post. WOMEN AND PEOPLE WITH DISABILITY ARE ENCOURAGED TO APPLY.\n\nEmployer : Department of Health\n\nLocation : Leratong Hospital\n\nClosing Date : 16-01-2026\n\n\n\nCriteria Questions\nDo you have a grade 10 or equivalent qualification, Grade C security certificate with valid PSIRA registration?\nAre you able to read and write?\n\n\n\nPlease Notes :\n\nDue to the large number of applications we envisage receiving, applications will not be acknowledged. If you do not receive any response within 3 months, please accept that your application was not successful.\n\n\nFind us\nAddress\n75 Fox Street, Mashalltown\nJohannesburg\n2000\n\nCall us\n\nPhone\n080 022 8827\nEmail\nsupport@gauteng.gov.za\n\nQuick Links\nAll Jobs\nAbout Us\n\n\u00a9 Gauteng Provincial Government 2026 . Powered by Department of e-Government"
  },
  {
    "position": "DRIVERS LEVEL 4",
    "location": "Leratong Hospital",
    "package": "R 193 359.00 per annum (Plus Benefits)",
    "closing_date": "2026/01/16",
    "link": "https://jobs.gauteng.gov.za/Public/ViewJob.aspx?u=57glvgJbW+LIB8faRsAlWw==",
    "title": "DRIVERS LEVEL 4",
    "reference_number": "REFS/034957",
    "directorate": "TRANSPORT DEPARTMENT",
    "centre": "Leratong Hospital",
    "package_detail": "R 193 359.00 per annum (Plus Benefits)",
    "closing_date_detail": "16-01-2026",
    "enquiries": "Ms N Serobatse (011) 411-3563 / Ms M Mabiletse (011)411-3677",
    "requirements": "Grade 12 or equivalent with 3-5 years as a driver. Valid code 10/14 drivers\u2019 licence with PDP. Candidates must have an unendorsed driver\u2019s licence. Must have knowledge of surrounding hospital, and clinics. Must understand legislative prescripts governing the health sector.",
    "duties": ": Transportation of staff, patient and documents. Report any faults regarding the vehicle, be able to change flat tyre if a need arises. Ensure cleanliness of the vehicle. Conduct pre/post trip inspections before embarking on a trip and after using a car. Ensure safe and timeous transportation of staff and patients. Be able to work shifts. Ensure compliance with the department of transport handbook. Report any damages on the vehicles within 24hours. Compile an incident report to report damages. Be able to perform any other duties as requested by the supervisor.",
    "notes": "Applications should be submitted strictly online at the following E-Recruitment portal: http://jobs.gauteng.gov.za. No hand-delivered, faxed, or emailed applications will be accepted. For assistance with online applications please email your query to healthjobqueries@gauteng.gov.za. NB: Where Driver\u2019s Licence is mandatory, exception will be granted for people with disabilities. Application should be accompanied by a fully completed and signed new Z83 application form obtainable from any Public Service Department or on the internet at www.dpsa.gov.za/documents plus a recently updated comprehensive Curriculum Vitae (CV). Applications without proof of a new Z83 application form and detailed CV will be disqualified. (Shortlisted candidates will receive communication from HR to submit certified copies of educational qualifications and other relevant documents not older than 6 months on or before the day of the interview). It is the applicant\u2019s responsibility to have foreign qualifications evaluated by the South African Qualifications Authority (SAQA). All foreign qualification must be accompanied by evaluation certificate from the South African Qualification Authority (SAQA). Correspondence will only be limited to shortlisted candidates. Suitable candidates will be subjected to a personnel suitability check (criminal record, citizenship, credit record checks, qualification verification and employment verification). Where applicable, candidates will be subjected to a skills/knowledge test. The recommended candidate may be subjected to Medical Surveillance as required by the Occupational Health and Safety Act, Act 5/1993. It is Department\u2019s intention to promote representivity (race, gender, and disability) in the Public Service through the filling of these posts. The Department reserves the right not to appoint/fill this post. WOMEN AND PEOPLE WITH DISABILITY ARE ENCOURAGED TO APPLY.",
    "full_text": "HOME\nJOBS\nABOUT US\nACCOUNT\n\n\n\nJob Details\nDepartment of Health\nDRIVERS LEVEL 4\nReference Number : REFS/034957\nDirectorate : TRANSPORT DEPARTMENT\nNumber of Posts : 5\nPackage : R 193 359.00 per annum (Plus Benefits)\nEnquiries : Ms N Serobatse (011) 411-3563 / Ms M Mabiletse (011)411-3677\n\nRequirements :\n\nGrade 12 or equivalent with 3-5 years as a driver. Valid code 10/14 drivers\u2019 licence with PDP. Candidates must have an unendorsed driver\u2019s licence. Must have knowledge of surrounding hospital, and clinics. Must understand legislative prescripts governing the health sector.\n\nDuties :\n\n: Transportation of staff, patient and documents. Report any faults regarding the vehicle, be able to change flat tyre if a need arises. Ensure cleanliness of the vehicle. Conduct pre/post trip inspections before embarking on a trip and after using a car. Ensure safe and timeous transportation of staff and patients. Be able to work shifts. Ensure compliance with the department of transport handbook. Report any damages on the vehicles within 24hours. Compile an incident report to report damages. Be able to perform any other duties as requested by the supervisor.\n\nNotes :\n\nApplications should be submitted strictly online at the following E-Recruitment portal: http://jobs.gauteng.gov.za. No hand-delivered, faxed, or emailed applications will be accepted. For assistance with online applications please email your query to healthjobqueries@gauteng.gov.za. NB: Where Driver\u2019s Licence is mandatory, exception will be granted for people with disabilities. Application should be accompanied by a fully completed and signed new Z83 application form obtainable from any Public Service Department or on the internet at www.dpsa.gov.za/documents plus a recently updated comprehensive Curriculum Vitae (CV). Applications without proof of a new Z83 application form and detailed CV will be disqualified. (Shortlisted candidates will receive communication from HR to submit certified copies of educational qualifications and other relevant documents not older than 6 months on or before the day of the interview). It is the applicant\u2019s responsibility to have foreign qualifications evaluated by the South African Qualifications Authority (SAQA). All foreign qualification must be accompanied by evaluation certificate from the South African Qualification Authority (SAQA). Correspondence will only be limited to shortlisted candidates. Suitable candidates will be subjected to a personnel suitability check (criminal record, citizenship, credit record checks, qualification verification and employment verification). Where applicable, candidates will be subjected to a skills/knowledge test. The recommended candidate may be subjected to Medical Surveillance as required by the Occupational Health and Safety Act, Act 5/1993. It is Department\u2019s intention to promote representivity (race, gender, and disability) in the Public Service through the filling of these posts. The Department reserves the right not to appoint/fill this post. WOMEN AND PEOPLE WITH DISABILITY ARE ENCOURAGED TO APPLY.\n\nEmployer : Department of Health\n\nLocation : Leratong Hospital\n\nClosing Date : 16-01-2026\n\n\n\nCriteria Questions\nDo you have a grade 12 or equivalent with 3-5 years as a driver?\nDo you have a valid code 10/14 drivers\u2019 licence with PDP?\n\n\n\nPlease Notes :\n\nDue to the large number of applications we envisage receiving, applications will not be acknowledged. If you do not receive any response within 3 months, please accept that your application was not successful.\n\n\nFind us\nAddress\n75 Fox Street, Mashalltown\nJohannesburg\n2000\n\nCall us\n\nPhone\n080 022 8827\nEmail\nsupport@gauteng.gov.za\n\nQuick Links\nAll Jobs\nAbout Us\n\n\u00a9 Gauteng Provincial Government 2026 . Powered by Department of e-Government"
  },
  {
    "position": "FOOD SERVICE SUPERVISOR LEVEL 4",
    "location": "Leratong Hospital",
    "package": "R 193 359.00 per annum (Plus Benefits)",
    "closing_date": "2026/01/16",
    "link": "https://jobs.gauteng.gov.za/Public/ViewJob.aspx?u=57glvgJbW+I5tmYtDeCWWg==",
    "title": "FOOD SERVICE SUPERVISOR LEVEL 4",
    "reference_number": "REFS/034956",
    "directorate": "Human Nutrition",
    "centre": "Leratong Hospital",
    "package_detail": "R 193 359.00 per annum (Plus Benefits)",
    "closing_date_detail": "16-01-2026",
    "enquiries": "Ms N Serobatse (011) 411-3563 / Ms M Mabiletse (011)411-3677",
    "requirements": "Grade 10 with at least 3 - 5 years\u2019 experience in a foodservice unit or Grade 12 or higher with 2 \u2013 4 years\u2019 experience in a foodservice unit. Knowledge of equipment and food preparation processes. Knowledge of hygiene and safety principles. Able to work shifts and public Holidays. Be able to rotate to different areas within the food service department. Good communication in English (verbal, written and numerical skills). Must be able to communicate well with people at different levels. Must be able to take initiative. Must be able to work in a team and under pressure. Good planning and organizational skills. Be able to handle conflict. Basic computer literacy would be an advantage.",
    "duties": "Responsible for supervision of all food service personnel and their activities. Responsible for the receiving, storage, issuing and maintaining of stock control. Assist with cost control measures (key control measures). Responsible for supervision of production processes, portioning, dishing up and distribution of meals. Assist with client satisfaction survey and plate wastage. Responsible for the implementation of hygiene and safety processes in the foodservice unit. Responsible for the PMDS of subordinate staff in area of supervision. Assist with disciplinary measures in area of supervision. Render administrative duties according to duty roster. Adhere to all food service guidelines, policies and procedures. Comply with Occupational Health and Safety Act. Perform duties as allocated by the next level manager.",
    "notes": "Applications should be submitted strictly online at the following E-Recruitment portal: http://jobs.gauteng.gov.za. No hand-delivered, faxed, or emailed applications will be accepted. For assistance with online applications please email your query to healthjobqueries@gauteng.gov.za. NB: Where Driver\u2019s Licence is mandatory, exception will be granted for people with disabilities. Application should be accompanied by a fully completed and signed new Z83 application form obtainable from any Public Service Department or on the internet at www.dpsa.gov.za/documents plus a recently updated comprehensive Curriculum Vitae (CV). Applications without proof of a new Z83 application form and detailed CV will be disqualified. (Shortlisted candidates will receive communication from HR to submit certified copies of educational qualifications and other relevant documents not older than 6 months on or before the day of the interview). It is the applicant\u2019s responsibility to have foreign qualifications evaluated by the South African Qualifications Authority (SAQA). All foreign qualification must be accompanied by evaluation certificate from the South African Qualification Authority (SAQA). Correspondence will only be limited to shortlisted candidates. Suitable candidates will be subjected to a personnel suitability check (criminal record, citizenship, credit record checks, qualification verification and employment verification). Where applicable, candidates will be subjected to a skills/knowledge test. The recommended candidate may be subjected to Medical Surveillance as required by the Occupational Health and Safety Act, Act 5/1993. It is Department\u2019s intention to promote representivity (race, gender, and disability) in the Public Service through the filling of these posts. The Department reserves the right not to appoint/fill this post. WOMEN AND PEOPLE WITH DISABILITY ARE ENCOURAGED TO APPLY.",
    "full_text": "HOME\nJOBS\nABOUT US\nACCOUNT\n\n\n\nJob Details\nDepartment of Health\nFOOD SERVICE SUPERVISOR LEVEL 4\nReference Number : REFS/034956\nDirectorate : Human Nutrition\nNumber of Posts : 1\nPackage : R 193 359.00 per annum (Plus Benefits)\nEnquiries : Ms N Serobatse (011) 411-3563 / Ms M Mabiletse (011)411-3677\n\nRequirements :\n\nGrade 10 with at least 3 - 5 years\u2019 experience in a foodservice unit or Grade 12 or higher with 2 \u2013 4 years\u2019 experience in a foodservice unit. Knowledge of equipment and food preparation processes. Knowledge of hygiene and safety principles. Able to work shifts and public Holidays. Be able to rotate to different areas within the food service department. Good communication in English (verbal, written and numerical skills). Must be able to communicate well with people at different levels. Must be able to take initiative. Must be able to work in a team and under pressure. Good planning and organizational skills. Be able to handle conflict. Basic computer literacy would be an advantage.\n\nDuties :\n\nResponsible for supervision of all food service personnel and their activities. Responsible for the receiving, storage, issuing and maintaining of stock control. Assist with cost control measures (key control measures). Responsible for supervision of production processes, portioning, dishing up and distribution of meals. Assist with client satisfaction survey and plate wastage. Responsible for the implementation of hygiene and safety processes in the foodservice unit. Responsible for the PMDS of subordinate staff in area of supervision. Assist with disciplinary measures in area of supervision. Render administrative duties according to duty roster. Adhere to all food service guidelines, policies and procedures. Comply with Occupational Health and Safety Act. Perform duties as allocated by the next level manager.\n\nNotes :\n\nApplications should be submitted strictly online at the following E-Recruitment portal: http://jobs.gauteng.gov.za. No hand-delivered, faxed, or emailed applications will be accepted. For assistance with online applications please email your query to healthjobqueries@gauteng.gov.za. NB: Where Driver\u2019s Licence is mandatory, exception will be granted for people with disabilities. Application should be accompanied by a fully completed and signed new Z83 application form obtainable from any Public Service Department or on the internet at www.dpsa.gov.za/documents plus a recently updated comprehensive Curriculum Vitae (CV). Applications without proof of a new Z83 application form and detailed CV will be disqualified. (Shortlisted candidates will receive communication from HR to submit certified copies of educational qualifications and other relevant documents not older than 6 months on or before the day of the interview). It is the applicant\u2019s responsibility to have foreign qualifications evaluated by the South African Qualifications Authority (SAQA). All foreign qualification must be accompanied by evaluation certificate from the South African Qualification Authority (SAQA). Correspondence will only be limited to shortlisted candidates. Suitable candidates will be subjected to a personnel suitability check (criminal record, citizenship, credit record checks, qualification verification and employment verification). Where applicable, candidates will be subjected to a skills/knowledge test. The recommended candidate may be subjected to Medical Surveillance as required by the Occupational Health and Safety Act, Act 5/1993. It is Department\u2019s intention to promote representivity (race, gender, and disability) in the Public Service through the filling of these posts. The Department reserves the right not to appoint/fill this post. WOMEN AND PEOPLE WITH DISABILITY ARE ENCOURAGED TO APPLY.\n\nEmployer : Department of Health\n\nLocation : Leratong Hospital\n\nClosing Date : 16-01-2026\n\n\n\nCriteria Questions\nDo you have a grade 10 with at least 3 - 5 years\u2019 experience in a foodservice unit or Grade 12 or higher with 2 \u2013 4 years\u2019 experience in a foodservice unit?\nDo you have basic computer literacy?\n\n\n\nPlease Notes :\n\nDue to the large number of applications we envisage receiving, applications will not be acknowledged. If you do not receive any response within 3 months, please accept that your application was not successful.\n\n\nFind us\nAddress\n75 Fox Street, Mashalltown\nJohannesburg\n2000\n\nCall us\n\nPhone\n080 022 8827\nEmail\nsupport@gauteng.gov.za\n\nQuick Links\nAll Jobs\nAbout Us\n\n\u00a9 Gauteng Provincial Government 2026 . Powered by Department of e-Government"
  },
  {
    "position": "FOREMAN/SUPERVISORS LEVEL 4",
    "location": "Leratong Hospital",
    "package": "R 193 359.00 per annum (Plus Benefits)",
    "closing_date": "2026/01/16",
    "link": "https://jobs.gauteng.gov.za/Public/ViewJob.aspx?u=57glvgJbW+LpvK/l/L6tYw==",
    "title": "FOREMAN/SUPERVISORS LEVEL 4",
    "reference_number": "REFS/034955",
    "directorate": "CLEANING DEPARTMENT",
    "centre": "Leratong Hospital",
    "package_detail": "R 193 359.00 per annum (Plus Benefits)",
    "closing_date_detail": "16-01-2026",
    "enquiries": "Ms N Serobatse (011) 411-3563 / Ms M Mabiletse (011)411-3677",
    "requirements": "Grade 12 or equivalent with 3-5 years in cleaning department. Microsoft package. Supervisory skills. Knowledge of occupational health and safety act, infection control and other legislative prescripts that govern the public sector.",
    "duties": "Allocation of cleaners in every unit, conduct spot checks in every unit to ensure a clean and hygienic environment. Ensure availability of cleaning chemicals, consumables and equipment. Ensure that medical/general waste is removed from the units to central storage. Liaise with external stakeholders for collection of waste. Ensure that cleaning is performed twice per and when a need arises. Ensure replenishing of consumables in the bathrooms, public toilets. Compile and presents sectional reports, ensure performance of staff. Ensure timeous submission of documents. Compile a checklist and ensure compliance to it. Ensure adherence to the work schedule. Ensure that cleaners report on duty, perform their duties as expected and leave at the appropriate time. Put measures against extended tea/lunch breaks. Be able to perform any other duties as requested by the supervisor.",
    "notes": "Applications should be submitted strictly online at the following E-Recruitment portal: http://jobs.gauteng.gov.za. No hand-delivered, faxed, or emailed applications will be accepted. For assistance with online applications please email your query to healthjobqueries@gauteng.gov.za. NB: Where Driver\u2019s Licence is mandatory, exception will be granted for people with disabilities. Application should be accompanied by a fully completed and signed new Z83 application form obtainable from any Public Service Department or on the internet at www.dpsa.gov.za/documents plus a recently updated comprehensive Curriculum Vitae (CV). Applications without proof of a new Z83 application form and detailed CV will be disqualified. (Shortlisted candidates will receive communication from HR to submit certified copies of educational qualifications and other relevant documents not older than 6 months on or before the day of the interview). It is the applicant\u2019s responsibility to have foreign qualifications evaluated by the South African Qualifications Authority (SAQA). All foreign qualification must be accompanied by evaluation certificate from the South African Qualification Authority (SAQA). Correspondence will only be limited to shortlisted candidates. Suitable candidates will be subjected to a personnel suitability check (criminal record, citizenship, credit record checks, qualification verification and employment verification). Where applicable, candidates will be subjected to a skills/knowledge test. The recommended candidate may be subjected to Medical Surveillance as required by the Occupational Health and Safety Act, Act 5/1993. It is Department\u2019s intention to promote representivity (race, gender, and disability) in the Public Service through the filling of these posts. The Department reserves the right not to appoint/fill this post. WOMEN AND PEOPLE WITH DISABILITY ARE ENCOURAGED TO APPLY.",
    "full_text": "HOME\nJOBS\nABOUT US\nACCOUNT\n\n\n\nJob Details\nDepartment of Health\nFOREMAN/SUPERVISORS LEVEL 4\nReference Number : REFS/034955\nDirectorate : CLEANING DEPARTMENT\nNumber of Posts : 3\nPackage : R 193 359.00 per annum (Plus Benefits)\nEnquiries : Ms N Serobatse (011) 411-3563 / Ms M Mabiletse (011)411-3677\n\nRequirements :\n\nGrade 12 or equivalent with 3-5 years in cleaning department. Microsoft package. Supervisory skills. Knowledge of occupational health and safety act, infection control and other legislative prescripts that govern the public sector.\n\nDuties :\n\nAllocation of cleaners in every unit, conduct spot checks in every unit to ensure a clean and hygienic environment. Ensure availability of cleaning chemicals, consumables and equipment. Ensure that medical/general waste is removed from the units to central storage. Liaise with external stakeholders for collection of waste. Ensure that cleaning is performed twice per and when a need arises. Ensure replenishing of consumables in the bathrooms, public toilets. Compile and presents sectional reports, ensure performance of staff. Ensure timeous submission of documents. Compile a checklist and ensure compliance to it. Ensure adherence to the work schedule. Ensure that cleaners report on duty, perform their duties as expected and leave at the appropriate time. Put measures against extended tea/lunch breaks. Be able to perform any other duties as requested by the supervisor.\n\nNotes :\n\nApplications should be submitted strictly online at the following E-Recruitment portal: http://jobs.gauteng.gov.za. No hand-delivered, faxed, or emailed applications will be accepted. For assistance with online applications please email your query to healthjobqueries@gauteng.gov.za. NB: Where Driver\u2019s Licence is mandatory, exception will be granted for people with disabilities. Application should be accompanied by a fully completed and signed new Z83 application form obtainable from any Public Service Department or on the internet at www.dpsa.gov.za/documents plus a recently updated comprehensive Curriculum Vitae (CV). Applications without proof of a new Z83 application form and detailed CV will be disqualified. (Shortlisted candidates will receive communication from HR to submit certified copies of educational qualifications and other relevant documents not older than 6 months on or before the day of the interview). It is the applicant\u2019s responsibility to have foreign qualifications evaluated by the South African Qualifications Authority (SAQA). All foreign qualification must be accompanied by evaluation certificate from the South African Qualification Authority (SAQA). Correspondence will only be limited to shortlisted candidates. Suitable candidates will be subjected to a personnel suitability check (criminal record, citizenship, credit record checks, qualification verification and employment verification). Where applicable, candidates will be subjected to a skills/knowledge test. The recommended candidate may be subjected to Medical Surveillance as required by the Occupational Health and Safety Act, Act 5/1993. It is Department\u2019s intention to promote representivity (race, gender, and disability) in the Public Service through the filling of these posts. The Department reserves the right not to appoint/fill this post. WOMEN AND PEOPLE WITH DISABILITY ARE ENCOURAGED TO APPLY.\n\nEmployer : Department of Health\n\nLocation : Leratong Hospital\n\nClosing Date : 16-01-2026\n\n\n\nCriteria Questions\nDo you have a grade 12 or equivalent with 3-5 years in cleaning department?\nDo you have supervisory skills?\n\n\n\nPlease Notes :\n\nDue to the large number of applications we envisage receiving, applications will not be acknowledged. If you do not receive any response within 3 months, please accept that your application was not successful.\n\n\nFind us\nAddress\n75 Fox Street, Mashalltown\nJohannesburg\n2000\n\nCall us\n\nPhone\n080 022 8827\nEmail\nsupport@gauteng.gov.za\n\nQuick Links\nAll Jobs\nAbout Us\n\n\u00a9 Gauteng Provincial Government 2026 . Powered by Department of e-Government"
  },
  {
    "position": "LOGISTICS OFFICER LEVEL 7",
    "location": "Leratong Hospital",
    "package": "R 325 101.00 PER ANNUM (PLUS BENEFITS)",
    "closing_date": "2026/01/16",
    "link": "https://jobs.gauteng.gov.za/Public/ViewJob.aspx?u=57glvgJbW+IrZt+Cf0voxQ==",
    "title": "LOGISTICS OFFICER LEVEL 7",
    "reference_number": "REFS/034954",
    "directorate": "CLEANING DEPARTMENT",
    "centre": "Leratong Hospital",
    "package_detail": "R 325 101.00 PER ANNUM (PLUS BENEFITS)",
    "closing_date_detail": "16-01-2026",
    "enquiries": "Ms N Serobatse (011) 411-3563 / Ms M Mabiletse (011)411-3677",
    "requirements": "Grade 12 or equivalent with 3-5years as a supervisor in cleaning department. A National Diploma (NQF level 6/7) in Public Management/Administration, Business administration, Logistics management will be an added advantage. Must have computer skills. Departmental policies procedures, public finance management act. Basic knowledge of legislations, project management, Batho Pele Principles, planning, organising. Understanding of infection control and occupational health and safety.",
    "duties": "Supervise the foreman/ supervisors in cleaning department. Ensure allocation of cleaners in every unit, ensure availability of cleaning chemicals and equipment. Conduct spot checks in every unit to ensure a clean and hygienic environment. Ensure that high dusting and scrub downs are performed. Ensure that fogging is done when requested. Ensure collection of medical and medical waste from the units, ensure cleanliness of the central storage. Ensure performance management of staff, compile and present reports for cleaning department. Checking compliance with signing of attendance register and checklist in different units. Be able to perform any other duties as requested by the supervisor.",
    "notes": "Applications should be submitted strictly online at the following E-Recruitment portal: http://jobs.gauteng.gov.za. No hand-delivered, faxed, or emailed applications will be accepted. For assistance with online applications please email your query to healthjobqueries@gauteng.gov.za. NB: Where Driver\u2019s Licence is mandatory, exception will be granted for people with disabilities. Application should be accompanied by a fully completed and signed new Z83 application form obtainable from any Public Service Department or on the internet at www.dpsa.gov.za/documents plus a recently updated comprehensive Curriculum Vitae (CV). Applications without proof of a new Z83 application form and detailed CV will be disqualified. (Shortlisted candidates will receive communication from HR to submit certified copies of educational qualifications and other relevant documents not older than 6 months on or before the day of the interview). It is the applicant\u2019s responsibility to have foreign qualifications evaluated by the South African Qualifications Authority (SAQA). All foreign qualification must be accompanied by evaluation certificate from the South African Qualification Authority (SAQA). Correspondence will only be limited to shortlisted candidates. Suitable candidates will be subjected to a personnel suitability check (criminal record, citizenship, credit record checks, qualification verification and employment verification). Where applicable, candidates will be subjected to a skills/knowledge test. The recommended candidate may be subjected to Medical Surveillance as required by the Occupational Health and Safety Act, Act 5/1993. It is Department\u2019s intention to promote representivity (race, gender, and disability) in the Public Service through the filling of these posts. The Department reserves the right not to appoint/fill this post. WOMEN AND PEOPLE WITH DISABILITY ARE ENCOURAGED TO APPLY.",
    "full_text": "HOME\nJOBS\nABOUT US\nACCOUNT\n\n\n\nJob Details\nDepartment of Health\nLOGISTICS OFFICER LEVEL 7\nReference Number : REFS/034954\nDirectorate : CLEANING DEPARTMENT\nNumber of Posts : 1\nPackage : R 325 101.00 PER ANNUM (PLUS BENEFITS)\nEnquiries : Ms N Serobatse (011) 411-3563 / Ms M Mabiletse (011)411-3677\n\nRequirements :\n\nGrade 12 or equivalent with 3-5years as a supervisor in cleaning department. A National Diploma (NQF level 6/7) in Public Management/Administration, Business administration, Logistics management will be an added advantage. Must have computer skills. Departmental policies procedures, public finance management act. Basic knowledge of legislations, project management, Batho Pele Principles, planning, organising. Understanding of infection control and occupational health and safety.\n\nDuties :\n\nSupervise the foreman/ supervisors in cleaning department. Ensure allocation of cleaners in every unit, ensure availability of cleaning chemicals and equipment. Conduct spot checks in every unit to ensure a clean and hygienic environment. Ensure that high dusting and scrub downs are performed. Ensure that fogging is done when requested. Ensure collection of medical and medical waste from the units, ensure cleanliness of the central storage. Ensure performance management of staff, compile and present reports for cleaning department. Checking compliance with signing of attendance register and checklist in different units. Be able to perform any other duties as requested by the supervisor.\n\nNotes :\n\nApplications should be submitted strictly online at the following E-Recruitment portal: http://jobs.gauteng.gov.za. No hand-delivered, faxed, or emailed applications will be accepted. For assistance with online applications please email your query to healthjobqueries@gauteng.gov.za. NB: Where Driver\u2019s Licence is mandatory, exception will be granted for people with disabilities. Application should be accompanied by a fully completed and signed new Z83 application form obtainable from any Public Service Department or on the internet at www.dpsa.gov.za/documents plus a recently updated comprehensive Curriculum Vitae (CV). Applications without proof of a new Z83 application form and detailed CV will be disqualified. (Shortlisted candidates will receive communication from HR to submit certified copies of educational qualifications and other relevant documents not older than 6 months on or before the day of the interview). It is the applicant\u2019s responsibility to have foreign qualifications evaluated by the South African Qualifications Authority (SAQA). All foreign qualification must be accompanied by evaluation certificate from the South African Qualification Authority (SAQA). Correspondence will only be limited to shortlisted candidates. Suitable candidates will be subjected to a personnel suitability check (criminal record, citizenship, credit record checks, qualification verification and employment verification). Where applicable, candidates will be subjected to a skills/knowledge test. The recommended candidate may be subjected to Medical Surveillance as required by the Occupational Health and Safety Act, Act 5/1993. It is Department\u2019s intention to promote representivity (race, gender, and disability) in the Public Service through the filling of these posts. The Department reserves the right not to appoint/fill this post. WOMEN AND PEOPLE WITH DISABILITY ARE ENCOURAGED TO APPLY.\n\nEmployer : Department of Health\n\nLocation : Leratong Hospital\n\nClosing Date : 16-01-2026\n\n\n\nCriteria Questions\nDo you have a grade 12 or equivalent with 3-5years as a supervisor in cleaning department?\nDo you have computer skills?\n\n\n\nPlease Notes :\n\nDue to the large number of applications we envisage receiving, applications will not be acknowledged. If you do not receive any response within 3 months, please accept that your application was not successful.\n\n\nFind us\nAddress\n75 Fox Street, Mashalltown\nJohannesburg\n2000\n\nCall us\n\nPhone\n080 022 8827\nEmail\nsupport@gauteng.gov.za\n\nQuick Links\nAll Jobs\nAbout Us\n\n\u00a9 Gauteng Provincial Government 2026 . Powered by Department of e-Government"
  },
  {
    "position": "LOGISTICS OFFICER LEVEL 7",
    "location": "Leratong Hospital",
    "package": "R 325 101.00 PER ANNUM (PLUS BENEFITS)",
    "closing_date": "2026/01/16",
    "link": "https://jobs.gauteng.gov.za/Public/ViewJob.aspx?u=57glvgJbW+K7Zb+sThOpig==",
    "title": "LOGISTICS OFFICER LEVEL 7",
    "reference_number": "REFS/034953",
    "directorate": "TRANSPORT",
    "centre": "Leratong Hospital",
    "package_detail": "R 325 101.00 PER ANNUM (PLUS BENEFITS)",
    "closing_date_detail": "16-01-2026",
    "enquiries": "Ms N Serobatse (011) 411-3563 / Ms M Mabiletse (011)411-3677",
    "requirements": "Grade 12 or equivalent with 3-5 years in transport department. A National Diploma (NQF level 6/7) in public management/ administration, Business administration, Logistics management or Fleet management will be added advantage Computer skills (Micro soft office). Valid code 10/14 Drivers licence with valid PDP. Good understanding of relevant legislations and prescripts. Departmental policies procedures, public finance management act. Basic knowledge of legislations, project management, Batho Pele Principles, planning, organising and Departmental transport handbook.",
    "duties": "Plan and allocate trips for the drivers, ensure compliance with pre and post trip inspections. Ensure that cars are used for official trips only staff and patients. Ensure cleanliness of vehicles. Ensure availability of drivers and collection of stock. Draft compliant off duties for staff. Attend weekly/monthly meetings. Book for cars when they are due for repairs/maintenance. Liaise with G-Fleet when it is time to replace vehicles, report any damages and losses to G-fleet. Follow up on traffic fines and allocate them to relevant individuals. Put measures that are in line with the departmental policies to prevent misuse of vehicles and petrol cards. Ensure performance management of staff, compile and present reports for transport department. Be able to perform any other duties as requested by the supervisor.",
    "notes": "Applications should be submitted strictly online at the following E-Recruitment portal: http://jobs.gauteng.gov.za. No hand-delivered, faxed, or emailed applications will be accepted. For assistance with online applications please email your query to healthjobqueries@gauteng.gov.za. NB: Where Driver\u2019s Licence is mandatory, exception will be granted for people with disabilities. Application should be accompanied by a fully completed and signed new Z83 application form obtainable from any Public Service Department or on the internet at www.dpsa.gov.za/documents plus a recently updated comprehensive Curriculum Vitae (CV). Applications without proof of a new Z83 application form and detailed CV will be disqualified. (Shortlisted candidates will receive communication from HR to submit certified copies of educational qualifications and other relevant documents not older than 6 months on or before the day of the interview). It is the applicant\u2019s responsibility to have foreign qualifications evaluated by the South African Qualifications Authority (SAQA). All foreign qualification must be accompanied by evaluation certificate from the South African Qualification Authority (SAQA). Correspondence will only be limited to shortlisted candidates. Suitable candidates will be subjected to a personnel suitability check (criminal record, citizenship, credit record checks, qualification verification and employment verification). Where applicable, candidates will be subjected to a skills/knowledge test. The recommended candidate may be subjected to Medical Surveillance as required by the Occupational Health and Safety Act, Act 5/1993. It is Department\u2019s intention to promote representivity (race, gender, and disability) in the Public Service through the filling of these posts. The Department reserves the right not to appoint/fill this post. WOMEN AND PEOPLE WITH DISABILITY ARE ENCOURAGED TO APPLY.",
    "full_text": "HOME\nJOBS\nABOUT US\nACCOUNT\n\n\n\nJob Details\nDepartment of Health\nLOGISTICS OFFICER LEVEL 7\nReference Number : REFS/034953\nDirectorate : TRANSPORT\nNumber of Posts : 1\nPackage : R 325 101.00 PER ANNUM (PLUS BENEFITS)\nEnquiries : Ms N Serobatse (011) 411-3563 / Ms M Mabiletse (011)411-3677\n\nRequirements :\n\nGrade 12 or equivalent with 3-5 years in transport department. A National Diploma (NQF level 6/7) in public management/ administration, Business administration, Logistics management or Fleet management will be added advantage Computer skills (Micro soft office). Valid code 10/14 Drivers licence with valid PDP. Good understanding of relevant legislations and prescripts. Departmental policies procedures, public finance management act. Basic knowledge of legislations, project management, Batho Pele Principles, planning, organising and Departmental transport handbook.\n\nDuties :\n\nPlan and allocate trips for the drivers, ensure compliance with pre and post trip inspections. Ensure that cars are used for official trips only staff and patients. Ensure cleanliness of vehicles. Ensure availability of drivers and collection of stock. Draft compliant off duties for staff. Attend weekly/monthly meetings. Book for cars when they are due for repairs/maintenance. Liaise with G-Fleet when it is time to replace vehicles, report any damages and losses to G-fleet. Follow up on traffic fines and allocate them to relevant individuals. Put measures that are in line with the departmental policies to prevent misuse of vehicles and petrol cards. Ensure performance management of staff, compile and present reports for transport department. Be able to perform any other duties as requested by the supervisor.\n\nNotes :\n\nApplications should be submitted strictly online at the following E-Recruitment portal: http://jobs.gauteng.gov.za. No hand-delivered, faxed, or emailed applications will be accepted. For assistance with online applications please email your query to healthjobqueries@gauteng.gov.za. NB: Where Driver\u2019s Licence is mandatory, exception will be granted for people with disabilities. Application should be accompanied by a fully completed and signed new Z83 application form obtainable from any Public Service Department or on the internet at www.dpsa.gov.za/documents plus a recently updated comprehensive Curriculum Vitae (CV). Applications without proof of a new Z83 application form and detailed CV will be disqualified. (Shortlisted candidates will receive communication from HR to submit certified copies of educational qualifications and other relevant documents not older than 6 months on or before the day of the interview). It is the applicant\u2019s responsibility to have foreign qualifications evaluated by the South African Qualifications Authority (SAQA). All foreign qualification must be accompanied by evaluation certificate from the South African Qualification Authority (SAQA). Correspondence will only be limited to shortlisted candidates. Suitable candidates will be subjected to a personnel suitability check (criminal record, citizenship, credit record checks, qualification verification and employment verification). Where applicable, candidates will be subjected to a skills/knowledge test. The recommended candidate may be subjected to Medical Surveillance as required by the Occupational Health and Safety Act, Act 5/1993. It is Department\u2019s intention to promote representivity (race, gender, and disability) in the Public Service through the filling of these posts. The Department reserves the right not to appoint/fill this post. WOMEN AND PEOPLE WITH DISABILITY ARE ENCOURAGED TO APPLY.\n\nEmployer : Department of Health\n\nLocation : Leratong Hospital\n\nClosing Date : 16-01-2026\n\n\n\nCriteria Questions\nDo you have a grade 12 or equivalent with 3-5 years in transport department?\nDo you have valid code 10/14 Drivers licence with valid PDP?\n\n\n\nPlease Notes :\n\nDue to the large number of applications we envisage receiving, applications will not be acknowledged. If you do not receive any response within 3 months, please accept that your application was not successful.\n\n\nFind us\nAddress\n75 Fox Street, Mashalltown\nJohannesburg\n2000\n\nCall us\n\nPhone\n080 022 8827\nEmail\nsupport@gauteng.gov.za\n\nQuick Links\nAll Jobs\nAbout Us\n\n\u00a9 Gauteng Provincial Government 2026 . Powered by Department of e-Government"
  },
  {
    "position": "COMMUNICATIONS OFFICER LEVEL 7",
    "location": "Leratong Hospital",
    "package": "R 325 101.00 PER ANNUM (PLUS BENEFITS)",
    "closing_date": "2026/01/16",
    "link": "https://jobs.gauteng.gov.za/Public/ViewJob.aspx?u=57glvgJbW+IsVHrUSAaGMw==",
    "title": "COMMUNICATIONS OFFICER LEVEL 7",
    "reference_number": "REFS/034952",
    "directorate": "ADMINISTRATION -COMMUNICATIONS",
    "centre": "Leratong Hospital",
    "package_detail": "R 325 101.00 PER ANNUM (PLUS BENEFITS)",
    "closing_date_detail": "16-01-2026",
    "enquiries": "Ms N Serobatse (011) 411-3563 / Ms M Mabiletse (011)411-3677",
    "requirements": "Grade 12 and a National Diploma (NQF level 6/7) in Public Management/ Administration, Communications, Journalism, Marketing, Business administration with 3-5 years in Communications environment. Computer skills (Microsoft office) Driver\u2019s licence will be an added advantage. Good understanding of relevant legislations and prescripts. Excellent communication skills (verbal and written) Understanding of the media environment. Research, scripting, content management, editing, proof reading and project management skills. Must be able to meet deadlines and work extra hours when a need arises. Departmental policies procedures, public finance management act. Basic knowledge of legislations, project management, Batho Pele Principles, planning and organising, event management.",
    "duties": "Provide an effective communication support service to the institution. Implement and assist with design, layout and cover concepts for departmental reports. Develop and implement creative concepts and products for departmental campaigns, projects, events, events invitations, exhibitions, branding of promotional items. Develop and implement multimedia content, including photographs and digital publications. Provide advice and ensure correct application of the logo in line with the prescripts. Archiving all visuals and publication produced. Manage the social media page for the hospital. Ensure development and implementation of the communication strategy that is in line with strategic objective of the department. Support program coordinators to facilitate functions within the hospital. Co-lead all internal and external communication initiatives of the institution. Ensure production of hospital newsletter and electronic website. Write regular opinion pieces for the institution. Forge relationship with media houses and other stakeholders. Ensure performance management of staff, compile and present reports for transport department. Attend weekly/monthly meetings Be a secretary for the hospital board and participate in various committees. Be responsible for personnel performance evaluation (PMDS) within regulated timelines and monitoring of attendance. Perform any other lawful duties as delegated by next level Supervisor.",
    "notes": "Applications should be submitted strictly online at the following E-Recruitment portal: http://jobs.gauteng.gov.za. No hand-delivered, faxed, or emailed applications will be accepted. For assistance with online applications please email your query to healthjobqueries@gauteng.gov.za. NB: Where Driver\u2019s Licence is mandatory, exception will be granted for people with disabilities. Application should be accompanied by a fully completed and signed new Z83 application form obtainable from any Public Service Department or on the internet at www.dpsa.gov.za/documents plus a recently updated comprehensive Curriculum Vitae (CV). Applications without proof of a new Z83 application form and detailed CV will be disqualified. (Shortlisted candidates will receive communication from HR to submit certified copies of educational qualifications and other relevant documents not older than 6 months on or before the day of the interview). It is the applicant\u2019s responsibility to have foreign qualifications evaluated by the South African Qualifications Authority (SAQA). All foreign qualification must be accompanied by evaluation certificate from the South African Qualification Authority (SAQA). Correspondence will only be limited to shortlisted candidates. Suitable candidates will be subjected to a personnel suitability check (criminal record, citizenship, credit record checks, qualification verification and employment verification). Where applicable, candidates will be subjected to a skills/knowledge test. The recommended candidate may be subjected to Medical Surveillance as required by the Occupational Health and Safety Act, Act 5/1993. It is Department\u2019s intention to promote representivity (race, gender, and disability) in the Public Service through the filling of these posts. The Department reserves the right not to appoint/fill this post. WOMEN AND PEOPLE WITH DISABILITY ARE ENCOURAGED TO APPLY.",
    "full_text": "HOME\nJOBS\nABOUT US\nACCOUNT\n\n\n\nJob Details\nDepartment of Health\nCOMMUNICATIONS OFFICER LEVEL 7\nReference Number : REFS/034952\nDirectorate : ADMINISTRATION -COMMUNICATIONS\nNumber of Posts : 1\nPackage : R 325 101.00 PER ANNUM (PLUS BENEFITS)\nEnquiries : Ms N Serobatse (011) 411-3563 / Ms M Mabiletse (011)411-3677\n\nRequirements :\n\nGrade 12 and a National Diploma (NQF level 6/7) in Public Management/ Administration, Communications, Journalism, Marketing, Business administration with 3-5 years in Communications environment. Computer skills (Microsoft office) Driver\u2019s licence will be an added advantage. Good understanding of relevant legislations and prescripts. Excellent communication skills (verbal and written) Understanding of the media environment. Research, scripting, content management, editing, proof reading and project management skills. Must be able to meet deadlines and work extra hours when a need arises. Departmental policies procedures, public finance management act. Basic knowledge of legislations, project management, Batho Pele Principles, planning and organising, event management.\n\nDuties :\n\nProvide an effective communication support service to the institution. Implement and assist with design, layout and cover concepts for departmental reports. Develop and implement creative concepts and products for departmental campaigns, projects, events, events invitations, exhibitions, branding of promotional items. Develop and implement multimedia content, including photographs and digital publications. Provide advice and ensure correct application of the logo in line with the prescripts. Archiving all visuals and publication produced. Manage the social media page for the hospital. Ensure development and implementation of the communication strategy that is in line with strategic objective of the department. Support program coordinators to facilitate functions within the hospital. Co-lead all internal and external communication initiatives of the institution. Ensure production of hospital newsletter and electronic website. Write regular opinion pieces for the institution. Forge relationship with media houses and other stakeholders. Ensure performance management of staff, compile and present reports for transport department. Attend weekly/monthly meetings Be a secretary for the hospital board and participate in various committees. Be responsible for personnel performance evaluation (PMDS) within regulated timelines and monitoring of attendance. Perform any other lawful duties as delegated by next level Supervisor.\n\nNotes :\n\nApplications should be submitted strictly online at the following E-Recruitment portal: http://jobs.gauteng.gov.za. No hand-delivered, faxed, or emailed applications will be accepted. For assistance with online applications please email your query to healthjobqueries@gauteng.gov.za. NB: Where Driver\u2019s Licence is mandatory, exception will be granted for people with disabilities. Application should be accompanied by a fully completed and signed new Z83 application form obtainable from any Public Service Department or on the internet at www.dpsa.gov.za/documents plus a recently updated comprehensive Curriculum Vitae (CV). Applications without proof of a new Z83 application form and detailed CV will be disqualified. (Shortlisted candidates will receive communication from HR to submit certified copies of educational qualifications and other relevant documents not older than 6 months on or before the day of the interview). It is the applicant\u2019s responsibility to have foreign qualifications evaluated by the South African Qualifications Authority (SAQA). All foreign qualification must be accompanied by evaluation certificate from the South African Qualification Authority (SAQA). Correspondence will only be limited to shortlisted candidates. Suitable candidates will be subjected to a personnel suitability check (criminal record, citizenship, credit record checks, qualification verification and employment verification). Where applicable, candidates will be subjected to a skills/knowledge test. The recommended candidate may be subjected to Medical Surveillance as required by the Occupational Health and Safety Act, Act 5/1993. It is Department\u2019s intention to promote representivity (race, gender, and disability) in the Public Service through the filling of these posts. The Department reserves the right not to appoint/fill this post. WOMEN AND PEOPLE WITH DISABILITY ARE ENCOURAGED TO APPLY.\n\nEmployer : Department of Health\n\nLocation : Leratong Hospital\n\nClosing Date : 16-01-2026\n\n\n\nCriteria Questions\nDo you have a grade 12 and a National Diploma (NQF level 6/7) in Public Management/ Administration, Communications, Journalism, Marketing, Business administration?\nDo you have 3-5 years in Communications environment?\n\n\n\nPlease Notes :\n\nDue to the large number of applications we envisage receiving, applications will not be acknowledged. If you do not receive any response within 3 months, please accept that your application was not successful.\n\n\nFind us\nAddress\n75 Fox Street, Mashalltown\nJohannesburg\n2000\n\nCall us\n\nPhone\n080 022 8827\nEmail\nsupport@gauteng.gov.za\n\nQuick Links\nAll Jobs\nAbout Us\n\n\u00a9 Gauteng Provincial Government 2026 . Powered by Department of e-Government"
  },
  {
    "position": "SENIOR ADMIN LEVEL 7",
    "location": "Leratong Hospital",
    "package": "R 325 101.00 PER ANNUM (PLUS BENEFITS",
    "closing_date": "2026/01/16",
    "link": "https://jobs.gauteng.gov.za/Public/ViewJob.aspx?u=57glvgJbW+JdtKV/eG3AIA==",
    "title": "SENIOR ADMIN LEVEL 7",
    "reference_number": "REFS/034951",
    "directorate": "OFFICE OF THE CEO",
    "centre": "Leratong Hospital",
    "package_detail": "R 325 101.00 PER ANNUM (PLUS BENEFITS",
    "closing_date_detail": "16-01-2026",
    "enquiries": "Ms N Serobatse (011) 411-3563 / Ms M Mabiletse (011)411-3677",
    "requirements": "Grade 12 or equivalent with NQF level 6/7 in office management, management assistant, secretarial, public management/administration. Microsoft package qualification. Proficient user of Microsoft suites, candidates will be subjected to a competency test. 5 years\u2019 experience rendering support to senior management. Driver\u2019s licence will be an added advantage (valid code8/10) Ability to operate office equipment. Knowledge of relevant legislation, policies, prescripts and procedures. Ability to manage senior management offices. Good telephone etiquette and ability to communicate well with people at different levels. Strong communication skills written and verbal.",
    "duties": "Provide secretariat/administrative functions to the office of the CEO. Manage the diary of the CEO. Receive visitors for the office of the CEO. Arrange refreshments for the office of the CEO. Receive and screen calls directed to the CEO. Provide support to the office of the CEO regarding meetings, respond to enquiries received from internal/external stakeholders, direct enquiries to relevant managers for response and follow up. Compile minutes during meetings and share with relevant stakeholders, Compile/consolidate reports for the office of the CEO. Perform any other duties as requested by the manager.",
    "notes": "Applications should be submitted strictly online at the following E-Recruitment portal: http://jobs.gauteng.gov.za. No hand-delivered, faxed, or emailed applications will be accepted. For assistance with online applications please email your query to healthjobqueries@gauteng.gov.za. NB: Where Driver\u2019s Licence is mandatory, exception will be granted for people with disabilities. Application should be accompanied by a fully completed and signed new Z83 application form obtainable from any Public Service Department or on the internet at www.dpsa.gov.za/documents plus a recently updated comprehensive Curriculum Vitae (CV). Applications without proof of a new Z83 application form and detailed CV will be disqualified. (Shortlisted candidates will receive communication from HR to submit certified copies of educational qualifications and other relevant documents not older than 6 months on or before the day of the interview). It is the applicant\u2019s responsibility to have foreign qualifications evaluated by the South African Qualifications Authority (SAQA). All foreign qualification must be accompanied by evaluation certificate from the South African Qualification Authority (SAQA). Correspondence will only be limited to shortlisted candidates. Suitable candidates will be subjected to a personnel suitability check (criminal record, citizenship, credit record checks, qualification verification and employment verification). Where applicable, candidates will be subjected to a skills/knowledge test. The recommended candidate may be subjected to Medical Surveillance as required by the Occupational Health and Safety Act, Act 5/1993. It is Department\u2019s intention to promote representivity (race, gender, and disability) in the Public Service through the filling of these posts. The Department reserves the right not to appoint/fill this post. WOMEN AND PEOPLE WITH DISABILITY ARE ENCOURAGED TO APPLY.",
    "full_text": "HOME\nJOBS\nABOUT US\nACCOUNT\n\n\n\nJob Details\nDepartment of Health\nSENIOR ADMIN LEVEL 7\nReference Number : REFS/034951\nDirectorate : OFFICE OF THE CEO\nNumber of Posts : 1\nPackage : R 325 101.00 PER ANNUM (PLUS BENEFITS\nEnquiries : Ms N Serobatse (011) 411-3563 / Ms M Mabiletse (011)411-3677\n\nRequirements :\n\nGrade 12 or equivalent with NQF level 6/7 in office management, management assistant, secretarial, public management/administration. Microsoft package qualification. Proficient user of Microsoft suites, candidates will be subjected to a competency test. 5 years\u2019 experience rendering support to senior management. Driver\u2019s licence will be an added advantage (valid code8/10) Ability to operate office equipment. Knowledge of relevant legislation, policies, prescripts and procedures. Ability to manage senior management offices. Good telephone etiquette and ability to communicate well with people at different levels. Strong communication skills written and verbal.\n\nDuties :\n\nProvide secretariat/administrative functions to the office of the CEO. Manage the diary of the CEO. Receive visitors for the office of the CEO. Arrange refreshments for the office of the CEO. Receive and screen calls directed to the CEO. Provide support to the office of the CEO regarding meetings, respond to enquiries received from internal/external stakeholders, direct enquiries to relevant managers for response and follow up. Compile minutes during meetings and share with relevant stakeholders, Compile/consolidate reports for the office of the CEO. Perform any other duties as requested by the manager.\n\nNotes :\n\nApplications should be submitted strictly online at the following E-Recruitment portal: http://jobs.gauteng.gov.za. No hand-delivered, faxed, or emailed applications will be accepted. For assistance with online applications please email your query to healthjobqueries@gauteng.gov.za. NB: Where Driver\u2019s Licence is mandatory, exception will be granted for people with disabilities. Application should be accompanied by a fully completed and signed new Z83 application form obtainable from any Public Service Department or on the internet at www.dpsa.gov.za/documents plus a recently updated comprehensive Curriculum Vitae (CV). Applications without proof of a new Z83 application form and detailed CV will be disqualified. (Shortlisted candidates will receive communication from HR to submit certified copies of educational qualifications and other relevant documents not older than 6 months on or before the day of the interview). It is the applicant\u2019s responsibility to have foreign qualifications evaluated by the South African Qualifications Authority (SAQA). All foreign qualification must be accompanied by evaluation certificate from the South African Qualification Authority (SAQA). Correspondence will only be limited to shortlisted candidates. Suitable candidates will be subjected to a personnel suitability check (criminal record, citizenship, credit record checks, qualification verification and employment verification). Where applicable, candidates will be subjected to a skills/knowledge test. The recommended candidate may be subjected to Medical Surveillance as required by the Occupational Health and Safety Act, Act 5/1993. It is Department\u2019s intention to promote representivity (race, gender, and disability) in the Public Service through the filling of these posts. The Department reserves the right not to appoint/fill this post. WOMEN AND PEOPLE WITH DISABILITY ARE ENCOURAGED TO APPLY.\n\nEmployer : Department of Health\n\nLocation : Leratong Hospital\n\nClosing Date : 16-01-2026\n\n\n\nCriteria Questions\nDo you have a grade 12 or equivalent with NQF level 6/7 in office management, management assistant, secretarial, public management/administration?\nDo you have 5 years\u2019 experience rendering support to senior management?\n\n\n\nPlease Notes :\n\nDue to the large number of applications we envisage receiving, applications will not be acknowledged. If you do not receive any response within 3 months, please accept that your application was not successful.\n\n\nFind us\nAddress\n75 Fox Street, Mashalltown\nJohannesburg\n2000\n\nCall us\n\nPhone\n080 022 8827\nEmail\nsupport@gauteng.gov.za\n\nQuick Links\nAll Jobs\nAbout Us\n\n\u00a9 Gauteng Provincial Government 2026 . Powered by Department of e-Government"
  },
  {
    "position": "ASSISTANT DIRECTOR PATIENT AFFAIRS",
    "location": "Leratong Hospital",
    "package": "R 468 459 per annum (Plus Benefits)",
    "closing_date": "2026/01/16",
    "link": "https://jobs.gauteng.gov.za/Public/ViewJob.aspx?u=57glvgJbW+KvaUMf355qUg==",
    "title": "ASSISTANT DIRECTOR PATIENT AFFAIRS",
    "reference_number": "REFS/034950",
    "directorate": "PATIENT AFFAIRS",
    "centre": "Leratong Hospital",
    "package_detail": "R 468 459 per annum (Plus Benefits)",
    "closing_date_detail": "16-01-2026",
    "enquiries": "Ms N Serobatse (011) 411-3563 / Ms M Mabiletse (011)411-3677",
    "requirements": "National Diploma/Degree in Public Management and Administration with 3 years\u2019 supervisory level experience in Patient Affairs. Management and Leadership skills. Ability to interpret and implement the policies, directives and guidelines of the Gauteng Department of Health. Excellent verbal and communication skills. Knowledge and understanding of Patient Affairs scripts. Must be computer literate.",
    "duties": "Responsible for implementation and compilation of the sections operational plans, strategic plans, and quarterly reviews. Ensure proper records keeping through proper interpretation of the Records management policy. Ensure that systems are in place for the management of PAIA requests. Interpretation and implementation of all mortuary prescripts and related guidelines. Ensure that systems are in place to maximize the institution revenue collection. Ensure individual performance is aligned to section strategic objectives. Ensure proper application of Labour Relations Act and Code of Conduct. Ensure submission of accurate and reliable data to senior management.",
    "notes": "Applications should be submitted strictly online at the following E-Recruitment portal: http://jobs.gauteng.gov.za. No hand-delivered, faxed, or emailed applications will be accepted. For assistance with online applications please email your query to healthjobqueries@gauteng.gov.za. NB: Where Driver\u2019s Licence is mandatory, exception will be granted for people with disabilities. Application should be accompanied by a fully completed and signed new Z83 application form obtainable from any Public Service Department or on the internet at www.dpsa.gov.za/documents plus a recently updated comprehensive Curriculum Vitae (CV). Applications without proof of a new Z83 application form and detailed CV will be disqualified. (Shortlisted candidates will receive communication from HR to submit certified copies of educational qualifications and other relevant documents not older than 6 months on or before the day of the interview). It is the applicant\u2019s responsibility to have foreign qualifications evaluated by the South African Qualifications Authority (SAQA). All foreign qualification must be accompanied by evaluation certificate from the South African Qualification Authority (SAQA). Correspondence will only be limited to shortlisted candidates. Suitable candidates will be subjected to a personnel suitability check (criminal record, citizenship, credit record checks, qualification verification and employment verification). Where applicable, candidates will be subjected to a skills/knowledge test. The recommended candidate may be subjected to Medical Surveillance as required by the Occupational Health and Safety Act, Act 5/1993. It is Department\u2019s intention to promote representivity (race, gender, and disability) in the Public Service through the filling of these posts. The Department reserves the right not to appoint/fill this post. WOMEN AND PEOPLE WITH DISABILITY ARE ENCOURAGED TO APPLY.",
    "full_text": "HOME\nJOBS\nABOUT US\nACCOUNT\n\n\n\nJob Details\nDepartment of Health\nASSISTANT DIRECTOR PATIENT AFFAIRS\nReference Number : REFS/034950\nDirectorate : PATIENT AFFAIRS\nNumber of Posts : 1\nPackage : R 468 459 per annum (Plus Benefits)\nEnquiries : Ms N Serobatse (011) 411-3563 / Ms M Mabiletse (011)411-3677\n\nRequirements :\n\nNational Diploma/Degree in Public Management and Administration with 3 years\u2019 supervisory level experience in Patient Affairs. Management and Leadership skills. Ability to interpret and implement the policies, directives and guidelines of the Gauteng Department of Health. Excellent verbal and communication skills. Knowledge and understanding of Patient Affairs scripts. Must be computer literate.\n\nDuties :\n\nResponsible for implementation and compilation of the sections operational plans, strategic plans, and quarterly reviews. Ensure proper records keeping through proper interpretation of the Records management policy. Ensure that systems are in place for the management of PAIA requests. Interpretation and implementation of all mortuary prescripts and related guidelines. Ensure that systems are in place to maximize the institution revenue collection. Ensure individual performance is aligned to section strategic objectives. Ensure proper application of Labour Relations Act and Code of Conduct. Ensure submission of accurate and reliable data to senior management.\n\nNotes :\n\nApplications should be submitted strictly online at the following E-Recruitment portal: http://jobs.gauteng.gov.za. No hand-delivered, faxed, or emailed applications will be accepted. For assistance with online applications please email your query to healthjobqueries@gauteng.gov.za. NB: Where Driver\u2019s Licence is mandatory, exception will be granted for people with disabilities. Application should be accompanied by a fully completed and signed new Z83 application form obtainable from any Public Service Department or on the internet at www.dpsa.gov.za/documents plus a recently updated comprehensive Curriculum Vitae (CV). Applications without proof of a new Z83 application form and detailed CV will be disqualified. (Shortlisted candidates will receive communication from HR to submit certified copies of educational qualifications and other relevant documents not older than 6 months on or before the day of the interview). It is the applicant\u2019s responsibility to have foreign qualifications evaluated by the South African Qualifications Authority (SAQA). All foreign qualification must be accompanied by evaluation certificate from the South African Qualification Authority (SAQA). Correspondence will only be limited to shortlisted candidates. Suitable candidates will be subjected to a personnel suitability check (criminal record, citizenship, credit record checks, qualification verification and employment verification). Where applicable, candidates will be subjected to a skills/knowledge test. The recommended candidate may be subjected to Medical Surveillance as required by the Occupational Health and Safety Act, Act 5/1993. It is Department\u2019s intention to promote representivity (race, gender, and disability) in the Public Service through the filling of these posts. The Department reserves the right not to appoint/fill this post. WOMEN AND PEOPLE WITH DISABILITY ARE ENCOURAGED TO APPLY.\n\nEmployer : Department of Health\n\nLocation : Leratong Hospital\n\nClosing Date : 16-01-2026\n\n\n\nCriteria Questions\nDo you have a National Diploma/Degree in Public Management and Administration?\nDo you have 3 years\u2019 supervisory level experience in Patient Affairs?\n\n\n\nPlease Notes :\n\nDue to the large number of applications we envisage receiving, applications will not be acknowledged. If you do not receive any response within 3 months, please accept that your application was not successful.\n\n\nFind us\nAddress\n75 Fox Street, Mashalltown\nJohannesburg\n2000\n\nCall us\n\nPhone\n080 022 8827\nEmail\nsupport@gauteng.gov.za\n\nQuick Links\nAll Jobs\nAbout Us\n\n\u00a9 Gauteng Provincial Government 2026 . Powered by Department of e-Government"
  },
  {
    "position": "ASSISTANT DIRECTOR FINANCE",
    "location": "Leratong Hospital",
    "package": "R 468 459 per annum (Plus Benefits)",
    "closing_date": "2026/01/16",
    "link": "https://jobs.gauteng.gov.za/Public/ViewJob.aspx?u=E7CSZ5GRR4Ff8zOiCY136Q==",
    "title": "ASSISTANT DIRECTOR FINANCE",
    "reference_number": "refs/034949",
    "directorate": "FINANCE DEPARTMENT",
    "centre": "Leratong Hospital",
    "package_detail": "R 468 459 per annum (Plus Benefits)",
    "closing_date_detail": "16-01-2026",
    "enquiries": "Ms N Serobatse (011) 411-3563 / Ms M Mabiletse (011)411-3677",
    "requirements": "An appropriate NQF level 7 (bachelor\u2019s degree or Advanced Diploma or B tech) qualification in Financial Accounting / Financial management plus 3 years supervisory level experience in Finance. Computer Literacy. Must have a valid driver\u2019s license. Knowledge of relevant Act (PFMA, Treasury Regulations) and systems (BAS, SAP). Interpersonal skills. Communication skills. Good leadership skills. Must be able to plan, organise and co-ordinate activities in the unit. Ability to work under pressure. Team leadership.",
    "duties": "Development of the Finance Department Operational Plan, compile and present quarterly reviews. Effective Financial control and monitoring of current budget and expenditure. Compiling of monthly financial reports. Perform various expenditure monthly reconciliations. Clearing of web cycles (IMS). Management of accruals. Ensure suppliers are paid within 30 days. Attend to suppliers related queries. Assist in the preparations and allocation of budget. Training of staff on finance related matters. Supervision and mentoring of staff. Attend to auditors and develop action plans to improve control and eliminate audit findings. Effective Risk management. Evaluate performance of sub \u2013 ordinates quarterly and annually.",
    "notes": "Applications should be submitted strictly online at the following E-Recruitment portal: http://jobs.gauteng.gov.za. No hand-delivered, faxed, or emailed applications will be accepted. For assistance with online applications please email your query to healthjobqueries@gauteng.gov.za. NB: Where Driver\u2019s Licence is mandatory, exception will be granted for people with disabilities. Application should be accompanied by a fully completed and signed new Z83 application form obtainable from any Public Service Department or on the internet at www.dpsa.gov.za/documents plus a recently updated comprehensive Curriculum Vitae (CV). Applications without proof of a new Z83 application form and detailed CV will be disqualified. (Shortlisted candidates will receive communication from HR to submit certified copies of educational qualifications and other relevant documents not older than 6 months on or before the day of the interview). It is the applicant\u2019s responsibility to have foreign qualifications evaluated by the South African Qualifications Authority (SAQA). All foreign qualification must be accompanied by evaluation certificate from the South African Qualification Authority (SAQA). Correspondence will only be limited to shortlisted candidates. Suitable candidates will be subjected to a personnel suitability check (criminal record, citizenship, credit record checks, qualification verification and employment verification). Where applicable, candidates will be subjected to a skills/knowledge test. The recommended candidate may be subjected to Medical Surveillance as required by the Occupational Health and Safety Act, Act 5/1993. It is Department\u2019s intention to promote representivity (race, gender, and disability) in the Public Service through the filling of these posts. The Department reserves the right not to appoint/fill this post. WOMEN AND PEOPLE WITH DISABILITY ARE ENCOURAGED TO APPLY.",
    "full_text": "HOME\nJOBS\nABOUT US\nACCOUNT\n\n\n\nJob Details\nDepartment of Health\nASSISTANT DIRECTOR FINANCE\nReference Number : refs/034949\nDirectorate : FINANCE DEPARTMENT\nNumber of Posts : 1\nPackage : R 468 459 per annum (Plus Benefits)\nEnquiries : Ms N Serobatse (011) 411-3563 / Ms M Mabiletse (011)411-3677\n\nRequirements :\n\nAn appropriate NQF level 7 (bachelor\u2019s degree or Advanced Diploma or B tech) qualification in Financial Accounting / Financial management plus 3 years supervisory level experience in Finance. Computer Literacy. Must have a valid driver\u2019s license. Knowledge of relevant Act (PFMA, Treasury Regulations) and systems (BAS, SAP). Interpersonal skills. Communication skills. Good leadership skills. Must be able to plan, organise and co-ordinate activities in the unit. Ability to work under pressure. Team leadership.\n\nDuties :\n\nDevelopment of the Finance Department Operational Plan, compile and present quarterly reviews. Effective Financial control and monitoring of current budget and expenditure. Compiling of monthly financial reports. Perform various expenditure monthly reconciliations. Clearing of web cycles (IMS). Management of accruals. Ensure suppliers are paid within 30 days. Attend to suppliers related queries. Assist in the preparations and allocation of budget. Training of staff on finance related matters. Supervision and mentoring of staff. Attend to auditors and develop action plans to improve control and eliminate audit findings. Effective Risk management. Evaluate performance of sub \u2013 ordinates quarterly and annually.\n\nNotes :\n\nApplications should be submitted strictly online at the following E-Recruitment portal: http://jobs.gauteng.gov.za. No hand-delivered, faxed, or emailed applications will be accepted. For assistance with online applications please email your query to healthjobqueries@gauteng.gov.za. NB: Where Driver\u2019s Licence is mandatory, exception will be granted for people with disabilities. Application should be accompanied by a fully completed and signed new Z83 application form obtainable from any Public Service Department or on the internet at www.dpsa.gov.za/documents plus a recently updated comprehensive Curriculum Vitae (CV). Applications without proof of a new Z83 application form and detailed CV will be disqualified. (Shortlisted candidates will receive communication from HR to submit certified copies of educational qualifications and other relevant documents not older than 6 months on or before the day of the interview). It is the applicant\u2019s responsibility to have foreign qualifications evaluated by the South African Qualifications Authority (SAQA). All foreign qualification must be accompanied by evaluation certificate from the South African Qualification Authority (SAQA). Correspondence will only be limited to shortlisted candidates. Suitable candidates will be subjected to a personnel suitability check (criminal record, citizenship, credit record checks, qualification verification and employment verification). Where applicable, candidates will be subjected to a skills/knowledge test. The recommended candidate may be subjected to Medical Surveillance as required by the Occupational Health and Safety Act, Act 5/1993. It is Department\u2019s intention to promote representivity (race, gender, and disability) in the Public Service through the filling of these posts. The Department reserves the right not to appoint/fill this post. WOMEN AND PEOPLE WITH DISABILITY ARE ENCOURAGED TO APPLY.\n\nEmployer : Department of Health\n\nLocation : Leratong Hospital\n\nClosing Date : 16-01-2026\n\n\n\nCriteria Questions\nDo you have an appropriate NQF level 7 (bachelor\u2019s degree or Advanced Diploma or B tech) qualification in Financial Accounting / Financial management ?\nDo you have 3 years supervisory level experience in Finance?\nDo you have a valid driver\u2019s licence?\n\n\n\nPlease Notes :\n\nDue to the large number of applications we envisage receiving, applications will not be acknowledged. If you do not receive any response within 3 months, please accept that your application was not successful.\n\n\nFind us\nAddress\n75 Fox Street, Mashalltown\nJohannesburg\n2000\n\nCall us\n\nPhone\n080 022 8827\nEmail\nsupport@gauteng.gov.za\n\nQuick Links\nAll Jobs\nAbout Us\n\n\u00a9 Gauteng Provincial Government 2026 . Powered by Department of e-Government"
  },
  {
    "position": "MEDICAL OFFICER ANAESTHETICS",
    "location": "Pholosong Regional Hospital",
    "package": "Grade 1: R 949 146 \u2013 R 1 021 911 per annum, (all-inclusive package), Grade 2: R 1 082 988 \u2013 R 1 182 13 per annum, (all-inclusive package), Grade 3: R 1 253 415 \u2013 R 1 561 734 per annum, (all-inclusive package)",
    "closing_date": "2026/01/16",
    "link": "https://jobs.gauteng.gov.za/Public/ViewJob.aspx?u=E7CSZ5GRR4HbIgZ66fa9fw==",
    "title": "MEDICAL OFFICER ANAESTHETICS",
    "reference_number": "refs/034948",
    "directorate": "Medical",
    "centre": "Pholosong Regional Hospital",
    "package_detail": "Grade 1: R 949 146 \u2013 R 1 021 911 per annum, (all-inclusive package), Grade 2: R 1 082 988 \u2013 R 1 182 13 per annum, (all-inclusive package), Grade 3: R 1 253 415 \u2013 R 1 561 734 per annum, (all-inclusive package)",
    "closing_date_detail": "16-01-2026",
    "enquiries": "Dr. N Jwara Tel No- (011) 812 5163",
    "requirements": "Grade 12 plus MBCHB degree registered with HPCSA as a Medical Officer independent practice. With annual registration to practice and registration as a Medical Officer independent practitioner.",
    "duties": "The incumbent will be responsible for interviewing, investigating, diagnosing and overseeing the treatment of patients. Attendance of relevant administrative meeting like mortality meetings, near miss meetings and completing Medico legal documents timeously (e.g. Death certificate). Improving quality of care by providing appropriate clinical care. Reduce medical litigation by exercising good clinical ethos. Implement and monitor adherence to National Core Standards (Norms and Standard). Participating in all activities of the discipline in relations to teaching and research. Participate in multidisciplinary team to the management of patients. Performance of practical procedures relevant to the patients. Ensure that administration and record keeping is done in the department. Experience and a diploma in anaesthesia will be an added advantage.",
    "notes": "Applications should be submitted strictly online at the following E-Recruitment portal: http://jobs.gauteng.gov.za. No hand-delivered, faxed, or emailed applications will be accepted. For assistance with online applications please email your query to healthjobqueries@gauteng.gov.za . NB: Where Driver\u2019s Licence is mandatory, exception will be granted for people with disabilities. Application should be accompanied by a fully completed and signed new Z83 application form obtainable from any Public Service Department or on the internet at www.dpsa.gov.za/documents plus a recently updated comprehensive Curriculum Vitae (CV), Registration Certificate with relevant professional body (HPCSA) and a proof of current registration (Annual Practicing Certificate/Card). Applications without proof of a new Z83 application form, a detailed CV, registration certificate and a proof of current registration card/certificate with relevant professional body will be disqualified. (Shortlisted candidates will receive communication from HR to submit certified copies of educational qualifications and other relevant documents not older than 6 months on or before the day of the interview). It is the applicant\u2019s responsibility to have foreign qualifications evaluated by the South African Qualifications Authority (SAQA). All foreign qualification must be accompanied by evaluation certificate from the South African Qualification Authority (SAQA). Correspondence will only be limited to shortlisted candidates. If you have not been contacted within 3 months of the closing date of this advertisement, please accept that your application was unsuccessful. Suitable candidates will be subjected to a personnel suitability check (criminal record, citizenship, credit record checks, qualification verification and employment verification). Where applicable, candidates will be subjected to a skills/knowledge test. The recommended candidate may be subjected to Medical Surveillance as required by the Occupational Health and Safety Act, Act 5/1993. It is Department\u2019s intention to promote representivity (race, gender, and disability) in the Public Service through the filling of these posts. The Department reserves the right not to appoint/fill this post. WOMEN AND PEOPLE WITH DISABILITY ARE ENCOURAGED TO APPLY.",
    "full_text": "HOME\nJOBS\nABOUT US\nACCOUNT\n\n\n\nJob Details\nDepartment of Health\nMEDICAL OFFICER ANAESTHETICS\nReference Number : refs/034948\nDirectorate : Medical\nNumber of Posts : 1\nPackage : Grade 1: R 949 146 \u2013 R 1 021 911 per annum, (all-inclusive package), Grade 2: R 1 082 988 \u2013 R 1 182 13 per annum, (all-inclusive package), Grade 3: R 1 253 415 \u2013 R 1 561 734 per annum, (all-inclusive package)\nEnquiries : Dr. N Jwara Tel No- (011) 812 5163\n\nRequirements :\n\nGrade 12 plus MBCHB degree registered with HPCSA as a Medical Officer independent practice. With annual registration to practice and registration as a Medical Officer independent practitioner.\n\nDuties :\n\nThe incumbent will be responsible for interviewing, investigating, diagnosing and overseeing the treatment of patients. Attendance of relevant administrative meeting like mortality meetings, near miss meetings and completing Medico legal documents timeously (e.g. Death certificate). Improving quality of care by providing appropriate clinical care. Reduce medical litigation by exercising good clinical ethos. Implement and monitor adherence to National Core Standards (Norms and Standard). Participating in all activities of the discipline in relations to teaching and research. Participate in multidisciplinary team to the management of patients. Performance of practical procedures relevant to the patients. Ensure that administration and record keeping is done in the department. Experience and a diploma in anaesthesia will be an added advantage.\n\nNotes :\n\nApplications should be submitted strictly online at the following E-Recruitment portal: http://jobs.gauteng.gov.za. No hand-delivered, faxed, or emailed applications will be accepted. For assistance with online applications please email your query to healthjobqueries@gauteng.gov.za . NB: Where Driver\u2019s Licence is mandatory, exception will be granted for people with disabilities. Application should be accompanied by a fully completed and signed new Z83 application form obtainable from any Public Service Department or on the internet at www.dpsa.gov.za/documents plus a recently updated comprehensive Curriculum Vitae (CV), Registration Certificate with relevant professional body (HPCSA) and a proof of current registration (Annual Practicing Certificate/Card). Applications without proof of a new Z83 application form, a detailed CV, registration certificate and a proof of current registration card/certificate with relevant professional body will be disqualified. (Shortlisted candidates will receive communication from HR to submit certified copies of educational qualifications and other relevant documents not older than 6 months on or before the day of the interview). It is the applicant\u2019s responsibility to have foreign qualifications evaluated by the South African Qualifications Authority (SAQA). All foreign qualification must be accompanied by evaluation certificate from the South African Qualification Authority (SAQA). Correspondence will only be limited to shortlisted candidates. If you have not been contacted within 3 months of the closing date of this advertisement, please accept that your application was unsuccessful. Suitable candidates will be subjected to a personnel suitability check (criminal record, citizenship, credit record checks, qualification verification and employment verification). Where applicable, candidates will be subjected to a skills/knowledge test. The recommended candidate may be subjected to Medical Surveillance as required by the Occupational Health and Safety Act, Act 5/1993. It is Department\u2019s intention to promote representivity (race, gender, and disability) in the Public Service through the filling of these posts. The Department reserves the right not to appoint/fill this post. WOMEN AND PEOPLE WITH DISABILITY ARE ENCOURAGED TO APPLY.\n\nEmployer : Department of Health\n\nLocation : Pholosong Regional Hospital\n\nClosing Date : 16-01-2026\n\n\n\nCriteria Questions\nDo you have a grade 12 plus MBCHB degree registered with HPCSA as a Medical Officer independent practice?\nDo you have annual registration to practice and registration as a Medical Officer independent practitioner?\n\n\n\nPlease Notes :\n\nDue to the large number of applications we envisage receiving, applications will not be acknowledged. If you do not receive any response within 3 months, please accept that your application was not successful.\n\n\nFind us\nAddress\n75 Fox Street, Mashalltown\nJohannesburg\n2000\n\nCall us\n\nPhone\n080 022 8827\nEmail\nsupport@gauteng.gov.za\n\nQuick Links\nAll Jobs\nAbout Us\n\n\u00a9 Gauteng Provincial Government 2026 . Powered by Department of e-Government"
  },
  {
    "position": "MEDICAL OFFICER GRADE 1 - INTERNAL MEDICINE",
    "location": "Pholosong Regional Hospital",
    "package": "Grade 1: R 949 146 \u2013 R 1 021 911 per annum, (all-inclusive package) , Grade 2: R 1 082 988 \u2013 R 1 182 13 per annum, (all-inclusive package),Grade 3: R 1 253 415 \u2013 R 1 561 734 per annum, (all-inclusive package)",
    "closing_date": "2026/01/16",
    "link": "https://jobs.gauteng.gov.za/Public/ViewJob.aspx?u=E7CSZ5GRR4EZFGgOS83zkw==",
    "title": "MEDICAL OFFICER GRADE 1 - INTERNAL MEDICINE",
    "reference_number": "refs/034947",
    "directorate": "Medical",
    "centre": "Pholosong Regional Hospital",
    "package_detail": "Grade 1: R 949 146 \u2013 R 1 021 911 per annum, (all-inclusive package) , Grade 2: R 1 082 988 \u2013 R 1 182 13 per annum, (all-inclusive package),Grade 3: R 1 253 415 \u2013 R 1 561 734 per annum, (all-inclusive package)",
    "closing_date_detail": "16-01-2026",
    "enquiries": "Dr. L. Luthuli Tel No- (011) 812 5163",
    "requirements": "MBCHB degree registered with HPCSA as a Medical Officer independent practitioner. Active registration to with the HPCSA for the current financial year.",
    "duties": "The incumbent will be responsible for interviewing, investigating, diagnosing and overseeing the treatment of patients. Attendance of relevant administrative meeting like mortality meetings, near miss meetings and completing Medico legal documents timeously (e.g. Death certificate). Improving quality of care by providing appropriate clinical care. Reduce medical litigation by exercising good clinical ethos. Implement and monitor adherence to National Core Standards (Norms and Standard). Participating in all activities of the discipline in relations to teaching and research. Participate in multidisciplinary team to the management of patients. Performance of practical procedures relevant to the patients. Ensure that administration and record keeping is done in the department. Primaries in internal Medicine, HIV Diploma and experience will be an added advantage.",
    "notes": "Applications should be submitted strictly online at the following E-Recruitment portal: http://jobs.gauteng.gov.za. No hand-delivered, faxed, or emailed applications will be accepted. For assistance with online applications please email your query to healthjobqueries@gauteng.gov.za . NB: Where Driver\u2019s Licence is mandatory, exception will be granted for people with disabilities. Application should be accompanied by a fully completed and signed new Z83 application form obtainable from any Public Service Department or on the internet at www.dpsa.gov.za/documents plus a recently updated comprehensive Curriculum Vitae (CV), Registration Certificate with relevant professional body (HPCSA) and a proof of current registration (Annual Practicing Certificate/Card). Applications without proof of a new Z83 application form, a detailed CV, registration certificate and a proof of current registration card/certificate with relevant professional body will be disqualified. (Shortlisted candidates will receive communication from HR to submit certified copies of educational qualifications and other relevant documents not older than 6 months on or before the day of the interview). It is the applicant\u2019s responsibility to have foreign qualifications evaluated by the South African Qualifications Authority (SAQA). All foreign qualification must be accompanied by evaluation certificate from the South African Qualification Authority (SAQA). Correspondence will only be limited to shortlisted candidates. If you have not been contacted within 3 months of the closing date of this advertisement, please accept that your application was unsuccessful. Suitable candidates will be subjected to a personnel suitability check (criminal record, citizenship, credit record checks, qualification verification and employment verification). Where applicable, candidates will be subjected to a skills/knowledge test. The recommended candidate may be subjected to Medical Surveillance as required by the Occupational Health and Safety Act, Act 5/1993. It is Department\u2019s intention to promote representivity (race, gender, and disability) in the Public Service through the filling of these posts. The Department reserves the right not to appoint/fill this post. WOMEN AND PEOPLE WITH DISABILITY ARE ENCOURAGED TO APPLY.",
    "full_text": "HOME\nJOBS\nABOUT US\nACCOUNT\n\n\n\nJob Details\nDepartment of Health\nMEDICAL OFFICER GRADE 1 - INTERNAL MEDICINE\nReference Number : refs/034947\nDirectorate : Medical\nNumber of Posts : 2\nPackage : Grade 1: R 949 146 \u2013 R 1 021 911 per annum, (all-inclusive package) , Grade 2: R 1 082 988 \u2013 R 1 182 13 per annum, (all-inclusive package),Grade 3: R 1 253 415 \u2013 R 1 561 734 per annum, (all-inclusive package)\nEnquiries : Dr. L. Luthuli Tel No- (011) 812 5163\n\nRequirements :\n\nMBCHB degree registered with HPCSA as a Medical Officer independent practitioner. Active registration to with the HPCSA for the current financial year.\n\nDuties :\n\nThe incumbent will be responsible for interviewing, investigating, diagnosing and overseeing the treatment of patients. Attendance of relevant administrative meeting like mortality meetings, near miss meetings and completing Medico legal documents timeously (e.g. Death certificate). Improving quality of care by providing appropriate clinical care. Reduce medical litigation by exercising good clinical ethos. Implement and monitor adherence to National Core Standards (Norms and Standard). Participating in all activities of the discipline in relations to teaching and research. Participate in multidisciplinary team to the management of patients. Performance of practical procedures relevant to the patients. Ensure that administration and record keeping is done in the department. Primaries in internal Medicine, HIV Diploma and experience will be an added advantage.\n\nNotes :\n\nApplications should be submitted strictly online at the following E-Recruitment portal: http://jobs.gauteng.gov.za. No hand-delivered, faxed, or emailed applications will be accepted. For assistance with online applications please email your query to healthjobqueries@gauteng.gov.za . NB: Where Driver\u2019s Licence is mandatory, exception will be granted for people with disabilities. Application should be accompanied by a fully completed and signed new Z83 application form obtainable from any Public Service Department or on the internet at www.dpsa.gov.za/documents plus a recently updated comprehensive Curriculum Vitae (CV), Registration Certificate with relevant professional body (HPCSA) and a proof of current registration (Annual Practicing Certificate/Card). Applications without proof of a new Z83 application form, a detailed CV, registration certificate and a proof of current registration card/certificate with relevant professional body will be disqualified. (Shortlisted candidates will receive communication from HR to submit certified copies of educational qualifications and other relevant documents not older than 6 months on or before the day of the interview). It is the applicant\u2019s responsibility to have foreign qualifications evaluated by the South African Qualifications Authority (SAQA). All foreign qualification must be accompanied by evaluation certificate from the South African Qualification Authority (SAQA). Correspondence will only be limited to shortlisted candidates. If you have not been contacted within 3 months of the closing date of this advertisement, please accept that your application was unsuccessful. Suitable candidates will be subjected to a personnel suitability check (criminal record, citizenship, credit record checks, qualification verification and employment verification). Where applicable, candidates will be subjected to a skills/knowledge test. The recommended candidate may be subjected to Medical Surveillance as required by the Occupational Health and Safety Act, Act 5/1993. It is Department\u2019s intention to promote representivity (race, gender, and disability) in the Public Service through the filling of these posts. The Department reserves the right not to appoint/fill this post. WOMEN AND PEOPLE WITH DISABILITY ARE ENCOURAGED TO APPLY.\n\nEmployer : Department of Health\n\nLocation : Pholosong Regional Hospital\n\nClosing Date : 16-01-2026\n\n\n\nCriteria Questions\nDo you have a MBCHB degree registered with HPCSA as a Medical Officer independent practitioner?\nDo you have active registration with the HPCSA for the current financial year?\n\n\n\nPlease Notes :\n\nDue to the large number of applications we envisage receiving, applications will not be acknowledged. If you do not receive any response within 3 months, please accept that your application was not successful.\n\n\nFind us\nAddress\n75 Fox Street, Mashalltown\nJohannesburg\n2000\n\nCall us\n\nPhone\n080 022 8827\nEmail\nsupport@gauteng.gov.za\n\nQuick Links\nAll Jobs\nAbout Us\n\n\u00a9 Gauteng Provincial Government 2026 . Powered by Department of e-Government"
  },
  {
    "position": "MEDICAL OFFICER GRADE 1 - RADIOLOGY",
    "location": "Pholosong Regional Hospital",
    "package": "Grade 1: R 949 146 \u2013 R 1 021 911 per annum, (all-inclusive package), Grade 2: R 1 082 988 \u2013 R 1 182 13 per annum, (all-inclusive package), Grade 3: R 1 253 415 \u2013 R 1 561 734 per annum, (all-inclusive package)",
    "closing_date": "2026/01/16",
    "link": "https://jobs.gauteng.gov.za/Public/ViewJob.aspx?u=E7CSZ5GRR4FUQVpbYVlVvA==",
    "title": "MEDICAL OFFICER GRADE 1 - RADIOLOGY",
    "reference_number": "refs/034946",
    "directorate": "Medical",
    "centre": "Pholosong Regional Hospital",
    "package_detail": "Grade 1: R 949 146 \u2013 R 1 021 911 per annum, (all-inclusive package), Grade 2: R 1 082 988 \u2013 R 1 182 13 per annum, (all-inclusive package), Grade 3: R 1 253 415 \u2013 R 1 561 734 per annum, (all-inclusive package)",
    "closing_date_detail": "16-01-2026",
    "enquiries": "Dr. N Jwara Tel No- (011) 812 5163",
    "requirements": "MBCHB degree registered with HPCSA as a Medical Officer independent practice with annual registration to practice and registration as a Medical Officer independent practitioner.",
    "duties": "The incumbent will be responsible for interviewing, investigating, diagnosing and overseeing the treatment of patients. Attendance of relevant administrative meeting like mortality meetings, near miss meetings and completing Medico legal documents timeously (e.g. Death certificate). Improving quality of care by providing appropriate clinical care. Reduce medical litigation by exercising good clinical ethos. Implement and monitor adherence to National Core Standards (Norms and Standard). Participating in all activities of the discipline in relations to teaching and research. Participate in multidisciplinary team to the management of patients. Performance of practical procedures relevant to the patients. Ensure that administration and record keeping is done in the department. Primaries in radiology and experience in radiology are an added advantage.",
    "notes": "Applications should be submitted strictly online at the following E-Recruitment portal: http://jobs.gauteng.gov.za. No hand-delivered, faxed, or emailed applications will be accepted. For assistance with online applications please email your query to healthjobqueries@gauteng.gov.za . NB: Where Driver\u2019s Licence is mandatory, exception will be granted for people with disabilities. Application should be accompanied by a fully completed and signed new Z83 application form obtainable from any Public Service Department or on the internet at www.dpsa.gov.za/documents plus a recently updated comprehensive Curriculum Vitae (CV), Registration Certificate with relevant professional body (HPCSA) and a proof of current registration (Annual Practicing Certificate/Card). Applications without proof of a new Z83 application form, a detailed CV, registration certificate and a proof of current registration card/certificate with relevant professional body will be disqualified. (Shortlisted candidates will receive communication from HR to submit certified copies of educational qualifications and other relevant documents not older than 6 months on or before the day of the interview). It is the applicant\u2019s responsibility to have foreign qualifications evaluated by the South African Qualifications Authority (SAQA). All foreign qualification must be accompanied by evaluation certificate from the South African Qualification Authority (SAQA). Correspondence will only be limited to shortlisted candidates. If you have not been contacted within 3 months of the closing date of this advertisement, please accept that your application was unsuccessful. Suitable candidates will be subjected to a personnel suitability check (criminal record, citizenship, credit record checks, qualification verification and employment verification). Where applicable, candidates will be subjected to a skills/knowledge test. The recommended candidate may be subjected to Medical Surveillance as required by the Occupational Health and Safety Act, Act 5/1993. It is Department\u2019s intention to promote representivity (race, gender, and disability) in the Public Service through the filling of these posts. The Department reserves the right not to appoint/fill this post. WOMEN AND PEOPLE WITH DISABILITY ARE ENCOURAGED TO APPLY.",
    "full_text": "HOME\nJOBS\nABOUT US\nACCOUNT\n\n\n\nJob Details\nDepartment of Health\nMEDICAL OFFICER GRADE 1 - RADIOLOGY\nReference Number : refs/034946\nDirectorate : Medical\nNumber of Posts : 1\nPackage : Grade 1: R 949 146 \u2013 R 1 021 911 per annum, (all-inclusive package), Grade 2: R 1 082 988 \u2013 R 1 182 13 per annum, (all-inclusive package), Grade 3: R 1 253 415 \u2013 R 1 561 734 per annum, (all-inclusive package)\nEnquiries : Dr. N Jwara Tel No- (011) 812 5163\n\nRequirements :\n\nMBCHB degree registered with HPCSA as a Medical Officer independent practice with annual registration to practice and registration as a Medical Officer independent practitioner.\n\nDuties :\n\nThe incumbent will be responsible for interviewing, investigating, diagnosing and overseeing the treatment of patients. Attendance of relevant administrative meeting like mortality meetings, near miss meetings and completing Medico legal documents timeously (e.g. Death certificate). Improving quality of care by providing appropriate clinical care. Reduce medical litigation by exercising good clinical ethos. Implement and monitor adherence to National Core Standards (Norms and Standard). Participating in all activities of the discipline in relations to teaching and research. Participate in multidisciplinary team to the management of patients. Performance of practical procedures relevant to the patients. Ensure that administration and record keeping is done in the department. Primaries in radiology and experience in radiology are an added advantage.\n\nNotes :\n\nApplications should be submitted strictly online at the following E-Recruitment portal: http://jobs.gauteng.gov.za. No hand-delivered, faxed, or emailed applications will be accepted. For assistance with online applications please email your query to healthjobqueries@gauteng.gov.za . NB: Where Driver\u2019s Licence is mandatory, exception will be granted for people with disabilities. Application should be accompanied by a fully completed and signed new Z83 application form obtainable from any Public Service Department or on the internet at www.dpsa.gov.za/documents plus a recently updated comprehensive Curriculum Vitae (CV), Registration Certificate with relevant professional body (HPCSA) and a proof of current registration (Annual Practicing Certificate/Card). Applications without proof of a new Z83 application form, a detailed CV, registration certificate and a proof of current registration card/certificate with relevant professional body will be disqualified. (Shortlisted candidates will receive communication from HR to submit certified copies of educational qualifications and other relevant documents not older than 6 months on or before the day of the interview). It is the applicant\u2019s responsibility to have foreign qualifications evaluated by the South African Qualifications Authority (SAQA). All foreign qualification must be accompanied by evaluation certificate from the South African Qualification Authority (SAQA). Correspondence will only be limited to shortlisted candidates. If you have not been contacted within 3 months of the closing date of this advertisement, please accept that your application was unsuccessful. Suitable candidates will be subjected to a personnel suitability check (criminal record, citizenship, credit record checks, qualification verification and employment verification). Where applicable, candidates will be subjected to a skills/knowledge test. The recommended candidate may be subjected to Medical Surveillance as required by the Occupational Health and Safety Act, Act 5/1993. It is Department\u2019s intention to promote representivity (race, gender, and disability) in the Public Service through the filling of these posts. The Department reserves the right not to appoint/fill this post. WOMEN AND PEOPLE WITH DISABILITY ARE ENCOURAGED TO APPLY.\n\nEmployer : Department of Health\n\nLocation : Pholosong Regional Hospital\n\nClosing Date : 16-01-2026\n\n\n\nCriteria Questions\nDo you have a MBCHB degree registered with HPCSA as a Medical Officer independent practice?\nDo you have annual registration to practice and registration as a Medical Officer independent practitioner?\n\n\n\nPlease Notes :\n\nDue to the large number of applications we envisage receiving, applications will not be acknowledged. If you do not receive any response within 3 months, please accept that your application was not successful.\n\n\nFind us\nAddress\n75 Fox Street, Mashalltown\nJohannesburg\n2000\n\nCall us\n\nPhone\n080 022 8827\nEmail\nsupport@gauteng.gov.za\n\nQuick Links\nAll Jobs\nAbout Us\n\n\u00a9 Gauteng Provincial Government 2026 . Powered by Department of e-Government"
  },
  {
    "position": "MEDICAL OFFICER GRADE 1- OBSTETRICS & GYNAECOLOGY",
    "location": "Pholosong Regional Hospital",
    "package": "Grade 1- R 949 146 \u2013 R 1 021 911 per annum, (all-inclusive package), Grade 2- R 1 082 988 \u2013 R 1 182 13 per annum, (all-inclusive package), Grade 3- R 1 253 415 \u2013 R 1 561 734 per annum, (all-inclusive package",
    "closing_date": "2026/01/16",
    "link": "https://jobs.gauteng.gov.za/Public/ViewJob.aspx?u=E7CSZ5GRR4G1L6qCBzaAHg==",
    "title": "MEDICAL OFFICER GRADE 1- OBSTETRICS & GYNAECOLOGY",
    "reference_number": "refs/034945",
    "directorate": "Medical",
    "centre": "Pholosong Regional Hospital",
    "package_detail": "Grade 1- R 949 146 \u2013 R 1 021 911 per annum, (all-inclusive package), Grade 2- R 1 082 988 \u2013 R 1 182 13 per annum, (all-inclusive package), Grade 3- R 1 253 415 \u2013 R 1 561 734 per annum, (all-inclusive package",
    "closing_date_detail": "16-01-2026",
    "enquiries": "Dr. L. Luthuli Tel No- (011) 812 5163",
    "requirements": "MBCHB degree registered with HPCSA as a Medical Officer independent practitioner. Active registration with the HPCSA for the current financial year.",
    "duties": "The incumbent will be responsible for interviewing, investigating, diagnosing and overseeing the treatment of patients. Attendance of relevant administrative meeting like mortality meetings, near miss meetings and completing Medico legal documents timeously (e.g. Death certificate). Improving quality of care by providing appropriate clinical care. Reduce medical litigation by exercising good clinical ethos. Implement and monitor adherence to National Core Standards (Norms and Standard). Participating in all activities of the discipline in relations to teaching and research. Participate in multidisciplinary team to the management of patients. Performance of practical procedures relevant to the patients. Ensure that administration and record keeping is done in the department. Experience and a diploma in obstetrics & gynaecology will be an added advantage",
    "notes": "Applications should be submitted strictly online at the following E-Recruitment portal: http://jobs.gauteng.gov.za. No hand-delivered, faxed, or emailed applications will be accepted. For assistance with online applications please email your query to healthjobqueries@gauteng.gov.za . NB: Where Driver\u2019s Licence is mandatory, exception will be granted for people with disabilities. Application should be accompanied by a fully completed and signed new Z83 application form obtainable from any Public Service Department or on the internet at www.dpsa.gov.za/documents plus a recently updated comprehensive Curriculum Vitae (CV), Registration Certificate with relevant professional body (HPCSA) and a proof of current registration (Annual Practicing Certificate/Card). Applications without proof of a new Z83 application form, a detailed CV, registration certificate and a proof of current registration card/certificate with relevant professional body will be disqualified. (Shortlisted candidates will receive communication from HR to submit certified copies of educational qualifications and other relevant documents not older than 6 months on or before the day of the interview). It is the applicant\u2019s responsibility to have foreign qualifications evaluated by the South African Qualifications Authority (SAQA). All foreign qualification must be accompanied by evaluation certificate from the South African Qualification Authority (SAQA). Correspondence will only be limited to shortlisted candidates. If you have not been contacted within 3 months of the closing date of this advertisement, please accept that your application was unsuccessful. Suitable candidates will be subjected to a personnel suitability check (criminal record, citizenship, credit record checks, qualification verification and employment verification). Where applicable, candidates will be subjected to a skills/knowledge test. The recommended candidate may be subjected to Medical Surveillance as required by the Occupational Health and Safety Act, Act 5/1993. It is Department\u2019s intention to promote representivity (race, gender, and disability) in the Public Service through the filling of these posts. The Department reserves the right not to appoint/fill this post. WOMEN AND PEOPLE WITH DISABILITY ARE ENCOURAGED TO APPLY.",
    "full_text": "HOME\nJOBS\nABOUT US\nACCOUNT\n\n\n\nJob Details\nDepartment of Health\nMEDICAL OFFICER GRADE 1- OBSTETRICS & GYNAECOLOGY\nReference Number : refs/034945\nDirectorate : Medical\nNumber of Posts : 2\nPackage : Grade 1- R 949 146 \u2013 R 1 021 911 per annum, (all-inclusive package), Grade 2- R 1 082 988 \u2013 R 1 182 13 per annum, (all-inclusive package), Grade 3- R 1 253 415 \u2013 R 1 561 734 per annum, (all-inclusive package\nEnquiries : Dr. L. Luthuli Tel No- (011) 812 5163\n\nRequirements :\n\nMBCHB degree registered with HPCSA as a Medical Officer independent practitioner. Active registration with the HPCSA for the current financial year.\n\nDuties :\n\nThe incumbent will be responsible for interviewing, investigating, diagnosing and overseeing the treatment of patients. Attendance of relevant administrative meeting like mortality meetings, near miss meetings and completing Medico legal documents timeously (e.g. Death certificate). Improving quality of care by providing appropriate clinical care. Reduce medical litigation by exercising good clinical ethos. Implement and monitor adherence to National Core Standards (Norms and Standard). Participating in all activities of the discipline in relations to teaching and research. Participate in multidisciplinary team to the management of patients. Performance of practical procedures relevant to the patients. Ensure that administration and record keeping is done in the department. Experience and a diploma in obstetrics & gynaecology will be an added advantage\n\nNotes :\n\nApplications should be submitted strictly online at the following E-Recruitment portal: http://jobs.gauteng.gov.za. No hand-delivered, faxed, or emailed applications will be accepted. For assistance with online applications please email your query to healthjobqueries@gauteng.gov.za . NB: Where Driver\u2019s Licence is mandatory, exception will be granted for people with disabilities. Application should be accompanied by a fully completed and signed new Z83 application form obtainable from any Public Service Department or on the internet at www.dpsa.gov.za/documents plus a recently updated comprehensive Curriculum Vitae (CV), Registration Certificate with relevant professional body (HPCSA) and a proof of current registration (Annual Practicing Certificate/Card). Applications without proof of a new Z83 application form, a detailed CV, registration certificate and a proof of current registration card/certificate with relevant professional body will be disqualified. (Shortlisted candidates will receive communication from HR to submit certified copies of educational qualifications and other relevant documents not older than 6 months on or before the day of the interview). It is the applicant\u2019s responsibility to have foreign qualifications evaluated by the South African Qualifications Authority (SAQA). All foreign qualification must be accompanied by evaluation certificate from the South African Qualification Authority (SAQA). Correspondence will only be limited to shortlisted candidates. If you have not been contacted within 3 months of the closing date of this advertisement, please accept that your application was unsuccessful. Suitable candidates will be subjected to a personnel suitability check (criminal record, citizenship, credit record checks, qualification verification and employment verification). Where applicable, candidates will be subjected to a skills/knowledge test. The recommended candidate may be subjected to Medical Surveillance as required by the Occupational Health and Safety Act, Act 5/1993. It is Department\u2019s intention to promote representivity (race, gender, and disability) in the Public Service through the filling of these posts. The Department reserves the right not to appoint/fill this post. WOMEN AND PEOPLE WITH DISABILITY ARE ENCOURAGED TO APPLY.\n\nEmployer : Department of Health\n\nLocation : Pholosong Regional Hospital\n\nClosing Date : 16-01-2026\n\n\n\nCriteria Questions\nDo you have a MBCHB degree registered with HPCSA as a Medical Officer independent practitioner?\nDo you have active registration with the HPCSA for the current financial year?\n\n\n\nPlease Notes :\n\nDue to the large number of applications we envisage receiving, applications will not be acknowledged. If you do not receive any response within 3 months, please accept that your application was not successful.\n\n\nFind us\nAddress\n75 Fox Street, Mashalltown\nJohannesburg\n2000\n\nCall us\n\nPhone\n080 022 8827\nEmail\nsupport@gauteng.gov.za\n\nQuick Links\nAll Jobs\nAbout Us\n\n\u00a9 Gauteng Provincial Government 2026 . Powered by Department of e-Government"
  },
  {
    "position": "MEDICAL OFFICER GRADE 1 - PAEDIATRICS",
    "location": "Pholosong Regional Hospital",
    "package": "Grade 1- R 949 146 \u2013 R 1 021 911 per annum, (all-inclusive package), Grade 2- R 1 082 988 \u2013 R 1 182 13 per annum, (all-inclusive package), Grade 3- R 1 253 415 \u2013 R 1 561 734 per annum, (all-inclusive package)",
    "closing_date": "2026/01/16",
    "link": "https://jobs.gauteng.gov.za/Public/ViewJob.aspx?u=57glvgJbW+Lb7T/8R1xyjA==",
    "title": "MEDICAL OFFICER GRADE 1 - PAEDIATRICS",
    "reference_number": "REFS/034944",
    "directorate": "Medical",
    "centre": "Pholosong Regional Hospital",
    "package_detail": "Grade 1- R 949 146 \u2013 R 1 021 911 per annum, (all-inclusive package), Grade 2- R 1 082 988 \u2013 R 1 182 13 per annum, (all-inclusive package), Grade 3- R 1 253 415 \u2013 R 1 561 734 per annum, (all-inclusive package)",
    "closing_date_detail": "16-01-2026",
    "enquiries": "Dr L Luthuli Tel No- (011) 812 5163",
    "requirements": "MBCHB degree registered with HPCSA as a Medical Officer independent practitioner. Active registration to with the HPCSA for the current financial year.",
    "duties": "The incumbent will be responsible for interviewing, investigating, diagnosing and overseeing the treatment of patients. Attendance of relevant administrative meeting like mortality meetings, near miss meetings and completing Medico legal documents timeously (e.g. Death certificate). Improving quality of care by providing appropriate clinical care. Reduce medical litigation by exercising good clinical ethos. Implement and monitor adherence to National Core Standards (Norms and Standard). Participating in all activities of the discipline in relations to teaching and research. Participate in multidisciplinary team to the management of patients. Performance of practical procedures relevant to the patients. Ensure that administration and record keeping is done in the department. A diploma in Child health and experience working in paediatrics department will be an added advantage",
    "notes": "Applications should be submitted strictly online at the following E-Recruitment portal: http://jobs.gauteng.gov.za. No hand-delivered, faxed, or emailed applications will be accepted. For assistance with online applications please email your query to healthjobqueries@gauteng.gov.za . NB: Where Driver\u2019s Licence is mandatory, exception will be granted for people with disabilities. Application should be accompanied by a fully completed and signed new Z83 application form obtainable from any Public Service Department or on the internet at www.dpsa.gov.za/documents plus a recently updated comprehensive Curriculum Vitae (CV), Registration Certificate with relevant professional body (HPCSA) and a proof of current registration (Annual Practicing Certificate/Card). Applications without proof of a new Z83 application form, a detailed CV, registration certificate and a proof of current registration card/certificate with relevant professional body will be disqualified. (Shortlisted candidates will receive communication from HR to submit certified copies of educational qualifications and other relevant documents not older than 6 months on or before the day of the interview). It is the applicant\u2019s responsibility to have foreign qualifications evaluated by the South African Qualifications Authority (SAQA). All foreign qualification must be accompanied by evaluation certificate from the South African Qualification Authority (SAQA). Correspondence will only be limited to shortlisted candidates. If you have not been contacted within 3 months of the closing date of this advertisement, please accept that your application was unsuccessful. Suitable candidates will be subjected to a personnel suitability check (criminal record, citizenship, credit record checks, qualification verification and employment verification). Where applicable, candidates will be subjected to a skills/knowledge test. The recommended candidate may be subjected to Medical Surveillance as required by the Occupational Health and Safety Act, Act 5/1993. It is Department\u2019s intention to promote representivity (race, gender, and disability) in the Public Service through the filling of these posts. The Department reserves the right not to appoint/fill this post. WOMEN AND PEOPLE WITH DISABILITY ARE ENCOURAGED TO APPLY.",
    "full_text": "HOME\nJOBS\nABOUT US\nACCOUNT\n\n\n\nJob Details\nDepartment of Health\nMEDICAL OFFICER GRADE 1 - PAEDIATRICS\nReference Number : REFS/034944\nDirectorate : Medical\nNumber of Posts : 2\nPackage : Grade 1- R 949 146 \u2013 R 1 021 911 per annum, (all-inclusive package), Grade 2- R 1 082 988 \u2013 R 1 182 13 per annum, (all-inclusive package), Grade 3- R 1 253 415 \u2013 R 1 561 734 per annum, (all-inclusive package)\nEnquiries : Dr L Luthuli Tel No- (011) 812 5163\n\nRequirements :\n\nMBCHB degree registered with HPCSA as a Medical Officer independent practitioner. Active registration to with the HPCSA for the current financial year.\n\nDuties :\n\nThe incumbent will be responsible for interviewing, investigating, diagnosing and overseeing the treatment of patients. Attendance of relevant administrative meeting like mortality meetings, near miss meetings and completing Medico legal documents timeously (e.g. Death certificate). Improving quality of care by providing appropriate clinical care. Reduce medical litigation by exercising good clinical ethos. Implement and monitor adherence to National Core Standards (Norms and Standard). Participating in all activities of the discipline in relations to teaching and research. Participate in multidisciplinary team to the management of patients. Performance of practical procedures relevant to the patients. Ensure that administration and record keeping is done in the department. A diploma in Child health and experience working in paediatrics department will be an added advantage\n\nNotes :\n\nApplications should be submitted strictly online at the following E-Recruitment portal: http://jobs.gauteng.gov.za. No hand-delivered, faxed, or emailed applications will be accepted. For assistance with online applications please email your query to healthjobqueries@gauteng.gov.za . NB: Where Driver\u2019s Licence is mandatory, exception will be granted for people with disabilities. Application should be accompanied by a fully completed and signed new Z83 application form obtainable from any Public Service Department or on the internet at www.dpsa.gov.za/documents plus a recently updated comprehensive Curriculum Vitae (CV), Registration Certificate with relevant professional body (HPCSA) and a proof of current registration (Annual Practicing Certificate/Card). Applications without proof of a new Z83 application form, a detailed CV, registration certificate and a proof of current registration card/certificate with relevant professional body will be disqualified. (Shortlisted candidates will receive communication from HR to submit certified copies of educational qualifications and other relevant documents not older than 6 months on or before the day of the interview). It is the applicant\u2019s responsibility to have foreign qualifications evaluated by the South African Qualifications Authority (SAQA). All foreign qualification must be accompanied by evaluation certificate from the South African Qualification Authority (SAQA). Correspondence will only be limited to shortlisted candidates. If you have not been contacted within 3 months of the closing date of this advertisement, please accept that your application was unsuccessful. Suitable candidates will be subjected to a personnel suitability check (criminal record, citizenship, credit record checks, qualification verification and employment verification). Where applicable, candidates will be subjected to a skills/knowledge test. The recommended candidate may be subjected to Medical Surveillance as required by the Occupational Health and Safety Act, Act 5/1993. It is Department\u2019s intention to promote representivity (race, gender, and disability) in the Public Service through the filling of these posts. The Department reserves the right not to appoint/fill this post. WOMEN AND PEOPLE WITH DISABILITY ARE ENCOURAGED TO APPLY.\n\nEmployer : Department of Health\n\nLocation : Pholosong Regional Hospital\n\nClosing Date : 16-01-2026\n\n\n\nCriteria Questions\nDo you have an appropriate qualification(degree/ equivalent qualification) that allows for the required registration with the Health Professionals Council of South Africa (HPCSA)?\nDo you have active registration with the HPCSA for the current financial year?\n\n\n\nPlease Notes :\n\nDue to the large number of applications we envisage receiving, applications will not be acknowledged. If you do not receive any response within 3 months, please accept that your application was not successful.\n\n\nFind us\nAddress\n75 Fox Street, Mashalltown\nJohannesburg\n2000\n\nCall us\n\nPhone\n080 022 8827\nEmail\nsupport@gauteng.gov.za\n\nQuick Links\nAll Jobs\nAbout Us\n\n\u00a9 Gauteng Provincial Government 2026 . Powered by Department of e-Government"
  },
  {
    "position": "Assistant Director: Communication Officer",
    "location": "Charlotte Maxeke Johannesburg Academic Hospital",
    "package": "R468 459.00 per annum (plus benefits)",
    "closing_date": "2026/01/09",
    "link": "https://jobs.gauteng.gov.za/Public/ViewJob.aspx?u=Awpj99fb8YVHG3pp3CfR6A==",
    "title": "Assistant Director: Communication Officer",
    "reference_number": "REFS/024369",
    "directorate": "Communications",
    "centre": "Charlotte Maxeke Johannesburg Academic Hospital",
    "package_detail": "R468 459.00 per annum (plus benefits)",
    "closing_date_detail": "09-01-2026",
    "enquiries": "Ms G Bogoshi TEL 011 488 3792 Ms L Maseko Tel 011 488 3711",
    "requirements": "Matric and appropriate three (3) year National Diploma or Degree from a recognized SAQA accredited tertiary institution in Public Relations/ Communication Science/ Communication management or Journalism. At least three (3) years\u2019 experience as Communication Officer. Skills: sound interpersonal relations, project planning skills, ability to prepare reports. Good communication skills both verbal and written. Must be computer literate. Knowledge: Good understanding and knowledge of communication must have a valid driver\u2019s licence.",
    "duties": "Plan, implement and oversee both internal and external communication. Formulate and implement communication strategies. Coordinate outreach and communication activities. Manage effectively and economically the hospital resources for public education, public relations, media services and stakeholder relations. Drive and coordinate generation of good news to cater for various media platforms and formats inclusive of corporate publications, media statements, electronics media, social media, visual and audio, live interviews. Coordinate responses to media enquiries and legislature Reponses. Provide communication support to the various department\u2019s events and activities. Ensure that hospital has adequate communication materials and publications at all times. Publish quarterly internal newsletters, coordination of the annual open day events. Manage and develop content for hospital\u2019s social media accounts. Carry out photo coverage in all events, implement social media strategy in line with departmental corporate identity with cooperate identity manual. Secretary and liaison between hospital board.",
    "notes": "Kindly note that No payment of any kind is required when applying for posts advertised by the Gauteng Department of Health. The Department reserves the right not to fill any advertised posts. Applications should be submitted strictly online at the following E-Recruitment portal: https://jobs.gauteng.gov.za.No hand-delivered, faxed, or emailed applications will be accepted. For assistance with online applications please email your query to healthjobqueries@gauteng.gov.za. Application should be accompanied by a fully completed and signed new Z83 form obtainable from any Public Service Department or on the internet at www.dpsa.gov.za/documents.The Z83 form must be fully completed and singed by the applicant. The following must be considered in relation to the completion of the Z83 by applicant. All the fields in Part A, Part C and Part D must be completed. Leave the following question blank if they are not possession of such: \u201dIf your profession or occupation requires official registration, provide date and particulars of registration\u201d. Application without proof of a new Z83 application form and detailed CV will be disqualified. Application must indicate the post reference number on their application. Shortlisted candidates will receive communication from HR Unit to submit certified copies of educational qualifications and other relevant documents not older than 6 months on or before the day of the interview). Personnel Suitability Checks (criminal checks, citizenship checks, qualification verification, company directorship, social media, financial record checks, reference checks) must be conducted prior appointment. Candidates in possession of a foreign qualification must furnish the Department with an evaluation certificate from the South African Qualification Authority (SAQA). Applicants with foreign qualification remain responsible for ensuring that their qualification are evaluated by the South African Qualification Authority (SAQA). The recommended candidate may be subjected to medical surveillance as require by the Occupational Health and Safety Act 5/1993. The Gauteng Department of Health is guided by the principles of Employment Equity. People with disabilities are encouraged to apply.",
    "full_text": "HOME\nJOBS\nABOUT US\nACCOUNT\n\n\n\nJob Details\nDepartment of Health\nAssistant Director: Communication Officer\nReference Number : REFS/024369\nDirectorate : Communications\nNumber of Posts : 1\nPackage : R468 459.00 per annum (plus benefits)\nEnquiries : Ms G Bogoshi TEL 011 488 3792 Ms L Maseko Tel 011 488 3711\n\nRequirements :\n\nMatric and appropriate three (3) year National Diploma or Degree from a recognized SAQA accredited tertiary institution in Public Relations/ Communication Science/ Communication management or Journalism. At least three (3) years\u2019 experience as Communication Officer. Skills: sound interpersonal relations, project planning skills, ability to prepare reports. Good communication skills both verbal and written. Must be computer literate. Knowledge: Good understanding and knowledge of communication must have a valid driver\u2019s licence.\n\nDuties :\n\nPlan, implement and oversee both internal and external communication. Formulate and implement communication strategies. Coordinate outreach and communication activities. Manage effectively and economically the hospital resources for public education, public relations, media services and stakeholder relations. Drive and coordinate generation of good news to cater for various media platforms and formats inclusive of corporate publications, media statements, electronics media, social media, visual and audio, live interviews. Coordinate responses to media enquiries and legislature Reponses. Provide communication support to the various department\u2019s events and activities. Ensure that hospital has adequate communication materials and publications at all times. Publish quarterly internal newsletters, coordination of the annual open day events. Manage and develop content for hospital\u2019s social media accounts. Carry out photo coverage in all events, implement social media strategy in line with departmental corporate identity with cooperate identity manual. Secretary and liaison between hospital board.\n\nNotes :\n\nKindly note that No payment of any kind is required when applying for posts advertised by the Gauteng Department of Health. The Department reserves the right not to fill any advertised posts. Applications should be submitted strictly online at the following E-Recruitment portal: https://jobs.gauteng.gov.za.No hand-delivered, faxed, or emailed applications will be accepted. For assistance with online applications please email your query to healthjobqueries@gauteng.gov.za. Application should be accompanied by a fully completed and signed new Z83 form obtainable from any Public Service Department or on the internet at www.dpsa.gov.za/documents.The Z83 form must be fully completed and singed by the applicant. The following must be considered in relation to the completion of the Z83 by applicant. All the fields in Part A, Part C and Part D must be completed. Leave the following question blank if they are not possession of such: \u201dIf your profession or occupation requires official registration, provide date and particulars of registration\u201d. Application without proof of a new Z83 application form and detailed CV will be disqualified. Application must indicate the post reference number on their application. Shortlisted candidates will receive communication from HR Unit to submit certified copies of educational qualifications and other relevant documents not older than 6 months on or before the day of the interview). Personnel Suitability Checks (criminal checks, citizenship checks, qualification verification, company directorship, social media, financial record checks, reference checks) must be conducted prior appointment. Candidates in possession of a foreign qualification must furnish the Department with an evaluation certificate from the South African Qualification Authority (SAQA). Applicants with foreign qualification remain responsible for ensuring that their qualification are evaluated by the South African Qualification Authority (SAQA). The recommended candidate may be subjected to medical surveillance as require by the Occupational Health and Safety Act 5/1993. The Gauteng Department of Health is guided by the principles of Employment Equity. People with disabilities are encouraged to apply.\n\nEmployer : Department of Health\n\nLocation : Charlotte Maxeke Johannesburg Academic Hospital\n\nClosing Date : 09-01-2026\n\n\n\nCriteria Questions\nDo you have a Matric and appropriate three (3) year National Diploma or Degree from a recognized SAQA accredited tertiary institution in Public Relations/ Communication Science/ Communication management or Journalism?\nDo you have at least three (3) years\u2019 experience as Communication Officer?\n\n\n\nPlease Notes :\n\nDue to the large number of applications we envisage receiving, applications will not be acknowledged. If you do not receive any response within 3 months, please accept that your application was not successful.\n\n\nFind us\nAddress\n75 Fox Street, Mashalltown\nJohannesburg\n2000\n\nCall us\n\nPhone\n080 022 8827\nEmail\nsupport@gauteng.gov.za\n\nQuick Links\nAll Jobs\nAbout Us\n\n\u00a9 Gauteng Provincial Government 2026 . Powered by Department of e-Government"
  },
  {
    "position": "Administration Officer",
    "location": "Charlotte Maxeke Johannesburg Academic Hospital",
    "package": "R 325 101.00 (per annum) plus benefits",
    "closing_date": "2026/01/09",
    "link": "https://jobs.gauteng.gov.za/Public/ViewJob.aspx?u=Awpj99fb8YV8QdedcWDXEw==",
    "title": "Administration Officer",
    "reference_number": "REFS/024368",
    "directorate": "Risk Management and Internal Control",
    "centre": "Charlotte Maxeke Johannesburg Academic Hospital",
    "package_detail": "R 325 101.00 (per annum) plus benefits",
    "closing_date_detail": "09-01-2026",
    "enquiries": "Ms. M. Dikamotse Tel No - 011 488 4841 Ms L Maseko Tel No - 011 488 3711",
    "requirements": "Grade 12 or equivalent with more than 10 years in Auditing, Accounting or Risk Management experience or National Diploma or Degree from a recognized SAQA tertiary institution in Auditing, Accounting or Risk Management between 0 and 2 years in Auditing, Accounting or Risk Management experience. Knowledge: Sound knowledge of Auditing, Accounting or Risk Management. In-basic knowledge and insight in Treasury Regulations and Public Finance Management Act. Customer relations. Computer literacy- MS Office (Word, Excel, Outlook & PowerPoint), a range of work procedures such as Finance, HR matters, Safety, Labour Matters. Administration procedures relating to specific working environment including norms and standards. Reporting procedures, procurement directives and procedures. Skills: Planning and organising, sound analytical thinking, good interpersonal relation, problem solving, decision-making and maintaining discipline. Conflict resolution, Good verbal communication and report writing skills. Ability to liaise with internal and external stakeholders (i.e. Auditor General of South Africa, Gauteng Audit Service and any other stakeholders). Loyal and strongly orientated towards teamwork, ability to operate independently, must hold high level of professionalism, confidentiality, integrity and ethical conduct. The following will be an added advantage: Supervision skills, previous experience in audit environment or completed audit articles.",
    "duties": "Monitor incidents and emerging risk reported. Monitor implementation of audit action plans. Prepare risk-based audits, financial and non-financial pre-audits and internal control assessments. Facilitate and monitor operational risk registers for all hospital business units. Monitor strategic risk register under manager\u2019s supervision. Orientate new staff on audit, risk and ethics. Conduct risk awareness campaigns. Delegated to various committees. Be abreast with legislative laws, regulations and guidelines as well as Department\u2019s circulars, policies and procedure manuals. Render Departmental administrative support service. Compile and draft management reports. (With recommendation were necessary).",
    "notes": "Kindly note that No payment of any kind is required when applying for posts advertised by the Gauteng Department of Health. The Department reserves the right not to fill any advertised posts. Applications should be submitted strictly online at the following E-Recruitment portal: https://jobs.gauteng.gov.za.No hand-delivered, faxed, or emailed applications will be accepted. For assistance with online applications please email your query to healthjobqueries@gauteng.gov.za. Application should be accompanied by a fully completed and signed new Z83 form obtainable from any Public Service Department or on the internet at www.dpsa.gov.za/documents.The Z83 form must be fully completed and singed by the applicant. The following must be considered in relation to the completion of the Z83 by applicant. All the fields in Part A, Part C and Part D must be completed. Leave the following question blank if they are not possession of such: \u201dIf your profession or occupation requires official registration, provide date and particulars of registration\u201d. Application without proof of a new Z83 application form and detailed CV will be disqualified. Application must indicate the post reference number on their application. Shortlisted candidates will receive communication from HR Unit to submit certified copies of educational qualifications and other relevant documents not older than 6 months on or before the day of the interview). Personnel Suitability Checks (criminal checks, citizenship checks, qualification verification, company directorship, social media, financial record checks, reference checks) must be conducted prior appointment. Candidates in possession of a foreign qualification must furnish the Department with an evaluation certificate from the South African Qualification Authority (SAQA). Applicants with foreign qualification remain responsible for ensuring that their qualification are evaluated by the South African Qualification Authority (SAQA). The recommended candidate may be subjected to medical surveillance as require by the Occupational Health and Safety Act 5/1993. The Gauteng Department of Health is guided by the principles of Employment Equity. People with disabilities are encouraged to apply.",
    "full_text": "HOME\nJOBS\nABOUT US\nACCOUNT\n\n\n\nJob Details\nDepartment of Health\nAdministration Officer\nReference Number : REFS/024368\nDirectorate : Risk Management and Internal Control\nNumber of Posts : 1\nPackage : R 325 101.00 (per annum) plus benefits\nEnquiries : Ms. M. Dikamotse Tel No - 011 488 4841 Ms L Maseko Tel No - 011 488 3711\n\nRequirements :\n\nGrade 12 or equivalent with more than 10 years in Auditing, Accounting or Risk Management experience or National Diploma or Degree from a recognized SAQA tertiary institution in Auditing, Accounting or Risk Management between 0 and 2 years in Auditing, Accounting or Risk Management experience. Knowledge: Sound knowledge of Auditing, Accounting or Risk Management. In-basic knowledge and insight in Treasury Regulations and Public Finance Management Act. Customer relations. Computer literacy- MS Office (Word, Excel, Outlook & PowerPoint), a range of work procedures such as Finance, HR matters, Safety, Labour Matters. Administration procedures relating to specific working environment including norms and standards. Reporting procedures, procurement directives and procedures. Skills: Planning and organising, sound analytical thinking, good interpersonal relation, problem solving, decision-making and maintaining discipline. Conflict resolution, Good verbal communication and report writing skills. Ability to liaise with internal and external stakeholders (i.e. Auditor General of South Africa, Gauteng Audit Service and any other stakeholders). Loyal and strongly orientated towards teamwork, ability to operate independently, must hold high level of professionalism, confidentiality, integrity and ethical conduct. The following will be an added advantage: Supervision skills, previous experience in audit environment or completed audit articles.\n\nDuties :\n\nMonitor incidents and emerging risk reported. Monitor implementation of audit action plans. Prepare risk-based audits, financial and non-financial pre-audits and internal control assessments. Facilitate and monitor operational risk registers for all hospital business units. Monitor strategic risk register under manager\u2019s supervision. Orientate new staff on audit, risk and ethics. Conduct risk awareness campaigns. Delegated to various committees. Be abreast with legislative laws, regulations and guidelines as well as Department\u2019s circulars, policies and procedure manuals. Render Departmental administrative support service. Compile and draft management reports. (With recommendation were necessary).\n\nNotes :\n\nKindly note that No payment of any kind is required when applying for posts advertised by the Gauteng Department of Health. The Department reserves the right not to fill any advertised posts. Applications should be submitted strictly online at the following E-Recruitment portal: https://jobs.gauteng.gov.za.No hand-delivered, faxed, or emailed applications will be accepted. For assistance with online applications please email your query to healthjobqueries@gauteng.gov.za. Application should be accompanied by a fully completed and signed new Z83 form obtainable from any Public Service Department or on the internet at www.dpsa.gov.za/documents.The Z83 form must be fully completed and singed by the applicant. The following must be considered in relation to the completion of the Z83 by applicant. All the fields in Part A, Part C and Part D must be completed. Leave the following question blank if they are not possession of such: \u201dIf your profession or occupation requires official registration, provide date and particulars of registration\u201d. Application without proof of a new Z83 application form and detailed CV will be disqualified. Application must indicate the post reference number on their application. Shortlisted candidates will receive communication from HR Unit to submit certified copies of educational qualifications and other relevant documents not older than 6 months on or before the day of the interview). Personnel Suitability Checks (criminal checks, citizenship checks, qualification verification, company directorship, social media, financial record checks, reference checks) must be conducted prior appointment. Candidates in possession of a foreign qualification must furnish the Department with an evaluation certificate from the South African Qualification Authority (SAQA). Applicants with foreign qualification remain responsible for ensuring that their qualification are evaluated by the South African Qualification Authority (SAQA). The recommended candidate may be subjected to medical surveillance as require by the Occupational Health and Safety Act 5/1993. The Gauteng Department of Health is guided by the principles of Employment Equity. People with disabilities are encouraged to apply.\n\nEmployer : Department of Health\n\nLocation : Charlotte Maxeke Johannesburg Academic Hospital\n\nClosing Date : 09-01-2026\n\n\n\nCriteria Questions\nDo you have Grade 12 or equivalent with more than 10 years in Auditing, Accounting or Risk Management experience or National Diploma or Degree from a recognized SAQA tertiary institution in Auditing, Accounting Risk Management between 0 and 2 years in Auditing, Accounting or Risk Management experience?\n\n\n\nPlease Notes :\n\nDue to the large number of applications we envisage receiving, applications will not be acknowledged. If you do not receive any response within 3 months, please accept that your application was not successful.\n\n\nFind us\nAddress\n75 Fox Street, Mashalltown\nJohannesburg\n2000\n\nCall us\n\nPhone\n080 022 8827\nEmail\nsupport@gauteng.gov.za\n\nQuick Links\nAll Jobs\nAbout Us\n\n\u00a9 Gauteng Provincial Government 2026 . Powered by Department of e-Government"
  }
]