[
  {
    "position": "CLINICAL PROGRAM COORDINATOR",
    "location": "Leratong Hospital",
    "package": "R 549 192 per annum (Plus Benefits)",
    "closing_date": "2026/01/16",
    "link": "https://jobs.gauteng.gov.za/Public/ViewJob.aspx?u=E7CSZ5GRR4E7dh6BW+s38Q==",
    "title": "CLINICAL PROGRAM COORDINATOR",
    "reference_number": "refs/034961",
    "directorate": "HUMAN RESOURCE (OHS)",
    "centre": "Leratong Hospital",
    "package_detail": "R 549 192 per annum (Plus Benefits)",
    "closing_date_detail": "16-01-2026",
    "enquiries": "Ms N Serobatse (011) 411-3563 / Ms M Mabiletse (011)411-3677",
    "requirements": "Grade12 or equivalent/NQF level/. A R425 qualification (i.e., diploma / degree in nursing) or equivalent qualification that allows registration with SANC as a professional nurse. Current registration with SANC. A minimum of 7 years appropriate/recognisable experience in nursing after registration as Professional Nurse with the SANC in General Nursing, of which 3 years must be relevant experience in Occupational Health and Safety environment. A post basic nursing qualification with duration of at least 1 year accredited by SANC in Occupational Health Safety. Current SANC registration. Basic computer literacy and driver\u2019s license are mandatory. Knowledge of Occupational Health AND safety Act 85 of 1993, COID Act 130 of 1993 including other related legal framework and PRAAD. Knowledge and application of policies governing the Public Service including Quality Assurance, PILIR, PRAAD and EHWP Strategic Framework. Be able to work independently. Skilled to develop on-going training in OHS principles to all categories of staff good communication, report writing and facilitation skills. Sound organizing, planning, presentation skills. Counselling, decision making, good communication skills.",
    "duties": "Implementation of Occupational Health and Safety Act 85 of 1993 and COID Act 130 of 1993. Conduct workplace hazard identification and risk assessment (HIRA) in liaison with managers and ensure there are safe operating procedures where necessary. Conduct training to all categories of personnel. Perform medical surveillance. Maintain all appropriate records and documents relevant to OHS. Participate in Institutions\u2019 and Province\u2019s determined Committees, Task Teams, and Forum for service improvement. Facilitate, implementation of National, Provincial legislation regarding OHS protocols and monitoring thereof. Develop and monitor the implementation of education and training programs in field. Active participation in Employees wellness program. Assist with waste management. Management of (IOD)injury on duty. Active participation in PILIR committee development and maintenance of OHS structure according to legal requirements. Working closely with IPC and EAP coordinators.",
    "notes": "Applications should be submitted strictly online at the following E-Recruitment portal: http://jobs.gauteng.gov.za. No hand-delivered, faxed, or emailed applications will be accepted. For assistance with online applications please email your query to healthjobqueries@gauteng.gov.za . NB: Where Driver\u2019s Licence is mandatory, exception will be granted for people with disabilities. Application should be accompanied by a fully completed and signed new Z83 application form obtainable from any Public Service Department or on the internet at www.dpsa.gov.za/documents plus a recently updated comprehensive Curriculum Vitae (CV), Registration Certificate with relevant professional body (HPCSA) and a proof of current registration (Annual Practicing Certificate/Card). Applications without proof of a new Z83 application form, a detailed CV, registration certificate and a proof of current registration card/certificate with relevant professional body will be disqualified. (Shortlisted candidates will receive communication from HR to submit certified copies of educational qualifications and other relevant documents not older than 6 months on or before the day of the interview). It is the applicant\u2019s responsibility to have foreign qualifications evaluated by the South African Qualifications Authority (SAQA). All foreign qualification must be accompanied by evaluation certificate from the South African Qualification Authority (SAQA). Correspondence will only be limited to shortlisted candidates. If you have not been contacted within 3 months of the closing date of this advertisement, please accept that your application was unsuccessful. Suitable candidates will be subjected to a personnel suitability check (criminal record, citizenship, credit record checks, qualification verification and employment verification). Where applicable, candidates will be subjected to a skills/knowledge test. The recommended candidate may be subjected to Medical Surveillance as required by the Occupational Health and Safety Act, Act 5/1993. It is Department\u2019s intention to promote representivity (race, gender, and disability) in the Public Service through the filling of these posts. The Department reserves the right not to appoint/fill this post. WOMEN AND PEOPLE WITH DISABILITY ARE ENCOURAGED TO APPLY.",
    "full_text": "HOME\nJOBS\nABOUT US\nACCOUNT\n\n\n\nJob Details\nDepartment of Health\nCLINICAL PROGRAM COORDINATOR\nReference Number : refs/034961\nDirectorate : HUMAN RESOURCE (OHS)\nNumber of Posts : 1\nPackage : R 549 192 per annum (Plus Benefits)\nEnquiries : Ms N Serobatse (011) 411-3563 / Ms M Mabiletse (011)411-3677\n\nRequirements :\n\nGrade12 or equivalent/NQF level/. A R425 qualification (i.e., diploma / degree in nursing) or equivalent qualification that allows registration with SANC as a professional nurse. Current registration with SANC. A minimum of 7 years appropriate/recognisable experience in nursing after registration as Professional Nurse with the SANC in General Nursing, of which 3 years must be relevant experience in Occupational Health and Safety environment. A post basic nursing qualification with duration of at least 1 year accredited by SANC in Occupational Health Safety. Current SANC registration. Basic computer literacy and driver\u2019s license are mandatory. Knowledge of Occupational Health AND safety Act 85 of 1993, COID Act 130 of 1993 including other related legal framework and PRAAD. Knowledge and application of policies governing the Public Service including Quality Assurance, PILIR, PRAAD and EHWP Strategic Framework. Be able to work independently. Skilled to develop on-going training in OHS principles to all categories of staff good communication, report writing and facilitation skills. Sound organizing, planning, presentation skills. Counselling, decision making, good communication skills.\n\nDuties :\n\nImplementation of Occupational Health and Safety Act 85 of 1993 and COID Act 130 of 1993. Conduct workplace hazard identification and risk assessment (HIRA) in liaison with managers and ensure there are safe operating procedures where necessary. Conduct training to all categories of personnel. Perform medical surveillance. Maintain all appropriate records and documents relevant to OHS. Participate in Institutions\u2019 and Province\u2019s determined Committees, Task Teams, and Forum for service improvement. Facilitate, implementation of National, Provincial legislation regarding OHS protocols and monitoring thereof. Develop and monitor the implementation of education and training programs in field. Active participation in Employees wellness program. Assist with waste management. Management of (IOD)injury on duty. Active participation in PILIR committee development and maintenance of OHS structure according to legal requirements. Working closely with IPC and EAP coordinators.\n\nNotes :\n\nApplications should be submitted strictly online at the following E-Recruitment portal: http://jobs.gauteng.gov.za. No hand-delivered, faxed, or emailed applications will be accepted. For assistance with online applications please email your query to healthjobqueries@gauteng.gov.za . NB: Where Driver\u2019s Licence is mandatory, exception will be granted for people with disabilities. Application should be accompanied by a fully completed and signed new Z83 application form obtainable from any Public Service Department or on the internet at www.dpsa.gov.za/documents plus a recently updated comprehensive Curriculum Vitae (CV), Registration Certificate with relevant professional body (HPCSA) and a proof of current registration (Annual Practicing Certificate/Card). Applications without proof of a new Z83 application form, a detailed CV, registration certificate and a proof of current registration card/certificate with relevant professional body will be disqualified. (Shortlisted candidates will receive communication from HR to submit certified copies of educational qualifications and other relevant documents not older than 6 months on or before the day of the interview). It is the applicant\u2019s responsibility to have foreign qualifications evaluated by the South African Qualifications Authority (SAQA). All foreign qualification must be accompanied by evaluation certificate from the South African Qualification Authority (SAQA). Correspondence will only be limited to shortlisted candidates. If you have not been contacted within 3 months of the closing date of this advertisement, please accept that your application was unsuccessful. Suitable candidates will be subjected to a personnel suitability check (criminal record, citizenship, credit record checks, qualification verification and employment verification). Where applicable, candidates will be subjected to a skills/knowledge test. The recommended candidate may be subjected to Medical Surveillance as required by the Occupational Health and Safety Act, Act 5/1993. It is Department\u2019s intention to promote representivity (race, gender, and disability) in the Public Service through the filling of these posts. The Department reserves the right not to appoint/fill this post. WOMEN AND PEOPLE WITH DISABILITY ARE ENCOURAGED TO APPLY.\n\nEmployer : Department of Health\n\nLocation : Leratong Hospital\n\nClosing Date : 16-01-2026\n\n\n\nCriteria Questions\nDo you have a R425 qualification (i.e., diploma / degree in nursing) or equivalent qualification that allows registration with SANC as a professional nurse?\nDo you have a minimum of 7 years appropriate/recognisable experience in nursing after registration as Professional Nurse with the SANC in General Nursing, of which 3 years must be relevant experience in Occupational Health and Safety environment?\n\n\n\nPlease Notes :\n\nDue to the large number of applications we envisage receiving, applications will not be acknowledged. If you do not receive any response within 3 months, please accept that your application was not successful.\n\n\nFind us\nAddress\n75 Fox Street, Mashalltown\nJohannesburg\n2000\n\nCall us\n\nPhone\n080 022 8827\nEmail\nsupport@gauteng.gov.za\n\nQuick Links\nAll Jobs\nAbout Us\n\n\u00a9 Gauteng Provincial Government 2026 . Powered by Department of e-Government"
  },
  {
    "position": "PORTERS LEVEL 2",
    "location": "Leratong Hospital",
    "package": "R 138 486 per annum (PLUS BENEFITS)",
    "closing_date": "2026/01/16",
    "link": "https://jobs.gauteng.gov.za/Public/ViewJob.aspx?u=57glvgJbW+LZ7A9Nhblgyw==",
    "title": "PORTERS LEVEL 2",
    "reference_number": "REFS/034960",
    "directorate": "PATIENT AFFAIRS",
    "centre": "Leratong Hospital",
    "package_detail": "R 138 486 per annum (PLUS BENEFITS)",
    "closing_date_detail": "16-01-2026",
    "enquiries": "Ms N Serobatse (011) 411-3563 / Ms M Mabiletse (011)411-3677",
    "requirements": "Grade 10/ABET level 4, vocational studies or equivalent. Must be able to read and write, be able to communicate in more than one official language. Knowledge of Batho Pele Principles and other legislated prescripts.",
    "duties": "Ensure transportation of patient from one point to the other, assist in off-loading of patients from private cars and ambulance, ensure availability of clean wheelchairs and stretchers for patient use, assist in mortuary during weekends, after hours and public holidays. Record mortuary temperatures during weekends, public holidays. Must be able to push patients on a stretcher or wheelchair. Be able to perform any other duties as requested by the supervisor.",
    "notes": "Applications should be submitted strictly online at the following E-Recruitment portal: http://jobs.gauteng.gov.za. No hand-delivered, faxed, or emailed applications will be accepted. For assistance with online applications please email your query to healthjobqueries@gauteng.gov.za. NB: Where Driver\u2019s Licence is mandatory, exception will be granted for people with disabilities. Application should be accompanied by a fully completed and signed new Z83 application form obtainable from any Public Service Department or on the internet at www.dpsa.gov.za/documents plus a recently updated comprehensive Curriculum Vitae (CV). Applications without proof of a new Z83 application form and detailed CV will be disqualified. (Shortlisted candidates will receive communication from HR to submit certified copies of educational qualifications and other relevant documents not older than 6 months on or before the day of the interview). It is the applicant\u2019s responsibility to have foreign qualifications evaluated by the South African Qualifications Authority (SAQA). All foreign qualification must be accompanied by evaluation certificate from the South African Qualification Authority (SAQA). Correspondence will only be limited to shortlisted candidates. Suitable candidates will be subjected to a personnel suitability check (criminal record, citizenship, credit record checks, qualification verification and employment verification). Where applicable, candidates will be subjected to a skills/knowledge test. The recommended candidate may be subjected to Medical Surveillance as required by the Occupational Health and Safety Act, Act 5/1993. It is Department\u2019s intention to promote representivity (race, gender, and disability) in the Public Service through the filling of these posts. The Department reserves the right not to appoint/fill this post. WOMEN AND PEOPLE WITH DISABILITY ARE ENCOURAGED TO APPLY.",
    "full_text": "HOME\nJOBS\nABOUT US\nACCOUNT\n\n\n\nJob Details\nDepartment of Health\nPORTERS LEVEL 2\nReference Number : REFS/034960\nDirectorate : PATIENT AFFAIRS\nNumber of Posts : 2\nPackage : R 138 486 per annum (PLUS BENEFITS)\nEnquiries : Ms N Serobatse (011) 411-3563 / Ms M Mabiletse (011)411-3677\n\nRequirements :\n\nGrade 10/ABET level 4, vocational studies or equivalent. Must be able to read and write, be able to communicate in more than one official language. Knowledge of Batho Pele Principles and other legislated prescripts.\n\nDuties :\n\nEnsure transportation of patient from one point to the other, assist in off-loading of patients from private cars and ambulance, ensure availability of clean wheelchairs and stretchers for patient use, assist in mortuary during weekends, after hours and public holidays. Record mortuary temperatures during weekends, public holidays. Must be able to push patients on a stretcher or wheelchair. Be able to perform any other duties as requested by the supervisor.\n\nNotes :\n\nApplications should be submitted strictly online at the following E-Recruitment portal: http://jobs.gauteng.gov.za. No hand-delivered, faxed, or emailed applications will be accepted. For assistance with online applications please email your query to healthjobqueries@gauteng.gov.za. NB: Where Driver\u2019s Licence is mandatory, exception will be granted for people with disabilities. Application should be accompanied by a fully completed and signed new Z83 application form obtainable from any Public Service Department or on the internet at www.dpsa.gov.za/documents plus a recently updated comprehensive Curriculum Vitae (CV). Applications without proof of a new Z83 application form and detailed CV will be disqualified. (Shortlisted candidates will receive communication from HR to submit certified copies of educational qualifications and other relevant documents not older than 6 months on or before the day of the interview). It is the applicant\u2019s responsibility to have foreign qualifications evaluated by the South African Qualifications Authority (SAQA). All foreign qualification must be accompanied by evaluation certificate from the South African Qualification Authority (SAQA). Correspondence will only be limited to shortlisted candidates. Suitable candidates will be subjected to a personnel suitability check (criminal record, citizenship, credit record checks, qualification verification and employment verification). Where applicable, candidates will be subjected to a skills/knowledge test. The recommended candidate may be subjected to Medical Surveillance as required by the Occupational Health and Safety Act, Act 5/1993. It is Department\u2019s intention to promote representivity (race, gender, and disability) in the Public Service through the filling of these posts. The Department reserves the right not to appoint/fill this post. WOMEN AND PEOPLE WITH DISABILITY ARE ENCOURAGED TO APPLY.\n\nEmployer : Department of Health\n\nLocation : Leratong Hospital\n\nClosing Date : 16-01-2026\n\n\n\nCriteria Questions\nDo you have a grade 10/ABET level 4, vocational studies or equivalent?\nAre you able to read and write?\n\n\n\nPlease Notes :\n\nDue to the large number of applications we envisage receiving, applications will not be acknowledged. If you do not receive any response within 3 months, please accept that your application was not successful.\n\n\nFind us\nAddress\n75 Fox Street, Mashalltown\nJohannesburg\n2000\n\nCall us\n\nPhone\n080 022 8827\nEmail\nsupport@gauteng.gov.za\n\nQuick Links\nAll Jobs\nAbout Us\n\n\u00a9 Gauteng Provincial Government 2026 . Powered by Department of e-Government"
  },
  {
    "position": "OPERATOR LEVEL 3",
    "location": "Leratong Hospital",
    "package": "R 163 680.00 per annum (plus benefits)",
    "closing_date": "2026/01/16",
    "link": "https://jobs.gauteng.gov.za/Public/ViewJob.aspx?u=57glvgJbW+Ku1vNSGU/jOg==",
    "title": "OPERATOR LEVEL 3",
    "reference_number": "REFS/034959",
    "directorate": "THEATRE AND CSSD",
    "centre": "Leratong Hospital",
    "package_detail": "R 163 680.00 per annum (plus benefits)",
    "closing_date_detail": "16-01-2026",
    "enquiries": "Ms N Serobatse (011) 411-3563 / Ms M Mabiletse (011)411-3677",
    "requirements": "Grade 10 or equivalent NQF Level 2. Be able to read and write English. Good communication and planning skills. Experience in CSSD and Theatre will be an added advantage. Must be prepared to work under pressure and in a team. Must be able to cope with physical demands of the positions. Good understanding of Batho Pele Principles. Be prepared to work shifts and be on rotations.",
    "duties": "Be able to maintain infection prevention and control. Knowledge of Principle of infection control in the working area and differentiate between a clean and dirty area. Dispose waste according to internal policy. Collect CSSD instruments from Emergency Department (Casualty), Maternity, ICU and Theatres. Responsible to ensure that the instruments and Loan Sets received are complete and in good working condition. Responsible for cleaning, sorting, compiling, packing and autoclaving of instruments. Packing of soft packs. Be able to operate instrument washer and autoclaves. Unpack clean linen from Linen Room, folding of linen and gowns according to principles. Attend to instruments register and daily stats. Run Attest and Bowie Dick tests for quality control. Maintain growth / ethical standard and self \u2013 development. Perform duties as required per job description. Ensure that Surgeons\u2019 boots are cleaned regularly. Perform any other lawful and reasonable duties as delegated by the Supervisor. Work under Supervision of a Professional Nurse.",
    "notes": "Applications should be submitted strictly online at the following E-Recruitment portal: http://jobs.gauteng.gov.za. No hand-delivered, faxed, or emailed applications will be accepted. For assistance with online applications please email your query to healthjobqueries@gauteng.gov.za. NB: Where Driver\u2019s Licence is mandatory, exception will be granted for people with disabilities. Application should be accompanied by a fully completed and signed new Z83 application form obtainable from any Public Service Department or on the internet at www.dpsa.gov.za/documents plus a recently updated comprehensive Curriculum Vitae (CV). Applications without proof of a new Z83 application form and detailed CV will be disqualified. (Shortlisted candidates will receive communication from HR to submit certified copies of educational qualifications and other relevant documents not older than 6 months on or before the day of the interview). It is the applicant\u2019s responsibility to have foreign qualifications evaluated by the South African Qualifications Authority (SAQA). All foreign qualification must be accompanied by evaluation certificate from the South African Qualification Authority (SAQA). Correspondence will only be limited to shortlisted candidates. Suitable candidates will be subjected to a personnel suitability check (criminal record, citizenship, credit record checks, qualification verification and employment verification). Where applicable, candidates will be subjected to a skills/knowledge test. The recommended candidate may be subjected to Medical Surveillance as required by the Occupational Health and Safety Act, Act 5/1993. It is Department\u2019s intention to promote representivity (race, gender, and disability) in the Public Service through the filling of these posts. The Department reserves the right not to appoint/fill this post. WOMEN AND PEOPLE WITH DISABILITY ARE ENCOURAGED TO APPLY.",
    "full_text": "HOME\nJOBS\nABOUT US\nACCOUNT\n\n\n\nJob Details\nDepartment of Health\nOPERATOR LEVEL 3\nReference Number : REFS/034959\nDirectorate : THEATRE AND CSSD\nNumber of Posts : 3\nPackage : R 163 680.00 per annum (plus benefits)\nEnquiries : Ms N Serobatse (011) 411-3563 / Ms M Mabiletse (011)411-3677\n\nRequirements :\n\nGrade 10 or equivalent NQF Level 2. Be able to read and write English. Good communication and planning skills. Experience in CSSD and Theatre will be an added advantage. Must be prepared to work under pressure and in a team. Must be able to cope with physical demands of the positions. Good understanding of Batho Pele Principles. Be prepared to work shifts and be on rotations.\n\nDuties :\n\nBe able to maintain infection prevention and control. Knowledge of Principle of infection control in the working area and differentiate between a clean and dirty area. Dispose waste according to internal policy. Collect CSSD instruments from Emergency Department (Casualty), Maternity, ICU and Theatres. Responsible to ensure that the instruments and Loan Sets received are complete and in good working condition. Responsible for cleaning, sorting, compiling, packing and autoclaving of instruments. Packing of soft packs. Be able to operate instrument washer and autoclaves. Unpack clean linen from Linen Room, folding of linen and gowns according to principles. Attend to instruments register and daily stats. Run Attest and Bowie Dick tests for quality control. Maintain growth / ethical standard and self \u2013 development. Perform duties as required per job description. Ensure that Surgeons\u2019 boots are cleaned regularly. Perform any other lawful and reasonable duties as delegated by the Supervisor. Work under Supervision of a Professional Nurse.\n\nNotes :\n\nApplications should be submitted strictly online at the following E-Recruitment portal: http://jobs.gauteng.gov.za. No hand-delivered, faxed, or emailed applications will be accepted. For assistance with online applications please email your query to healthjobqueries@gauteng.gov.za. NB: Where Driver\u2019s Licence is mandatory, exception will be granted for people with disabilities. Application should be accompanied by a fully completed and signed new Z83 application form obtainable from any Public Service Department or on the internet at www.dpsa.gov.za/documents plus a recently updated comprehensive Curriculum Vitae (CV). Applications without proof of a new Z83 application form and detailed CV will be disqualified. (Shortlisted candidates will receive communication from HR to submit certified copies of educational qualifications and other relevant documents not older than 6 months on or before the day of the interview). It is the applicant\u2019s responsibility to have foreign qualifications evaluated by the South African Qualifications Authority (SAQA). All foreign qualification must be accompanied by evaluation certificate from the South African Qualification Authority (SAQA). Correspondence will only be limited to shortlisted candidates. Suitable candidates will be subjected to a personnel suitability check (criminal record, citizenship, credit record checks, qualification verification and employment verification). Where applicable, candidates will be subjected to a skills/knowledge test. The recommended candidate may be subjected to Medical Surveillance as required by the Occupational Health and Safety Act, Act 5/1993. It is Department\u2019s intention to promote representivity (race, gender, and disability) in the Public Service through the filling of these posts. The Department reserves the right not to appoint/fill this post. WOMEN AND PEOPLE WITH DISABILITY ARE ENCOURAGED TO APPLY.\n\nEmployer : Department of Health\n\nLocation : Leratong Hospital\n\nClosing Date : 16-01-2026\n\n\n\nCriteria Questions\nDo you have a grade 10 or equivalent NQF Level 2?\nAre you able to read and write English?\n\n\n\nPlease Notes :\n\nDue to the large number of applications we envisage receiving, applications will not be acknowledged. If you do not receive any response within 3 months, please accept that your application was not successful.\n\n\nFind us\nAddress\n75 Fox Street, Mashalltown\nJohannesburg\n2000\n\nCall us\n\nPhone\n080 022 8827\nEmail\nsupport@gauteng.gov.za\n\nQuick Links\nAll Jobs\nAbout Us\n\n\u00a9 Gauteng Provincial Government 2026 . Powered by Department of e-Government"
  },
  {
    "position": "SECURITY LEVEL 3",
    "location": "Leratong Hospital",
    "package": "R 163 680.00 per annum (Plus Benefits)",
    "closing_date": "2026/01/16",
    "link": "https://jobs.gauteng.gov.za/Public/ViewJob.aspx?u=57glvgJbW+JhXqiPuI3QTw==",
    "title": "SECURITY LEVEL 3",
    "reference_number": "REFS/034958",
    "directorate": "SECURITY DEPARTMENT",
    "centre": "Leratong Hospital",
    "package_detail": "R 163 680.00 per annum (Plus Benefits)",
    "closing_date_detail": "16-01-2026",
    "enquiries": "Ms N Serobatse (011) 411-3563 / Ms M Mabiletse (011)411-3677",
    "requirements": "Grade 10 or equivalent qualification, Grade C security certificate with valid PSIRA registration. No criminal record. Ability to read and write. Applicants must be able to communicate in more than one official languages. Must be prepared to work shifts, weekends, and public holidays. Knowledge of security prescripts governing the public sector. Knowledge of Batho Pele principles",
    "duties": "Ensure safety and security of staff, assets and visitors, mending of the access control, searching of vehicles, staff and patients entering and leaving the institution. Perform hourly patrols within the institution, parking areas, around perimeter fence and report any abnormalities or suspicious moves. Monitor the CCTV camera. Attend sectional meetings and present reports. Assist in other units through backups.",
    "notes": "Applications should be submitted strictly online at the following E-Recruitment portal: http://jobs.gauteng.gov.za. No hand-delivered, faxed, or emailed applications will be accepted. For assistance with online applications please email your query to healthjobqueries@gauteng.gov.za. NB: Where Driver\u2019s Licence is mandatory, exception will be granted for people with disabilities. Application should be accompanied by a fully completed and signed new Z83 application form obtainable from any Public Service Department or on the internet at www.dpsa.gov.za/documents plus a recently updated comprehensive Curriculum Vitae (CV). Applications without proof of a new Z83 application form and detailed CV will be disqualified. (Shortlisted candidates will receive communication from HR to submit certified copies of educational qualifications and other relevant documents not older than 6 months on or before the day of the interview). It is the applicant\u2019s responsibility to have foreign qualifications evaluated by the South African Qualifications Authority (SAQA). All foreign qualification must be accompanied by evaluation certificate from the South African Qualification Authority (SAQA). Correspondence will only be limited to shortlisted candidates. Suitable candidates will be subjected to a personnel suitability check (criminal record, citizenship, credit record checks, qualification verification and employment verification). Where applicable, candidates will be subjected to a skills/knowledge test. The recommended candidate may be subjected to Medical Surveillance as required by the Occupational Health and Safety Act, Act 5/1993. It is Department\u2019s intention to promote representivity (race, gender, and disability) in the Public Service through the filling of these posts. The Department reserves the right not to appoint/fill this post. WOMEN AND PEOPLE WITH DISABILITY ARE ENCOURAGED TO APPLY.",
    "full_text": "HOME\nJOBS\nABOUT US\nACCOUNT\n\n\n\nJob Details\nDepartment of Health\nSECURITY LEVEL 3\nReference Number : REFS/034958\nDirectorate : SECURITY DEPARTMENT\nNumber of Posts : 3\nPackage : R 163 680.00 per annum (Plus Benefits)\nEnquiries : Ms N Serobatse (011) 411-3563 / Ms M Mabiletse (011)411-3677\n\nRequirements :\n\nGrade 10 or equivalent qualification, Grade C security certificate with valid PSIRA registration. No criminal record. Ability to read and write. Applicants must be able to communicate in more than one official languages. Must be prepared to work shifts, weekends, and public holidays. Knowledge of security prescripts governing the public sector. Knowledge of Batho Pele principles\n\nDuties :\n\nEnsure safety and security of staff, assets and visitors, mending of the access control, searching of vehicles, staff and patients entering and leaving the institution. Perform hourly patrols within the institution, parking areas, around perimeter fence and report any abnormalities or suspicious moves. Monitor the CCTV camera. Attend sectional meetings and present reports. Assist in other units through backups.\n\nNotes :\n\nApplications should be submitted strictly online at the following E-Recruitment portal: http://jobs.gauteng.gov.za. No hand-delivered, faxed, or emailed applications will be accepted. For assistance with online applications please email your query to healthjobqueries@gauteng.gov.za. NB: Where Driver\u2019s Licence is mandatory, exception will be granted for people with disabilities. Application should be accompanied by a fully completed and signed new Z83 application form obtainable from any Public Service Department or on the internet at www.dpsa.gov.za/documents plus a recently updated comprehensive Curriculum Vitae (CV). Applications without proof of a new Z83 application form and detailed CV will be disqualified. (Shortlisted candidates will receive communication from HR to submit certified copies of educational qualifications and other relevant documents not older than 6 months on or before the day of the interview). It is the applicant\u2019s responsibility to have foreign qualifications evaluated by the South African Qualifications Authority (SAQA). All foreign qualification must be accompanied by evaluation certificate from the South African Qualification Authority (SAQA). Correspondence will only be limited to shortlisted candidates. Suitable candidates will be subjected to a personnel suitability check (criminal record, citizenship, credit record checks, qualification verification and employment verification). Where applicable, candidates will be subjected to a skills/knowledge test. The recommended candidate may be subjected to Medical Surveillance as required by the Occupational Health and Safety Act, Act 5/1993. It is Department\u2019s intention to promote representivity (race, gender, and disability) in the Public Service through the filling of these posts. The Department reserves the right not to appoint/fill this post. WOMEN AND PEOPLE WITH DISABILITY ARE ENCOURAGED TO APPLY.\n\nEmployer : Department of Health\n\nLocation : Leratong Hospital\n\nClosing Date : 16-01-2026\n\n\n\nCriteria Questions\nDo you have a grade 10 or equivalent qualification, Grade C security certificate with valid PSIRA registration?\nAre you able to read and write?\n\n\n\nPlease Notes :\n\nDue to the large number of applications we envisage receiving, applications will not be acknowledged. If you do not receive any response within 3 months, please accept that your application was not successful.\n\n\nFind us\nAddress\n75 Fox Street, Mashalltown\nJohannesburg\n2000\n\nCall us\n\nPhone\n080 022 8827\nEmail\nsupport@gauteng.gov.za\n\nQuick Links\nAll Jobs\nAbout Us\n\n\u00a9 Gauteng Provincial Government 2026 . Powered by Department of e-Government"
  },
  {
    "position": "DRIVERS LEVEL 4",
    "location": "Leratong Hospital",
    "package": "R 193 359.00 per annum (Plus Benefits)",
    "closing_date": "2026/01/16",
    "link": "https://jobs.gauteng.gov.za/Public/ViewJob.aspx?u=57glvgJbW+LIB8faRsAlWw==",
    "title": "DRIVERS LEVEL 4",
    "reference_number": "REFS/034957",
    "directorate": "TRANSPORT DEPARTMENT",
    "centre": "Leratong Hospital",
    "package_detail": "R 193 359.00 per annum (Plus Benefits)",
    "closing_date_detail": "16-01-2026",
    "enquiries": "Ms N Serobatse (011) 411-3563 / Ms M Mabiletse (011)411-3677",
    "requirements": "Grade 12 or equivalent with 3-5 years as a driver. Valid code 10/14 drivers\u2019 licence with PDP. Candidates must have an unendorsed driver\u2019s licence. Must have knowledge of surrounding hospital, and clinics. Must understand legislative prescripts governing the health sector.",
    "duties": ": Transportation of staff, patient and documents. Report any faults regarding the vehicle, be able to change flat tyre if a need arises. Ensure cleanliness of the vehicle. Conduct pre/post trip inspections before embarking on a trip and after using a car. Ensure safe and timeous transportation of staff and patients. Be able to work shifts. Ensure compliance with the department of transport handbook. Report any damages on the vehicles within 24hours. Compile an incident report to report damages. Be able to perform any other duties as requested by the supervisor.",
    "notes": "Applications should be submitted strictly online at the following E-Recruitment portal: http://jobs.gauteng.gov.za. No hand-delivered, faxed, or emailed applications will be accepted. For assistance with online applications please email your query to healthjobqueries@gauteng.gov.za. NB: Where Driver\u2019s Licence is mandatory, exception will be granted for people with disabilities. Application should be accompanied by a fully completed and signed new Z83 application form obtainable from any Public Service Department or on the internet at www.dpsa.gov.za/documents plus a recently updated comprehensive Curriculum Vitae (CV). Applications without proof of a new Z83 application form and detailed CV will be disqualified. (Shortlisted candidates will receive communication from HR to submit certified copies of educational qualifications and other relevant documents not older than 6 months on or before the day of the interview). It is the applicant\u2019s responsibility to have foreign qualifications evaluated by the South African Qualifications Authority (SAQA). All foreign qualification must be accompanied by evaluation certificate from the South African Qualification Authority (SAQA). Correspondence will only be limited to shortlisted candidates. Suitable candidates will be subjected to a personnel suitability check (criminal record, citizenship, credit record checks, qualification verification and employment verification). Where applicable, candidates will be subjected to a skills/knowledge test. The recommended candidate may be subjected to Medical Surveillance as required by the Occupational Health and Safety Act, Act 5/1993. It is Department\u2019s intention to promote representivity (race, gender, and disability) in the Public Service through the filling of these posts. The Department reserves the right not to appoint/fill this post. WOMEN AND PEOPLE WITH DISABILITY ARE ENCOURAGED TO APPLY.",
    "full_text": "HOME\nJOBS\nABOUT US\nACCOUNT\n\n\n\nJob Details\nDepartment of Health\nDRIVERS LEVEL 4\nReference Number : REFS/034957\nDirectorate : TRANSPORT DEPARTMENT\nNumber of Posts : 5\nPackage : R 193 359.00 per annum (Plus Benefits)\nEnquiries : Ms N Serobatse (011) 411-3563 / Ms M Mabiletse (011)411-3677\n\nRequirements :\n\nGrade 12 or equivalent with 3-5 years as a driver. Valid code 10/14 drivers\u2019 licence with PDP. Candidates must have an unendorsed driver\u2019s licence. Must have knowledge of surrounding hospital, and clinics. Must understand legislative prescripts governing the health sector.\n\nDuties :\n\n: Transportation of staff, patient and documents. Report any faults regarding the vehicle, be able to change flat tyre if a need arises. Ensure cleanliness of the vehicle. Conduct pre/post trip inspections before embarking on a trip and after using a car. Ensure safe and timeous transportation of staff and patients. Be able to work shifts. Ensure compliance with the department of transport handbook. Report any damages on the vehicles within 24hours. Compile an incident report to report damages. Be able to perform any other duties as requested by the supervisor.\n\nNotes :\n\nApplications should be submitted strictly online at the following E-Recruitment portal: http://jobs.gauteng.gov.za. No hand-delivered, faxed, or emailed applications will be accepted. For assistance with online applications please email your query to healthjobqueries@gauteng.gov.za. NB: Where Driver\u2019s Licence is mandatory, exception will be granted for people with disabilities. Application should be accompanied by a fully completed and signed new Z83 application form obtainable from any Public Service Department or on the internet at www.dpsa.gov.za/documents plus a recently updated comprehensive Curriculum Vitae (CV). Applications without proof of a new Z83 application form and detailed CV will be disqualified. (Shortlisted candidates will receive communication from HR to submit certified copies of educational qualifications and other relevant documents not older than 6 months on or before the day of the interview). It is the applicant\u2019s responsibility to have foreign qualifications evaluated by the South African Qualifications Authority (SAQA). All foreign qualification must be accompanied by evaluation certificate from the South African Qualification Authority (SAQA). Correspondence will only be limited to shortlisted candidates. Suitable candidates will be subjected to a personnel suitability check (criminal record, citizenship, credit record checks, qualification verification and employment verification). Where applicable, candidates will be subjected to a skills/knowledge test. The recommended candidate may be subjected to Medical Surveillance as required by the Occupational Health and Safety Act, Act 5/1993. It is Department\u2019s intention to promote representivity (race, gender, and disability) in the Public Service through the filling of these posts. The Department reserves the right not to appoint/fill this post. WOMEN AND PEOPLE WITH DISABILITY ARE ENCOURAGED TO APPLY.\n\nEmployer : Department of Health\n\nLocation : Leratong Hospital\n\nClosing Date : 16-01-2026\n\n\n\nCriteria Questions\nDo you have a grade 12 or equivalent with 3-5 years as a driver?\nDo you have a valid code 10/14 drivers\u2019 licence with PDP?\n\n\n\nPlease Notes :\n\nDue to the large number of applications we envisage receiving, applications will not be acknowledged. If you do not receive any response within 3 months, please accept that your application was not successful.\n\n\nFind us\nAddress\n75 Fox Street, Mashalltown\nJohannesburg\n2000\n\nCall us\n\nPhone\n080 022 8827\nEmail\nsupport@gauteng.gov.za\n\nQuick Links\nAll Jobs\nAbout Us\n\n\u00a9 Gauteng Provincial Government 2026 . Powered by Department of e-Government"
  },
  {
    "position": "FOOD SERVICE SUPERVISOR LEVEL 4",
    "location": "Leratong Hospital",
    "package": "R 193 359.00 per annum (Plus Benefits)",
    "closing_date": "2026/01/16",
    "link": "https://jobs.gauteng.gov.za/Public/ViewJob.aspx?u=57glvgJbW+I5tmYtDeCWWg==",
    "title": "FOOD SERVICE SUPERVISOR LEVEL 4",
    "reference_number": "REFS/034956",
    "directorate": "Human Nutrition",
    "centre": "Leratong Hospital",
    "package_detail": "R 193 359.00 per annum (Plus Benefits)",
    "closing_date_detail": "16-01-2026",
    "enquiries": "Ms N Serobatse (011) 411-3563 / Ms M Mabiletse (011)411-3677",
    "requirements": "Grade 10 with at least 3 - 5 years\u2019 experience in a foodservice unit or Grade 12 or higher with 2 \u2013 4 years\u2019 experience in a foodservice unit. Knowledge of equipment and food preparation processes. Knowledge of hygiene and safety principles. Able to work shifts and public Holidays. Be able to rotate to different areas within the food service department. Good communication in English (verbal, written and numerical skills). Must be able to communicate well with people at different levels. Must be able to take initiative. Must be able to work in a team and under pressure. Good planning and organizational skills. Be able to handle conflict. Basic computer literacy would be an advantage.",
    "duties": "Responsible for supervision of all food service personnel and their activities. Responsible for the receiving, storage, issuing and maintaining of stock control. Assist with cost control measures (key control measures). Responsible for supervision of production processes, portioning, dishing up and distribution of meals. Assist with client satisfaction survey and plate wastage. Responsible for the implementation of hygiene and safety processes in the foodservice unit. Responsible for the PMDS of subordinate staff in area of supervision. Assist with disciplinary measures in area of supervision. Render administrative duties according to duty roster. Adhere to all food service guidelines, policies and procedures. Comply with Occupational Health and Safety Act. Perform duties as allocated by the next level manager.",
    "notes": "Applications should be submitted strictly online at the following E-Recruitment portal: http://jobs.gauteng.gov.za. No hand-delivered, faxed, or emailed applications will be accepted. For assistance with online applications please email your query to healthjobqueries@gauteng.gov.za. NB: Where Driver\u2019s Licence is mandatory, exception will be granted for people with disabilities. Application should be accompanied by a fully completed and signed new Z83 application form obtainable from any Public Service Department or on the internet at www.dpsa.gov.za/documents plus a recently updated comprehensive Curriculum Vitae (CV). Applications without proof of a new Z83 application form and detailed CV will be disqualified. (Shortlisted candidates will receive communication from HR to submit certified copies of educational qualifications and other relevant documents not older than 6 months on or before the day of the interview). It is the applicant\u2019s responsibility to have foreign qualifications evaluated by the South African Qualifications Authority (SAQA). All foreign qualification must be accompanied by evaluation certificate from the South African Qualification Authority (SAQA). Correspondence will only be limited to shortlisted candidates. Suitable candidates will be subjected to a personnel suitability check (criminal record, citizenship, credit record checks, qualification verification and employment verification). Where applicable, candidates will be subjected to a skills/knowledge test. The recommended candidate may be subjected to Medical Surveillance as required by the Occupational Health and Safety Act, Act 5/1993. It is Department\u2019s intention to promote representivity (race, gender, and disability) in the Public Service through the filling of these posts. The Department reserves the right not to appoint/fill this post. WOMEN AND PEOPLE WITH DISABILITY ARE ENCOURAGED TO APPLY.",
    "full_text": "HOME\nJOBS\nABOUT US\nACCOUNT\n\n\n\nJob Details\nDepartment of Health\nFOOD SERVICE SUPERVISOR LEVEL 4\nReference Number : REFS/034956\nDirectorate : Human Nutrition\nNumber of Posts : 1\nPackage : R 193 359.00 per annum (Plus Benefits)\nEnquiries : Ms N Serobatse (011) 411-3563 / Ms M Mabiletse (011)411-3677\n\nRequirements :\n\nGrade 10 with at least 3 - 5 years\u2019 experience in a foodservice unit or Grade 12 or higher with 2 \u2013 4 years\u2019 experience in a foodservice unit. Knowledge of equipment and food preparation processes. Knowledge of hygiene and safety principles. Able to work shifts and public Holidays. Be able to rotate to different areas within the food service department. Good communication in English (verbal, written and numerical skills). Must be able to communicate well with people at different levels. Must be able to take initiative. Must be able to work in a team and under pressure. Good planning and organizational skills. Be able to handle conflict. Basic computer literacy would be an advantage.\n\nDuties :\n\nResponsible for supervision of all food service personnel and their activities. Responsible for the receiving, storage, issuing and maintaining of stock control. Assist with cost control measures (key control measures). Responsible for supervision of production processes, portioning, dishing up and distribution of meals. Assist with client satisfaction survey and plate wastage. Responsible for the implementation of hygiene and safety processes in the foodservice unit. Responsible for the PMDS of subordinate staff in area of supervision. Assist with disciplinary measures in area of supervision. Render administrative duties according to duty roster. Adhere to all food service guidelines, policies and procedures. Comply with Occupational Health and Safety Act. Perform duties as allocated by the next level manager.\n\nNotes :\n\nApplications should be submitted strictly online at the following E-Recruitment portal: http://jobs.gauteng.gov.za. No hand-delivered, faxed, or emailed applications will be accepted. For assistance with online applications please email your query to healthjobqueries@gauteng.gov.za. NB: Where Driver\u2019s Licence is mandatory, exception will be granted for people with disabilities. Application should be accompanied by a fully completed and signed new Z83 application form obtainable from any Public Service Department or on the internet at www.dpsa.gov.za/documents plus a recently updated comprehensive Curriculum Vitae (CV). Applications without proof of a new Z83 application form and detailed CV will be disqualified. (Shortlisted candidates will receive communication from HR to submit certified copies of educational qualifications and other relevant documents not older than 6 months on or before the day of the interview). It is the applicant\u2019s responsibility to have foreign qualifications evaluated by the South African Qualifications Authority (SAQA). All foreign qualification must be accompanied by evaluation certificate from the South African Qualification Authority (SAQA). Correspondence will only be limited to shortlisted candidates. Suitable candidates will be subjected to a personnel suitability check (criminal record, citizenship, credit record checks, qualification verification and employment verification). Where applicable, candidates will be subjected to a skills/knowledge test. The recommended candidate may be subjected to Medical Surveillance as required by the Occupational Health and Safety Act, Act 5/1993. It is Department\u2019s intention to promote representivity (race, gender, and disability) in the Public Service through the filling of these posts. The Department reserves the right not to appoint/fill this post. WOMEN AND PEOPLE WITH DISABILITY ARE ENCOURAGED TO APPLY.\n\nEmployer : Department of Health\n\nLocation : Leratong Hospital\n\nClosing Date : 16-01-2026\n\n\n\nCriteria Questions\nDo you have a grade 10 with at least 3 - 5 years\u2019 experience in a foodservice unit or Grade 12 or higher with 2 \u2013 4 years\u2019 experience in a foodservice unit?\nDo you have basic computer literacy?\n\n\n\nPlease Notes :\n\nDue to the large number of applications we envisage receiving, applications will not be acknowledged. If you do not receive any response within 3 months, please accept that your application was not successful.\n\n\nFind us\nAddress\n75 Fox Street, Mashalltown\nJohannesburg\n2000\n\nCall us\n\nPhone\n080 022 8827\nEmail\nsupport@gauteng.gov.za\n\nQuick Links\nAll Jobs\nAbout Us\n\n\u00a9 Gauteng Provincial Government 2026 . Powered by Department of e-Government"
  },
  {
    "position": "FOREMAN/SUPERVISORS LEVEL 4",
    "location": "Leratong Hospital",
    "package": "R 193 359.00 per annum (Plus Benefits)",
    "closing_date": "2026/01/16",
    "link": "https://jobs.gauteng.gov.za/Public/ViewJob.aspx?u=57glvgJbW+LpvK/l/L6tYw==",
    "title": "FOREMAN/SUPERVISORS LEVEL 4",
    "reference_number": "REFS/034955",
    "directorate": "CLEANING DEPARTMENT",
    "centre": "Leratong Hospital",
    "package_detail": "R 193 359.00 per annum (Plus Benefits)",
    "closing_date_detail": "16-01-2026",
    "enquiries": "Ms N Serobatse (011) 411-3563 / Ms M Mabiletse (011)411-3677",
    "requirements": "Grade 12 or equivalent with 3-5 years in cleaning department. Microsoft package. Supervisory skills. Knowledge of occupational health and safety act, infection control and other legislative prescripts that govern the public sector.",
    "duties": "Allocation of cleaners in every unit, conduct spot checks in every unit to ensure a clean and hygienic environment. Ensure availability of cleaning chemicals, consumables and equipment. Ensure that medical/general waste is removed from the units to central storage. Liaise with external stakeholders for collection of waste. Ensure that cleaning is performed twice per and when a need arises. Ensure replenishing of consumables in the bathrooms, public toilets. Compile and presents sectional reports, ensure performance of staff. Ensure timeous submission of documents. Compile a checklist and ensure compliance to it. Ensure adherence to the work schedule. Ensure that cleaners report on duty, perform their duties as expected and leave at the appropriate time. Put measures against extended tea/lunch breaks. Be able to perform any other duties as requested by the supervisor.",
    "notes": "Applications should be submitted strictly online at the following E-Recruitment portal: http://jobs.gauteng.gov.za. No hand-delivered, faxed, or emailed applications will be accepted. For assistance with online applications please email your query to healthjobqueries@gauteng.gov.za. NB: Where Driver\u2019s Licence is mandatory, exception will be granted for people with disabilities. Application should be accompanied by a fully completed and signed new Z83 application form obtainable from any Public Service Department or on the internet at www.dpsa.gov.za/documents plus a recently updated comprehensive Curriculum Vitae (CV). Applications without proof of a new Z83 application form and detailed CV will be disqualified. (Shortlisted candidates will receive communication from HR to submit certified copies of educational qualifications and other relevant documents not older than 6 months on or before the day of the interview). It is the applicant\u2019s responsibility to have foreign qualifications evaluated by the South African Qualifications Authority (SAQA). All foreign qualification must be accompanied by evaluation certificate from the South African Qualification Authority (SAQA). Correspondence will only be limited to shortlisted candidates. Suitable candidates will be subjected to a personnel suitability check (criminal record, citizenship, credit record checks, qualification verification and employment verification). Where applicable, candidates will be subjected to a skills/knowledge test. The recommended candidate may be subjected to Medical Surveillance as required by the Occupational Health and Safety Act, Act 5/1993. It is Department\u2019s intention to promote representivity (race, gender, and disability) in the Public Service through the filling of these posts. The Department reserves the right not to appoint/fill this post. WOMEN AND PEOPLE WITH DISABILITY ARE ENCOURAGED TO APPLY.",
    "full_text": "HOME\nJOBS\nABOUT US\nACCOUNT\n\n\n\nJob Details\nDepartment of Health\nFOREMAN/SUPERVISORS LEVEL 4\nReference Number : REFS/034955\nDirectorate : CLEANING DEPARTMENT\nNumber of Posts : 3\nPackage : R 193 359.00 per annum (Plus Benefits)\nEnquiries : Ms N Serobatse (011) 411-3563 / Ms M Mabiletse (011)411-3677\n\nRequirements :\n\nGrade 12 or equivalent with 3-5 years in cleaning department. Microsoft package. Supervisory skills. Knowledge of occupational health and safety act, infection control and other legislative prescripts that govern the public sector.\n\nDuties :\n\nAllocation of cleaners in every unit, conduct spot checks in every unit to ensure a clean and hygienic environment. Ensure availability of cleaning chemicals, consumables and equipment. Ensure that medical/general waste is removed from the units to central storage. Liaise with external stakeholders for collection of waste. Ensure that cleaning is performed twice per and when a need arises. Ensure replenishing of consumables in the bathrooms, public toilets. Compile and presents sectional reports, ensure performance of staff. Ensure timeous submission of documents. Compile a checklist and ensure compliance to it. Ensure adherence to the work schedule. Ensure that cleaners report on duty, perform their duties as expected and leave at the appropriate time. Put measures against extended tea/lunch breaks. Be able to perform any other duties as requested by the supervisor.\n\nNotes :\n\nApplications should be submitted strictly online at the following E-Recruitment portal: http://jobs.gauteng.gov.za. No hand-delivered, faxed, or emailed applications will be accepted. For assistance with online applications please email your query to healthjobqueries@gauteng.gov.za. NB: Where Driver\u2019s Licence is mandatory, exception will be granted for people with disabilities. Application should be accompanied by a fully completed and signed new Z83 application form obtainable from any Public Service Department or on the internet at www.dpsa.gov.za/documents plus a recently updated comprehensive Curriculum Vitae (CV). Applications without proof of a new Z83 application form and detailed CV will be disqualified. (Shortlisted candidates will receive communication from HR to submit certified copies of educational qualifications and other relevant documents not older than 6 months on or before the day of the interview). It is the applicant\u2019s responsibility to have foreign qualifications evaluated by the South African Qualifications Authority (SAQA). All foreign qualification must be accompanied by evaluation certificate from the South African Qualification Authority (SAQA). Correspondence will only be limited to shortlisted candidates. Suitable candidates will be subjected to a personnel suitability check (criminal record, citizenship, credit record checks, qualification verification and employment verification). Where applicable, candidates will be subjected to a skills/knowledge test. The recommended candidate may be subjected to Medical Surveillance as required by the Occupational Health and Safety Act, Act 5/1993. It is Department\u2019s intention to promote representivity (race, gender, and disability) in the Public Service through the filling of these posts. The Department reserves the right not to appoint/fill this post. WOMEN AND PEOPLE WITH DISABILITY ARE ENCOURAGED TO APPLY.\n\nEmployer : Department of Health\n\nLocation : Leratong Hospital\n\nClosing Date : 16-01-2026\n\n\n\nCriteria Questions\nDo you have a grade 12 or equivalent with 3-5 years in cleaning department?\nDo you have supervisory skills?\n\n\n\nPlease Notes :\n\nDue to the large number of applications we envisage receiving, applications will not be acknowledged. If you do not receive any response within 3 months, please accept that your application was not successful.\n\n\nFind us\nAddress\n75 Fox Street, Mashalltown\nJohannesburg\n2000\n\nCall us\n\nPhone\n080 022 8827\nEmail\nsupport@gauteng.gov.za\n\nQuick Links\nAll Jobs\nAbout Us\n\n\u00a9 Gauteng Provincial Government 2026 . Powered by Department of e-Government"
  },
  {
    "position": "LOGISTICS OFFICER LEVEL 7",
    "location": "Leratong Hospital",
    "package": "R 325 101.00 PER ANNUM (PLUS BENEFITS)",
    "closing_date": "2026/01/16",
    "link": "https://jobs.gauteng.gov.za/Public/ViewJob.aspx?u=57glvgJbW+IrZt+Cf0voxQ==",
    "title": "LOGISTICS OFFICER LEVEL 7",
    "reference_number": "REFS/034954",
    "directorate": "CLEANING DEPARTMENT",
    "centre": "Leratong Hospital",
    "package_detail": "R 325 101.00 PER ANNUM (PLUS BENEFITS)",
    "closing_date_detail": "16-01-2026",
    "enquiries": "Ms N Serobatse (011) 411-3563 / Ms M Mabiletse (011)411-3677",
    "requirements": "Grade 12 or equivalent with 3-5years as a supervisor in cleaning department. A National Diploma (NQF level 6/7) in Public Management/Administration, Business administration, Logistics management will be an added advantage. Must have computer skills. Departmental policies procedures, public finance management act. Basic knowledge of legislations, project management, Batho Pele Principles, planning, organising. Understanding of infection control and occupational health and safety.",
    "duties": "Supervise the foreman/ supervisors in cleaning department. Ensure allocation of cleaners in every unit, ensure availability of cleaning chemicals and equipment. Conduct spot checks in every unit to ensure a clean and hygienic environment. Ensure that high dusting and scrub downs are performed. Ensure that fogging is done when requested. Ensure collection of medical and medical waste from the units, ensure cleanliness of the central storage. Ensure performance management of staff, compile and present reports for cleaning department. Checking compliance with signing of attendance register and checklist in different units. Be able to perform any other duties as requested by the supervisor.",
    "notes": "Applications should be submitted strictly online at the following E-Recruitment portal: http://jobs.gauteng.gov.za. No hand-delivered, faxed, or emailed applications will be accepted. For assistance with online applications please email your query to healthjobqueries@gauteng.gov.za. NB: Where Driver\u2019s Licence is mandatory, exception will be granted for people with disabilities. Application should be accompanied by a fully completed and signed new Z83 application form obtainable from any Public Service Department or on the internet at www.dpsa.gov.za/documents plus a recently updated comprehensive Curriculum Vitae (CV). Applications without proof of a new Z83 application form and detailed CV will be disqualified. (Shortlisted candidates will receive communication from HR to submit certified copies of educational qualifications and other relevant documents not older than 6 months on or before the day of the interview). It is the applicant\u2019s responsibility to have foreign qualifications evaluated by the South African Qualifications Authority (SAQA). All foreign qualification must be accompanied by evaluation certificate from the South African Qualification Authority (SAQA). Correspondence will only be limited to shortlisted candidates. Suitable candidates will be subjected to a personnel suitability check (criminal record, citizenship, credit record checks, qualification verification and employment verification). Where applicable, candidates will be subjected to a skills/knowledge test. The recommended candidate may be subjected to Medical Surveillance as required by the Occupational Health and Safety Act, Act 5/1993. It is Department\u2019s intention to promote representivity (race, gender, and disability) in the Public Service through the filling of these posts. The Department reserves the right not to appoint/fill this post. WOMEN AND PEOPLE WITH DISABILITY ARE ENCOURAGED TO APPLY.",
    "full_text": "HOME\nJOBS\nABOUT US\nACCOUNT\n\n\n\nJob Details\nDepartment of Health\nLOGISTICS OFFICER LEVEL 7\nReference Number : REFS/034954\nDirectorate : CLEANING DEPARTMENT\nNumber of Posts : 1\nPackage : R 325 101.00 PER ANNUM (PLUS BENEFITS)\nEnquiries : Ms N Serobatse (011) 411-3563 / Ms M Mabiletse (011)411-3677\n\nRequirements :\n\nGrade 12 or equivalent with 3-5years as a supervisor in cleaning department. A National Diploma (NQF level 6/7) in Public Management/Administration, Business administration, Logistics management will be an added advantage. Must have computer skills. Departmental policies procedures, public finance management act. Basic knowledge of legislations, project management, Batho Pele Principles, planning, organising. Understanding of infection control and occupational health and safety.\n\nDuties :\n\nSupervise the foreman/ supervisors in cleaning department. Ensure allocation of cleaners in every unit, ensure availability of cleaning chemicals and equipment. Conduct spot checks in every unit to ensure a clean and hygienic environment. Ensure that high dusting and scrub downs are performed. Ensure that fogging is done when requested. Ensure collection of medical and medical waste from the units, ensure cleanliness of the central storage. Ensure performance management of staff, compile and present reports for cleaning department. Checking compliance with signing of attendance register and checklist in different units. Be able to perform any other duties as requested by the supervisor.\n\nNotes :\n\nApplications should be submitted strictly online at the following E-Recruitment portal: http://jobs.gauteng.gov.za. No hand-delivered, faxed, or emailed applications will be accepted. For assistance with online applications please email your query to healthjobqueries@gauteng.gov.za. NB: Where Driver\u2019s Licence is mandatory, exception will be granted for people with disabilities. Application should be accompanied by a fully completed and signed new Z83 application form obtainable from any Public Service Department or on the internet at www.dpsa.gov.za/documents plus a recently updated comprehensive Curriculum Vitae (CV). Applications without proof of a new Z83 application form and detailed CV will be disqualified. (Shortlisted candidates will receive communication from HR to submit certified copies of educational qualifications and other relevant documents not older than 6 months on or before the day of the interview). It is the applicant\u2019s responsibility to have foreign qualifications evaluated by the South African Qualifications Authority (SAQA). All foreign qualification must be accompanied by evaluation certificate from the South African Qualification Authority (SAQA). Correspondence will only be limited to shortlisted candidates. Suitable candidates will be subjected to a personnel suitability check (criminal record, citizenship, credit record checks, qualification verification and employment verification). Where applicable, candidates will be subjected to a skills/knowledge test. The recommended candidate may be subjected to Medical Surveillance as required by the Occupational Health and Safety Act, Act 5/1993. It is Department\u2019s intention to promote representivity (race, gender, and disability) in the Public Service through the filling of these posts. The Department reserves the right not to appoint/fill this post. WOMEN AND PEOPLE WITH DISABILITY ARE ENCOURAGED TO APPLY.\n\nEmployer : Department of Health\n\nLocation : Leratong Hospital\n\nClosing Date : 16-01-2026\n\n\n\nCriteria Questions\nDo you have a grade 12 or equivalent with 3-5years as a supervisor in cleaning department?\nDo you have computer skills?\n\n\n\nPlease Notes :\n\nDue to the large number of applications we envisage receiving, applications will not be acknowledged. If you do not receive any response within 3 months, please accept that your application was not successful.\n\n\nFind us\nAddress\n75 Fox Street, Mashalltown\nJohannesburg\n2000\n\nCall us\n\nPhone\n080 022 8827\nEmail\nsupport@gauteng.gov.za\n\nQuick Links\nAll Jobs\nAbout Us\n\n\u00a9 Gauteng Provincial Government 2026 . Powered by Department of e-Government"
  },
  {
    "position": "LOGISTICS OFFICER LEVEL 7",
    "location": "Leratong Hospital",
    "package": "R 325 101.00 PER ANNUM (PLUS BENEFITS)",
    "closing_date": "2026/01/16",
    "link": "https://jobs.gauteng.gov.za/Public/ViewJob.aspx?u=57glvgJbW+K7Zb+sThOpig==",
    "title": "LOGISTICS OFFICER LEVEL 7",
    "reference_number": "REFS/034953",
    "directorate": "TRANSPORT",
    "centre": "Leratong Hospital",
    "package_detail": "R 325 101.00 PER ANNUM (PLUS BENEFITS)",
    "closing_date_detail": "16-01-2026",
    "enquiries": "Ms N Serobatse (011) 411-3563 / Ms M Mabiletse (011)411-3677",
    "requirements": "Grade 12 or equivalent with 3-5 years in transport department. A National Diploma (NQF level 6/7) in public management/ administration, Business administration, Logistics management or Fleet management will be added advantage Computer skills (Micro soft office). Valid code 10/14 Drivers licence with valid PDP. Good understanding of relevant legislations and prescripts. Departmental policies procedures, public finance management act. Basic knowledge of legislations, project management, Batho Pele Principles, planning, organising and Departmental transport handbook.",
    "duties": "Plan and allocate trips for the drivers, ensure compliance with pre and post trip inspections. Ensure that cars are used for official trips only staff and patients. Ensure cleanliness of vehicles. Ensure availability of drivers and collection of stock. Draft compliant off duties for staff. Attend weekly/monthly meetings. Book for cars when they are due for repairs/maintenance. Liaise with G-Fleet when it is time to replace vehicles, report any damages and losses to G-fleet. Follow up on traffic fines and allocate them to relevant individuals. Put measures that are in line with the departmental policies to prevent misuse of vehicles and petrol cards. Ensure performance management of staff, compile and present reports for transport department. Be able to perform any other duties as requested by the supervisor.",
    "notes": "Applications should be submitted strictly online at the following E-Recruitment portal: http://jobs.gauteng.gov.za. No hand-delivered, faxed, or emailed applications will be accepted. For assistance with online applications please email your query to healthjobqueries@gauteng.gov.za. NB: Where Driver\u2019s Licence is mandatory, exception will be granted for people with disabilities. Application should be accompanied by a fully completed and signed new Z83 application form obtainable from any Public Service Department or on the internet at www.dpsa.gov.za/documents plus a recently updated comprehensive Curriculum Vitae (CV). Applications without proof of a new Z83 application form and detailed CV will be disqualified. (Shortlisted candidates will receive communication from HR to submit certified copies of educational qualifications and other relevant documents not older than 6 months on or before the day of the interview). It is the applicant\u2019s responsibility to have foreign qualifications evaluated by the South African Qualifications Authority (SAQA). All foreign qualification must be accompanied by evaluation certificate from the South African Qualification Authority (SAQA). Correspondence will only be limited to shortlisted candidates. Suitable candidates will be subjected to a personnel suitability check (criminal record, citizenship, credit record checks, qualification verification and employment verification). Where applicable, candidates will be subjected to a skills/knowledge test. The recommended candidate may be subjected to Medical Surveillance as required by the Occupational Health and Safety Act, Act 5/1993. It is Department\u2019s intention to promote representivity (race, gender, and disability) in the Public Service through the filling of these posts. The Department reserves the right not to appoint/fill this post. WOMEN AND PEOPLE WITH DISABILITY ARE ENCOURAGED TO APPLY.",
    "full_text": "HOME\nJOBS\nABOUT US\nACCOUNT\n\n\n\nJob Details\nDepartment of Health\nLOGISTICS OFFICER LEVEL 7\nReference Number : REFS/034953\nDirectorate : TRANSPORT\nNumber of Posts : 1\nPackage : R 325 101.00 PER ANNUM (PLUS BENEFITS)\nEnquiries : Ms N Serobatse (011) 411-3563 / Ms M Mabiletse (011)411-3677\n\nRequirements :\n\nGrade 12 or equivalent with 3-5 years in transport department. A National Diploma (NQF level 6/7) in public management/ administration, Business administration, Logistics management or Fleet management will be added advantage Computer skills (Micro soft office). Valid code 10/14 Drivers licence with valid PDP. Good understanding of relevant legislations and prescripts. Departmental policies procedures, public finance management act. Basic knowledge of legislations, project management, Batho Pele Principles, planning, organising and Departmental transport handbook.\n\nDuties :\n\nPlan and allocate trips for the drivers, ensure compliance with pre and post trip inspections. Ensure that cars are used for official trips only staff and patients. Ensure cleanliness of vehicles. Ensure availability of drivers and collection of stock. Draft compliant off duties for staff. Attend weekly/monthly meetings. Book for cars when they are due for repairs/maintenance. Liaise with G-Fleet when it is time to replace vehicles, report any damages and losses to G-fleet. Follow up on traffic fines and allocate them to relevant individuals. Put measures that are in line with the departmental policies to prevent misuse of vehicles and petrol cards. Ensure performance management of staff, compile and present reports for transport department. Be able to perform any other duties as requested by the supervisor.\n\nNotes :\n\nApplications should be submitted strictly online at the following E-Recruitment portal: http://jobs.gauteng.gov.za. No hand-delivered, faxed, or emailed applications will be accepted. For assistance with online applications please email your query to healthjobqueries@gauteng.gov.za. NB: Where Driver\u2019s Licence is mandatory, exception will be granted for people with disabilities. Application should be accompanied by a fully completed and signed new Z83 application form obtainable from any Public Service Department or on the internet at www.dpsa.gov.za/documents plus a recently updated comprehensive Curriculum Vitae (CV). Applications without proof of a new Z83 application form and detailed CV will be disqualified. (Shortlisted candidates will receive communication from HR to submit certified copies of educational qualifications and other relevant documents not older than 6 months on or before the day of the interview). It is the applicant\u2019s responsibility to have foreign qualifications evaluated by the South African Qualifications Authority (SAQA). All foreign qualification must be accompanied by evaluation certificate from the South African Qualification Authority (SAQA). Correspondence will only be limited to shortlisted candidates. Suitable candidates will be subjected to a personnel suitability check (criminal record, citizenship, credit record checks, qualification verification and employment verification). Where applicable, candidates will be subjected to a skills/knowledge test. The recommended candidate may be subjected to Medical Surveillance as required by the Occupational Health and Safety Act, Act 5/1993. It is Department\u2019s intention to promote representivity (race, gender, and disability) in the Public Service through the filling of these posts. The Department reserves the right not to appoint/fill this post. WOMEN AND PEOPLE WITH DISABILITY ARE ENCOURAGED TO APPLY.\n\nEmployer : Department of Health\n\nLocation : Leratong Hospital\n\nClosing Date : 16-01-2026\n\n\n\nCriteria Questions\nDo you have a grade 12 or equivalent with 3-5 years in transport department?\nDo you have valid code 10/14 Drivers licence with valid PDP?\n\n\n\nPlease Notes :\n\nDue to the large number of applications we envisage receiving, applications will not be acknowledged. If you do not receive any response within 3 months, please accept that your application was not successful.\n\n\nFind us\nAddress\n75 Fox Street, Mashalltown\nJohannesburg\n2000\n\nCall us\n\nPhone\n080 022 8827\nEmail\nsupport@gauteng.gov.za\n\nQuick Links\nAll Jobs\nAbout Us\n\n\u00a9 Gauteng Provincial Government 2026 . Powered by Department of e-Government"
  },
  {
    "position": "COMMUNICATIONS OFFICER LEVEL 7",
    "location": "Leratong Hospital",
    "package": "R 325 101.00 PER ANNUM (PLUS BENEFITS)",
    "closing_date": "2026/01/16",
    "link": "https://jobs.gauteng.gov.za/Public/ViewJob.aspx?u=57glvgJbW+IsVHrUSAaGMw==",
    "title": "COMMUNICATIONS OFFICER LEVEL 7",
    "reference_number": "REFS/034952",
    "directorate": "ADMINISTRATION -COMMUNICATIONS",
    "centre": "Leratong Hospital",
    "package_detail": "R 325 101.00 PER ANNUM (PLUS BENEFITS)",
    "closing_date_detail": "16-01-2026",
    "enquiries": "Ms N Serobatse (011) 411-3563 / Ms M Mabiletse (011)411-3677",
    "requirements": "Grade 12 and a National Diploma (NQF level 6/7) in Public Management/ Administration, Communications, Journalism, Marketing, Business administration with 3-5 years in Communications environment. Computer skills (Microsoft office) Driver\u2019s licence will be an added advantage. Good understanding of relevant legislations and prescripts. Excellent communication skills (verbal and written) Understanding of the media environment. Research, scripting, content management, editing, proof reading and project management skills. Must be able to meet deadlines and work extra hours when a need arises. Departmental policies procedures, public finance management act. Basic knowledge of legislations, project management, Batho Pele Principles, planning and organising, event management.",
    "duties": "Provide an effective communication support service to the institution. Implement and assist with design, layout and cover concepts for departmental reports. Develop and implement creative concepts and products for departmental campaigns, projects, events, events invitations, exhibitions, branding of promotional items. Develop and implement multimedia content, including photographs and digital publications. Provide advice and ensure correct application of the logo in line with the prescripts. Archiving all visuals and publication produced. Manage the social media page for the hospital. Ensure development and implementation of the communication strategy that is in line with strategic objective of the department. Support program coordinators to facilitate functions within the hospital. Co-lead all internal and external communication initiatives of the institution. Ensure production of hospital newsletter and electronic website. Write regular opinion pieces for the institution. Forge relationship with media houses and other stakeholders. Ensure performance management of staff, compile and present reports for transport department. Attend weekly/monthly meetings Be a secretary for the hospital board and participate in various committees. Be responsible for personnel performance evaluation (PMDS) within regulated timelines and monitoring of attendance. Perform any other lawful duties as delegated by next level Supervisor.",
    "notes": "Applications should be submitted strictly online at the following E-Recruitment portal: http://jobs.gauteng.gov.za. No hand-delivered, faxed, or emailed applications will be accepted. For assistance with online applications please email your query to healthjobqueries@gauteng.gov.za. NB: Where Driver\u2019s Licence is mandatory, exception will be granted for people with disabilities. Application should be accompanied by a fully completed and signed new Z83 application form obtainable from any Public Service Department or on the internet at www.dpsa.gov.za/documents plus a recently updated comprehensive Curriculum Vitae (CV). Applications without proof of a new Z83 application form and detailed CV will be disqualified. (Shortlisted candidates will receive communication from HR to submit certified copies of educational qualifications and other relevant documents not older than 6 months on or before the day of the interview). It is the applicant\u2019s responsibility to have foreign qualifications evaluated by the South African Qualifications Authority (SAQA). All foreign qualification must be accompanied by evaluation certificate from the South African Qualification Authority (SAQA). Correspondence will only be limited to shortlisted candidates. Suitable candidates will be subjected to a personnel suitability check (criminal record, citizenship, credit record checks, qualification verification and employment verification). Where applicable, candidates will be subjected to a skills/knowledge test. The recommended candidate may be subjected to Medical Surveillance as required by the Occupational Health and Safety Act, Act 5/1993. It is Department\u2019s intention to promote representivity (race, gender, and disability) in the Public Service through the filling of these posts. The Department reserves the right not to appoint/fill this post. WOMEN AND PEOPLE WITH DISABILITY ARE ENCOURAGED TO APPLY.",
    "full_text": "HOME\nJOBS\nABOUT US\nACCOUNT\n\n\n\nJob Details\nDepartment of Health\nCOMMUNICATIONS OFFICER LEVEL 7\nReference Number : REFS/034952\nDirectorate : ADMINISTRATION -COMMUNICATIONS\nNumber of Posts : 1\nPackage : R 325 101.00 PER ANNUM (PLUS BENEFITS)\nEnquiries : Ms N Serobatse (011) 411-3563 / Ms M Mabiletse (011)411-3677\n\nRequirements :\n\nGrade 12 and a National Diploma (NQF level 6/7) in Public Management/ Administration, Communications, Journalism, Marketing, Business administration with 3-5 years in Communications environment. Computer skills (Microsoft office) Driver\u2019s licence will be an added advantage. Good understanding of relevant legislations and prescripts. Excellent communication skills (verbal and written) Understanding of the media environment. Research, scripting, content management, editing, proof reading and project management skills. Must be able to meet deadlines and work extra hours when a need arises. Departmental policies procedures, public finance management act. Basic knowledge of legislations, project management, Batho Pele Principles, planning and organising, event management.\n\nDuties :\n\nProvide an effective communication support service to the institution. Implement and assist with design, layout and cover concepts for departmental reports. Develop and implement creative concepts and products for departmental campaigns, projects, events, events invitations, exhibitions, branding of promotional items. Develop and implement multimedia content, including photographs and digital publications. Provide advice and ensure correct application of the logo in line with the prescripts. Archiving all visuals and publication produced. Manage the social media page for the hospital. Ensure development and implementation of the communication strategy that is in line with strategic objective of the department. Support program coordinators to facilitate functions within the hospital. Co-lead all internal and external communication initiatives of the institution. Ensure production of hospital newsletter and electronic website. Write regular opinion pieces for the institution. Forge relationship with media houses and other stakeholders. Ensure performance management of staff, compile and present reports for transport department. Attend weekly/monthly meetings Be a secretary for the hospital board and participate in various committees. Be responsible for personnel performance evaluation (PMDS) within regulated timelines and monitoring of attendance. Perform any other lawful duties as delegated by next level Supervisor.\n\nNotes :\n\nApplications should be submitted strictly online at the following E-Recruitment portal: http://jobs.gauteng.gov.za. No hand-delivered, faxed, or emailed applications will be accepted. For assistance with online applications please email your query to healthjobqueries@gauteng.gov.za. NB: Where Driver\u2019s Licence is mandatory, exception will be granted for people with disabilities. Application should be accompanied by a fully completed and signed new Z83 application form obtainable from any Public Service Department or on the internet at www.dpsa.gov.za/documents plus a recently updated comprehensive Curriculum Vitae (CV). Applications without proof of a new Z83 application form and detailed CV will be disqualified. (Shortlisted candidates will receive communication from HR to submit certified copies of educational qualifications and other relevant documents not older than 6 months on or before the day of the interview). It is the applicant\u2019s responsibility to have foreign qualifications evaluated by the South African Qualifications Authority (SAQA). All foreign qualification must be accompanied by evaluation certificate from the South African Qualification Authority (SAQA). Correspondence will only be limited to shortlisted candidates. Suitable candidates will be subjected to a personnel suitability check (criminal record, citizenship, credit record checks, qualification verification and employment verification). Where applicable, candidates will be subjected to a skills/knowledge test. The recommended candidate may be subjected to Medical Surveillance as required by the Occupational Health and Safety Act, Act 5/1993. It is Department\u2019s intention to promote representivity (race, gender, and disability) in the Public Service through the filling of these posts. The Department reserves the right not to appoint/fill this post. WOMEN AND PEOPLE WITH DISABILITY ARE ENCOURAGED TO APPLY.\n\nEmployer : Department of Health\n\nLocation : Leratong Hospital\n\nClosing Date : 16-01-2026\n\n\n\nCriteria Questions\nDo you have a grade 12 and a National Diploma (NQF level 6/7) in Public Management/ Administration, Communications, Journalism, Marketing, Business administration?\nDo you have 3-5 years in Communications environment?\n\n\n\nPlease Notes :\n\nDue to the large number of applications we envisage receiving, applications will not be acknowledged. If you do not receive any response within 3 months, please accept that your application was not successful.\n\n\nFind us\nAddress\n75 Fox Street, Mashalltown\nJohannesburg\n2000\n\nCall us\n\nPhone\n080 022 8827\nEmail\nsupport@gauteng.gov.za\n\nQuick Links\nAll Jobs\nAbout Us\n\n\u00a9 Gauteng Provincial Government 2026 . Powered by Department of e-Government"
  },
  {
    "position": "SENIOR ADMIN LEVEL 7",
    "location": "Leratong Hospital",
    "package": "R 325 101.00 PER ANNUM (PLUS BENEFITS",
    "closing_date": "2026/01/16",
    "link": "https://jobs.gauteng.gov.za/Public/ViewJob.aspx?u=57glvgJbW+JdtKV/eG3AIA==",
    "title": "SENIOR ADMIN LEVEL 7",
    "reference_number": "REFS/034951",
    "directorate": "OFFICE OF THE CEO",
    "centre": "Leratong Hospital",
    "package_detail": "R 325 101.00 PER ANNUM (PLUS BENEFITS",
    "closing_date_detail": "16-01-2026",
    "enquiries": "Ms N Serobatse (011) 411-3563 / Ms M Mabiletse (011)411-3677",
    "requirements": "Grade 12 or equivalent with NQF level 6/7 in office management, management assistant, secretarial, public management/administration. Microsoft package qualification. Proficient user of Microsoft suites, candidates will be subjected to a competency test. 5 years\u2019 experience rendering support to senior management. Driver\u2019s licence will be an added advantage (valid code8/10) Ability to operate office equipment. Knowledge of relevant legislation, policies, prescripts and procedures. Ability to manage senior management offices. Good telephone etiquette and ability to communicate well with people at different levels. Strong communication skills written and verbal.",
    "duties": "Provide secretariat/administrative functions to the office of the CEO. Manage the diary of the CEO. Receive visitors for the office of the CEO. Arrange refreshments for the office of the CEO. Receive and screen calls directed to the CEO. Provide support to the office of the CEO regarding meetings, respond to enquiries received from internal/external stakeholders, direct enquiries to relevant managers for response and follow up. Compile minutes during meetings and share with relevant stakeholders, Compile/consolidate reports for the office of the CEO. Perform any other duties as requested by the manager.",
    "notes": "Applications should be submitted strictly online at the following E-Recruitment portal: http://jobs.gauteng.gov.za. No hand-delivered, faxed, or emailed applications will be accepted. For assistance with online applications please email your query to healthjobqueries@gauteng.gov.za. NB: Where Driver\u2019s Licence is mandatory, exception will be granted for people with disabilities. Application should be accompanied by a fully completed and signed new Z83 application form obtainable from any Public Service Department or on the internet at www.dpsa.gov.za/documents plus a recently updated comprehensive Curriculum Vitae (CV). Applications without proof of a new Z83 application form and detailed CV will be disqualified. (Shortlisted candidates will receive communication from HR to submit certified copies of educational qualifications and other relevant documents not older than 6 months on or before the day of the interview). It is the applicant\u2019s responsibility to have foreign qualifications evaluated by the South African Qualifications Authority (SAQA). All foreign qualification must be accompanied by evaluation certificate from the South African Qualification Authority (SAQA). Correspondence will only be limited to shortlisted candidates. Suitable candidates will be subjected to a personnel suitability check (criminal record, citizenship, credit record checks, qualification verification and employment verification). Where applicable, candidates will be subjected to a skills/knowledge test. The recommended candidate may be subjected to Medical Surveillance as required by the Occupational Health and Safety Act, Act 5/1993. It is Department\u2019s intention to promote representivity (race, gender, and disability) in the Public Service through the filling of these posts. The Department reserves the right not to appoint/fill this post. WOMEN AND PEOPLE WITH DISABILITY ARE ENCOURAGED TO APPLY.",
    "full_text": "HOME\nJOBS\nABOUT US\nACCOUNT\n\n\n\nJob Details\nDepartment of Health\nSENIOR ADMIN LEVEL 7\nReference Number : REFS/034951\nDirectorate : OFFICE OF THE CEO\nNumber of Posts : 1\nPackage : R 325 101.00 PER ANNUM (PLUS BENEFITS\nEnquiries : Ms N Serobatse (011) 411-3563 / Ms M Mabiletse (011)411-3677\n\nRequirements :\n\nGrade 12 or equivalent with NQF level 6/7 in office management, management assistant, secretarial, public management/administration. Microsoft package qualification. Proficient user of Microsoft suites, candidates will be subjected to a competency test. 5 years\u2019 experience rendering support to senior management. Driver\u2019s licence will be an added advantage (valid code8/10) Ability to operate office equipment. Knowledge of relevant legislation, policies, prescripts and procedures. Ability to manage senior management offices. Good telephone etiquette and ability to communicate well with people at different levels. Strong communication skills written and verbal.\n\nDuties :\n\nProvide secretariat/administrative functions to the office of the CEO. Manage the diary of the CEO. Receive visitors for the office of the CEO. Arrange refreshments for the office of the CEO. Receive and screen calls directed to the CEO. Provide support to the office of the CEO regarding meetings, respond to enquiries received from internal/external stakeholders, direct enquiries to relevant managers for response and follow up. Compile minutes during meetings and share with relevant stakeholders, Compile/consolidate reports for the office of the CEO. Perform any other duties as requested by the manager.\n\nNotes :\n\nApplications should be submitted strictly online at the following E-Recruitment portal: http://jobs.gauteng.gov.za. No hand-delivered, faxed, or emailed applications will be accepted. For assistance with online applications please email your query to healthjobqueries@gauteng.gov.za. NB: Where Driver\u2019s Licence is mandatory, exception will be granted for people with disabilities. Application should be accompanied by a fully completed and signed new Z83 application form obtainable from any Public Service Department or on the internet at www.dpsa.gov.za/documents plus a recently updated comprehensive Curriculum Vitae (CV). Applications without proof of a new Z83 application form and detailed CV will be disqualified. (Shortlisted candidates will receive communication from HR to submit certified copies of educational qualifications and other relevant documents not older than 6 months on or before the day of the interview). It is the applicant\u2019s responsibility to have foreign qualifications evaluated by the South African Qualifications Authority (SAQA). All foreign qualification must be accompanied by evaluation certificate from the South African Qualification Authority (SAQA). Correspondence will only be limited to shortlisted candidates. Suitable candidates will be subjected to a personnel suitability check (criminal record, citizenship, credit record checks, qualification verification and employment verification). Where applicable, candidates will be subjected to a skills/knowledge test. The recommended candidate may be subjected to Medical Surveillance as required by the Occupational Health and Safety Act, Act 5/1993. It is Department\u2019s intention to promote representivity (race, gender, and disability) in the Public Service through the filling of these posts. The Department reserves the right not to appoint/fill this post. WOMEN AND PEOPLE WITH DISABILITY ARE ENCOURAGED TO APPLY.\n\nEmployer : Department of Health\n\nLocation : Leratong Hospital\n\nClosing Date : 16-01-2026\n\n\n\nCriteria Questions\nDo you have a grade 12 or equivalent with NQF level 6/7 in office management, management assistant, secretarial, public management/administration?\nDo you have 5 years\u2019 experience rendering support to senior management?\n\n\n\nPlease Notes :\n\nDue to the large number of applications we envisage receiving, applications will not be acknowledged. If you do not receive any response within 3 months, please accept that your application was not successful.\n\n\nFind us\nAddress\n75 Fox Street, Mashalltown\nJohannesburg\n2000\n\nCall us\n\nPhone\n080 022 8827\nEmail\nsupport@gauteng.gov.za\n\nQuick Links\nAll Jobs\nAbout Us\n\n\u00a9 Gauteng Provincial Government 2026 . Powered by Department of e-Government"
  },
  {
    "position": "ASSISTANT DIRECTOR PATIENT AFFAIRS",
    "location": "Leratong Hospital",
    "package": "R 468 459 per annum (Plus Benefits)",
    "closing_date": "2026/01/16",
    "link": "https://jobs.gauteng.gov.za/Public/ViewJob.aspx?u=57glvgJbW+KvaUMf355qUg==",
    "title": "ASSISTANT DIRECTOR PATIENT AFFAIRS",
    "reference_number": "REFS/034950",
    "directorate": "PATIENT AFFAIRS",
    "centre": "Leratong Hospital",
    "package_detail": "R 468 459 per annum (Plus Benefits)",
    "closing_date_detail": "16-01-2026",
    "enquiries": "Ms N Serobatse (011) 411-3563 / Ms M Mabiletse (011)411-3677",
    "requirements": "National Diploma/Degree in Public Management and Administration with 3 years\u2019 supervisory level experience in Patient Affairs. Management and Leadership skills. Ability to interpret and implement the policies, directives and guidelines of the Gauteng Department of Health. Excellent verbal and communication skills. Knowledge and understanding of Patient Affairs scripts. Must be computer literate.",
    "duties": "Responsible for implementation and compilation of the sections operational plans, strategic plans, and quarterly reviews. Ensure proper records keeping through proper interpretation of the Records management policy. Ensure that systems are in place for the management of PAIA requests. Interpretation and implementation of all mortuary prescripts and related guidelines. Ensure that systems are in place to maximize the institution revenue collection. Ensure individual performance is aligned to section strategic objectives. Ensure proper application of Labour Relations Act and Code of Conduct. Ensure submission of accurate and reliable data to senior management.",
    "notes": "Applications should be submitted strictly online at the following E-Recruitment portal: http://jobs.gauteng.gov.za. No hand-delivered, faxed, or emailed applications will be accepted. For assistance with online applications please email your query to healthjobqueries@gauteng.gov.za. NB: Where Driver\u2019s Licence is mandatory, exception will be granted for people with disabilities. Application should be accompanied by a fully completed and signed new Z83 application form obtainable from any Public Service Department or on the internet at www.dpsa.gov.za/documents plus a recently updated comprehensive Curriculum Vitae (CV). Applications without proof of a new Z83 application form and detailed CV will be disqualified. (Shortlisted candidates will receive communication from HR to submit certified copies of educational qualifications and other relevant documents not older than 6 months on or before the day of the interview). It is the applicant\u2019s responsibility to have foreign qualifications evaluated by the South African Qualifications Authority (SAQA). All foreign qualification must be accompanied by evaluation certificate from the South African Qualification Authority (SAQA). Correspondence will only be limited to shortlisted candidates. Suitable candidates will be subjected to a personnel suitability check (criminal record, citizenship, credit record checks, qualification verification and employment verification). Where applicable, candidates will be subjected to a skills/knowledge test. The recommended candidate may be subjected to Medical Surveillance as required by the Occupational Health and Safety Act, Act 5/1993. It is Department\u2019s intention to promote representivity (race, gender, and disability) in the Public Service through the filling of these posts. The Department reserves the right not to appoint/fill this post. WOMEN AND PEOPLE WITH DISABILITY ARE ENCOURAGED TO APPLY.",
    "full_text": "HOME\nJOBS\nABOUT US\nACCOUNT\n\n\n\nJob Details\nDepartment of Health\nASSISTANT DIRECTOR PATIENT AFFAIRS\nReference Number : REFS/034950\nDirectorate : PATIENT AFFAIRS\nNumber of Posts : 1\nPackage : R 468 459 per annum (Plus Benefits)\nEnquiries : Ms N Serobatse (011) 411-3563 / Ms M Mabiletse (011)411-3677\n\nRequirements :\n\nNational Diploma/Degree in Public Management and Administration with 3 years\u2019 supervisory level experience in Patient Affairs. Management and Leadership skills. Ability to interpret and implement the policies, directives and guidelines of the Gauteng Department of Health. Excellent verbal and communication skills. Knowledge and understanding of Patient Affairs scripts. Must be computer literate.\n\nDuties :\n\nResponsible for implementation and compilation of the sections operational plans, strategic plans, and quarterly reviews. Ensure proper records keeping through proper interpretation of the Records management policy. Ensure that systems are in place for the management of PAIA requests. Interpretation and implementation of all mortuary prescripts and related guidelines. Ensure that systems are in place to maximize the institution revenue collection. Ensure individual performance is aligned to section strategic objectives. Ensure proper application of Labour Relations Act and Code of Conduct. Ensure submission of accurate and reliable data to senior management.\n\nNotes :\n\nApplications should be submitted strictly online at the following E-Recruitment portal: http://jobs.gauteng.gov.za. No hand-delivered, faxed, or emailed applications will be accepted. For assistance with online applications please email your query to healthjobqueries@gauteng.gov.za. NB: Where Driver\u2019s Licence is mandatory, exception will be granted for people with disabilities. Application should be accompanied by a fully completed and signed new Z83 application form obtainable from any Public Service Department or on the internet at www.dpsa.gov.za/documents plus a recently updated comprehensive Curriculum Vitae (CV). Applications without proof of a new Z83 application form and detailed CV will be disqualified. (Shortlisted candidates will receive communication from HR to submit certified copies of educational qualifications and other relevant documents not older than 6 months on or before the day of the interview). It is the applicant\u2019s responsibility to have foreign qualifications evaluated by the South African Qualifications Authority (SAQA). All foreign qualification must be accompanied by evaluation certificate from the South African Qualification Authority (SAQA). Correspondence will only be limited to shortlisted candidates. Suitable candidates will be subjected to a personnel suitability check (criminal record, citizenship, credit record checks, qualification verification and employment verification). Where applicable, candidates will be subjected to a skills/knowledge test. The recommended candidate may be subjected to Medical Surveillance as required by the Occupational Health and Safety Act, Act 5/1993. It is Department\u2019s intention to promote representivity (race, gender, and disability) in the Public Service through the filling of these posts. The Department reserves the right not to appoint/fill this post. WOMEN AND PEOPLE WITH DISABILITY ARE ENCOURAGED TO APPLY.\n\nEmployer : Department of Health\n\nLocation : Leratong Hospital\n\nClosing Date : 16-01-2026\n\n\n\nCriteria Questions\nDo you have a National Diploma/Degree in Public Management and Administration?\nDo you have 3 years\u2019 supervisory level experience in Patient Affairs?\n\n\n\nPlease Notes :\n\nDue to the large number of applications we envisage receiving, applications will not be acknowledged. If you do not receive any response within 3 months, please accept that your application was not successful.\n\n\nFind us\nAddress\n75 Fox Street, Mashalltown\nJohannesburg\n2000\n\nCall us\n\nPhone\n080 022 8827\nEmail\nsupport@gauteng.gov.za\n\nQuick Links\nAll Jobs\nAbout Us\n\n\u00a9 Gauteng Provincial Government 2026 . Powered by Department of e-Government"
  },
  {
    "position": "ASSISTANT DIRECTOR FINANCE",
    "location": "Leratong Hospital",
    "package": "R 468 459 per annum (Plus Benefits)",
    "closing_date": "2026/01/16",
    "link": "https://jobs.gauteng.gov.za/Public/ViewJob.aspx?u=E7CSZ5GRR4Ff8zOiCY136Q==",
    "title": "ASSISTANT DIRECTOR FINANCE",
    "reference_number": "refs/034949",
    "directorate": "FINANCE DEPARTMENT",
    "centre": "Leratong Hospital",
    "package_detail": "R 468 459 per annum (Plus Benefits)",
    "closing_date_detail": "16-01-2026",
    "enquiries": "Ms N Serobatse (011) 411-3563 / Ms M Mabiletse (011)411-3677",
    "requirements": "An appropriate NQF level 7 (bachelor\u2019s degree or Advanced Diploma or B tech) qualification in Financial Accounting / Financial management plus 3 years supervisory level experience in Finance. Computer Literacy. Must have a valid driver\u2019s license. Knowledge of relevant Act (PFMA, Treasury Regulations) and systems (BAS, SAP). Interpersonal skills. Communication skills. Good leadership skills. Must be able to plan, organise and co-ordinate activities in the unit. Ability to work under pressure. Team leadership.",
    "duties": "Development of the Finance Department Operational Plan, compile and present quarterly reviews. Effective Financial control and monitoring of current budget and expenditure. Compiling of monthly financial reports. Perform various expenditure monthly reconciliations. Clearing of web cycles (IMS). Management of accruals. Ensure suppliers are paid within 30 days. Attend to suppliers related queries. Assist in the preparations and allocation of budget. Training of staff on finance related matters. Supervision and mentoring of staff. Attend to auditors and develop action plans to improve control and eliminate audit findings. Effective Risk management. Evaluate performance of sub \u2013 ordinates quarterly and annually.",
    "notes": "Applications should be submitted strictly online at the following E-Recruitment portal: http://jobs.gauteng.gov.za. No hand-delivered, faxed, or emailed applications will be accepted. For assistance with online applications please email your query to healthjobqueries@gauteng.gov.za. NB: Where Driver\u2019s Licence is mandatory, exception will be granted for people with disabilities. Application should be accompanied by a fully completed and signed new Z83 application form obtainable from any Public Service Department or on the internet at www.dpsa.gov.za/documents plus a recently updated comprehensive Curriculum Vitae (CV). Applications without proof of a new Z83 application form and detailed CV will be disqualified. (Shortlisted candidates will receive communication from HR to submit certified copies of educational qualifications and other relevant documents not older than 6 months on or before the day of the interview). It is the applicant\u2019s responsibility to have foreign qualifications evaluated by the South African Qualifications Authority (SAQA). All foreign qualification must be accompanied by evaluation certificate from the South African Qualification Authority (SAQA). Correspondence will only be limited to shortlisted candidates. Suitable candidates will be subjected to a personnel suitability check (criminal record, citizenship, credit record checks, qualification verification and employment verification). Where applicable, candidates will be subjected to a skills/knowledge test. The recommended candidate may be subjected to Medical Surveillance as required by the Occupational Health and Safety Act, Act 5/1993. It is Department\u2019s intention to promote representivity (race, gender, and disability) in the Public Service through the filling of these posts. The Department reserves the right not to appoint/fill this post. WOMEN AND PEOPLE WITH DISABILITY ARE ENCOURAGED TO APPLY.",
    "full_text": "HOME\nJOBS\nABOUT US\nACCOUNT\n\n\n\nJob Details\nDepartment of Health\nASSISTANT DIRECTOR FINANCE\nReference Number : refs/034949\nDirectorate : FINANCE DEPARTMENT\nNumber of Posts : 1\nPackage : R 468 459 per annum (Plus Benefits)\nEnquiries : Ms N Serobatse (011) 411-3563 / Ms M Mabiletse (011)411-3677\n\nRequirements :\n\nAn appropriate NQF level 7 (bachelor\u2019s degree or Advanced Diploma or B tech) qualification in Financial Accounting / Financial management plus 3 years supervisory level experience in Finance. Computer Literacy. Must have a valid driver\u2019s license. Knowledge of relevant Act (PFMA, Treasury Regulations) and systems (BAS, SAP). Interpersonal skills. Communication skills. Good leadership skills. Must be able to plan, organise and co-ordinate activities in the unit. Ability to work under pressure. Team leadership.\n\nDuties :\n\nDevelopment of the Finance Department Operational Plan, compile and present quarterly reviews. Effective Financial control and monitoring of current budget and expenditure. Compiling of monthly financial reports. Perform various expenditure monthly reconciliations. Clearing of web cycles (IMS). Management of accruals. Ensure suppliers are paid within 30 days. Attend to suppliers related queries. Assist in the preparations and allocation of budget. Training of staff on finance related matters. Supervision and mentoring of staff. Attend to auditors and develop action plans to improve control and eliminate audit findings. Effective Risk management. Evaluate performance of sub \u2013 ordinates quarterly and annually.\n\nNotes :\n\nApplications should be submitted strictly online at the following E-Recruitment portal: http://jobs.gauteng.gov.za. No hand-delivered, faxed, or emailed applications will be accepted. For assistance with online applications please email your query to healthjobqueries@gauteng.gov.za. NB: Where Driver\u2019s Licence is mandatory, exception will be granted for people with disabilities. Application should be accompanied by a fully completed and signed new Z83 application form obtainable from any Public Service Department or on the internet at www.dpsa.gov.za/documents plus a recently updated comprehensive Curriculum Vitae (CV). Applications without proof of a new Z83 application form and detailed CV will be disqualified. (Shortlisted candidates will receive communication from HR to submit certified copies of educational qualifications and other relevant documents not older than 6 months on or before the day of the interview). It is the applicant\u2019s responsibility to have foreign qualifications evaluated by the South African Qualifications Authority (SAQA). All foreign qualification must be accompanied by evaluation certificate from the South African Qualification Authority (SAQA). Correspondence will only be limited to shortlisted candidates. Suitable candidates will be subjected to a personnel suitability check (criminal record, citizenship, credit record checks, qualification verification and employment verification). Where applicable, candidates will be subjected to a skills/knowledge test. The recommended candidate may be subjected to Medical Surveillance as required by the Occupational Health and Safety Act, Act 5/1993. It is Department\u2019s intention to promote representivity (race, gender, and disability) in the Public Service through the filling of these posts. The Department reserves the right not to appoint/fill this post. WOMEN AND PEOPLE WITH DISABILITY ARE ENCOURAGED TO APPLY.\n\nEmployer : Department of Health\n\nLocation : Leratong Hospital\n\nClosing Date : 16-01-2026\n\n\n\nCriteria Questions\nDo you have an appropriate NQF level 7 (bachelor\u2019s degree or Advanced Diploma or B tech) qualification in Financial Accounting / Financial management ?\nDo you have 3 years supervisory level experience in Finance?\nDo you have a valid driver\u2019s licence?\n\n\n\nPlease Notes :\n\nDue to the large number of applications we envisage receiving, applications will not be acknowledged. If you do not receive any response within 3 months, please accept that your application was not successful.\n\n\nFind us\nAddress\n75 Fox Street, Mashalltown\nJohannesburg\n2000\n\nCall us\n\nPhone\n080 022 8827\nEmail\nsupport@gauteng.gov.za\n\nQuick Links\nAll Jobs\nAbout Us\n\n\u00a9 Gauteng Provincial Government 2026 . Powered by Department of e-Government"
  },
  {
    "position": "MEDICAL OFFICER ANAESTHETICS",
    "location": "Pholosong Regional Hospital",
    "package": "Grade 1: R 949 146 \u2013 R 1 021 911 per annum, (all-inclusive package), Grade 2: R 1 082 988 \u2013 R 1 182 13 per annum, (all-inclusive package), Grade 3: R 1 253 415 \u2013 R 1 561 734 per annum, (all-inclusive package)",
    "closing_date": "2026/01/16",
    "link": "https://jobs.gauteng.gov.za/Public/ViewJob.aspx?u=E7CSZ5GRR4HbIgZ66fa9fw==",
    "title": "MEDICAL OFFICER ANAESTHETICS",
    "reference_number": "refs/034948",
    "directorate": "Medical",
    "centre": "Pholosong Regional Hospital",
    "package_detail": "Grade 1: R 949 146 \u2013 R 1 021 911 per annum, (all-inclusive package), Grade 2: R 1 082 988 \u2013 R 1 182 13 per annum, (all-inclusive package), Grade 3: R 1 253 415 \u2013 R 1 561 734 per annum, (all-inclusive package)",
    "closing_date_detail": "16-01-2026",
    "enquiries": "Dr. N Jwara Tel No- (011) 812 5163",
    "requirements": "Grade 12 plus MBCHB degree registered with HPCSA as a Medical Officer independent practice. With annual registration to practice and registration as a Medical Officer independent practitioner.",
    "duties": "The incumbent will be responsible for interviewing, investigating, diagnosing and overseeing the treatment of patients. Attendance of relevant administrative meeting like mortality meetings, near miss meetings and completing Medico legal documents timeously (e.g. Death certificate). Improving quality of care by providing appropriate clinical care. Reduce medical litigation by exercising good clinical ethos. Implement and monitor adherence to National Core Standards (Norms and Standard). Participating in all activities of the discipline in relations to teaching and research. Participate in multidisciplinary team to the management of patients. Performance of practical procedures relevant to the patients. Ensure that administration and record keeping is done in the department. Experience and a diploma in anaesthesia will be an added advantage.",
    "notes": "Applications should be submitted strictly online at the following E-Recruitment portal: http://jobs.gauteng.gov.za. No hand-delivered, faxed, or emailed applications will be accepted. For assistance with online applications please email your query to healthjobqueries@gauteng.gov.za . NB: Where Driver\u2019s Licence is mandatory, exception will be granted for people with disabilities. Application should be accompanied by a fully completed and signed new Z83 application form obtainable from any Public Service Department or on the internet at www.dpsa.gov.za/documents plus a recently updated comprehensive Curriculum Vitae (CV), Registration Certificate with relevant professional body (HPCSA) and a proof of current registration (Annual Practicing Certificate/Card). Applications without proof of a new Z83 application form, a detailed CV, registration certificate and a proof of current registration card/certificate with relevant professional body will be disqualified. (Shortlisted candidates will receive communication from HR to submit certified copies of educational qualifications and other relevant documents not older than 6 months on or before the day of the interview). It is the applicant\u2019s responsibility to have foreign qualifications evaluated by the South African Qualifications Authority (SAQA). All foreign qualification must be accompanied by evaluation certificate from the South African Qualification Authority (SAQA). Correspondence will only be limited to shortlisted candidates. If you have not been contacted within 3 months of the closing date of this advertisement, please accept that your application was unsuccessful. Suitable candidates will be subjected to a personnel suitability check (criminal record, citizenship, credit record checks, qualification verification and employment verification). Where applicable, candidates will be subjected to a skills/knowledge test. The recommended candidate may be subjected to Medical Surveillance as required by the Occupational Health and Safety Act, Act 5/1993. It is Department\u2019s intention to promote representivity (race, gender, and disability) in the Public Service through the filling of these posts. The Department reserves the right not to appoint/fill this post. WOMEN AND PEOPLE WITH DISABILITY ARE ENCOURAGED TO APPLY.",
    "full_text": "HOME\nJOBS\nABOUT US\nACCOUNT\n\n\n\nJob Details\nDepartment of Health\nMEDICAL OFFICER ANAESTHETICS\nReference Number : refs/034948\nDirectorate : Medical\nNumber of Posts : 1\nPackage : Grade 1: R 949 146 \u2013 R 1 021 911 per annum, (all-inclusive package), Grade 2: R 1 082 988 \u2013 R 1 182 13 per annum, (all-inclusive package), Grade 3: R 1 253 415 \u2013 R 1 561 734 per annum, (all-inclusive package)\nEnquiries : Dr. N Jwara Tel No- (011) 812 5163\n\nRequirements :\n\nGrade 12 plus MBCHB degree registered with HPCSA as a Medical Officer independent practice. With annual registration to practice and registration as a Medical Officer independent practitioner.\n\nDuties :\n\nThe incumbent will be responsible for interviewing, investigating, diagnosing and overseeing the treatment of patients. Attendance of relevant administrative meeting like mortality meetings, near miss meetings and completing Medico legal documents timeously (e.g. Death certificate). Improving quality of care by providing appropriate clinical care. Reduce medical litigation by exercising good clinical ethos. Implement and monitor adherence to National Core Standards (Norms and Standard). Participating in all activities of the discipline in relations to teaching and research. Participate in multidisciplinary team to the management of patients. Performance of practical procedures relevant to the patients. Ensure that administration and record keeping is done in the department. Experience and a diploma in anaesthesia will be an added advantage.\n\nNotes :\n\nApplications should be submitted strictly online at the following E-Recruitment portal: http://jobs.gauteng.gov.za. No hand-delivered, faxed, or emailed applications will be accepted. For assistance with online applications please email your query to healthjobqueries@gauteng.gov.za . NB: Where Driver\u2019s Licence is mandatory, exception will be granted for people with disabilities. Application should be accompanied by a fully completed and signed new Z83 application form obtainable from any Public Service Department or on the internet at www.dpsa.gov.za/documents plus a recently updated comprehensive Curriculum Vitae (CV), Registration Certificate with relevant professional body (HPCSA) and a proof of current registration (Annual Practicing Certificate/Card). Applications without proof of a new Z83 application form, a detailed CV, registration certificate and a proof of current registration card/certificate with relevant professional body will be disqualified. (Shortlisted candidates will receive communication from HR to submit certified copies of educational qualifications and other relevant documents not older than 6 months on or before the day of the interview). It is the applicant\u2019s responsibility to have foreign qualifications evaluated by the South African Qualifications Authority (SAQA). All foreign qualification must be accompanied by evaluation certificate from the South African Qualification Authority (SAQA). Correspondence will only be limited to shortlisted candidates. If you have not been contacted within 3 months of the closing date of this advertisement, please accept that your application was unsuccessful. Suitable candidates will be subjected to a personnel suitability check (criminal record, citizenship, credit record checks, qualification verification and employment verification). Where applicable, candidates will be subjected to a skills/knowledge test. The recommended candidate may be subjected to Medical Surveillance as required by the Occupational Health and Safety Act, Act 5/1993. It is Department\u2019s intention to promote representivity (race, gender, and disability) in the Public Service through the filling of these posts. The Department reserves the right not to appoint/fill this post. WOMEN AND PEOPLE WITH DISABILITY ARE ENCOURAGED TO APPLY.\n\nEmployer : Department of Health\n\nLocation : Pholosong Regional Hospital\n\nClosing Date : 16-01-2026\n\n\n\nCriteria Questions\nDo you have a grade 12 plus MBCHB degree registered with HPCSA as a Medical Officer independent practice?\nDo you have annual registration to practice and registration as a Medical Officer independent practitioner?\n\n\n\nPlease Notes :\n\nDue to the large number of applications we envisage receiving, applications will not be acknowledged. If you do not receive any response within 3 months, please accept that your application was not successful.\n\n\nFind us\nAddress\n75 Fox Street, Mashalltown\nJohannesburg\n2000\n\nCall us\n\nPhone\n080 022 8827\nEmail\nsupport@gauteng.gov.za\n\nQuick Links\nAll Jobs\nAbout Us\n\n\u00a9 Gauteng Provincial Government 2026 . Powered by Department of e-Government"
  },
  {
    "position": "MEDICAL OFFICER GRADE 1 - INTERNAL MEDICINE",
    "location": "Pholosong Regional Hospital",
    "package": "Grade 1: R 949 146 \u2013 R 1 021 911 per annum, (all-inclusive package) , Grade 2: R 1 082 988 \u2013 R 1 182 13 per annum, (all-inclusive package),Grade 3: R 1 253 415 \u2013 R 1 561 734 per annum, (all-inclusive package)",
    "closing_date": "2026/01/16",
    "link": "https://jobs.gauteng.gov.za/Public/ViewJob.aspx?u=E7CSZ5GRR4EZFGgOS83zkw==",
    "title": "MEDICAL OFFICER GRADE 1 - INTERNAL MEDICINE",
    "reference_number": "refs/034947",
    "directorate": "Medical",
    "centre": "Pholosong Regional Hospital",
    "package_detail": "Grade 1: R 949 146 \u2013 R 1 021 911 per annum, (all-inclusive package) , Grade 2: R 1 082 988 \u2013 R 1 182 13 per annum, (all-inclusive package),Grade 3: R 1 253 415 \u2013 R 1 561 734 per annum, (all-inclusive package)",
    "closing_date_detail": "16-01-2026",
    "enquiries": "Dr. L. Luthuli Tel No- (011) 812 5163",
    "requirements": "MBCHB degree registered with HPCSA as a Medical Officer independent practitioner. Active registration to with the HPCSA for the current financial year.",
    "duties": "The incumbent will be responsible for interviewing, investigating, diagnosing and overseeing the treatment of patients. Attendance of relevant administrative meeting like mortality meetings, near miss meetings and completing Medico legal documents timeously (e.g. Death certificate). Improving quality of care by providing appropriate clinical care. Reduce medical litigation by exercising good clinical ethos. Implement and monitor adherence to National Core Standards (Norms and Standard). Participating in all activities of the discipline in relations to teaching and research. Participate in multidisciplinary team to the management of patients. Performance of practical procedures relevant to the patients. Ensure that administration and record keeping is done in the department. Primaries in internal Medicine, HIV Diploma and experience will be an added advantage.",
    "notes": "Applications should be submitted strictly online at the following E-Recruitment portal: http://jobs.gauteng.gov.za. No hand-delivered, faxed, or emailed applications will be accepted. For assistance with online applications please email your query to healthjobqueries@gauteng.gov.za . NB: Where Driver\u2019s Licence is mandatory, exception will be granted for people with disabilities. Application should be accompanied by a fully completed and signed new Z83 application form obtainable from any Public Service Department or on the internet at www.dpsa.gov.za/documents plus a recently updated comprehensive Curriculum Vitae (CV), Registration Certificate with relevant professional body (HPCSA) and a proof of current registration (Annual Practicing Certificate/Card). Applications without proof of a new Z83 application form, a detailed CV, registration certificate and a proof of current registration card/certificate with relevant professional body will be disqualified. (Shortlisted candidates will receive communication from HR to submit certified copies of educational qualifications and other relevant documents not older than 6 months on or before the day of the interview). It is the applicant\u2019s responsibility to have foreign qualifications evaluated by the South African Qualifications Authority (SAQA). All foreign qualification must be accompanied by evaluation certificate from the South African Qualification Authority (SAQA). Correspondence will only be limited to shortlisted candidates. If you have not been contacted within 3 months of the closing date of this advertisement, please accept that your application was unsuccessful. Suitable candidates will be subjected to a personnel suitability check (criminal record, citizenship, credit record checks, qualification verification and employment verification). Where applicable, candidates will be subjected to a skills/knowledge test. The recommended candidate may be subjected to Medical Surveillance as required by the Occupational Health and Safety Act, Act 5/1993. It is Department\u2019s intention to promote representivity (race, gender, and disability) in the Public Service through the filling of these posts. The Department reserves the right not to appoint/fill this post. WOMEN AND PEOPLE WITH DISABILITY ARE ENCOURAGED TO APPLY.",
    "full_text": "HOME\nJOBS\nABOUT US\nACCOUNT\n\n\n\nJob Details\nDepartment of Health\nMEDICAL OFFICER GRADE 1 - INTERNAL MEDICINE\nReference Number : refs/034947\nDirectorate : Medical\nNumber of Posts : 2\nPackage : Grade 1: R 949 146 \u2013 R 1 021 911 per annum, (all-inclusive package) , Grade 2: R 1 082 988 \u2013 R 1 182 13 per annum, (all-inclusive package),Grade 3: R 1 253 415 \u2013 R 1 561 734 per annum, (all-inclusive package)\nEnquiries : Dr. L. Luthuli Tel No- (011) 812 5163\n\nRequirements :\n\nMBCHB degree registered with HPCSA as a Medical Officer independent practitioner. Active registration to with the HPCSA for the current financial year.\n\nDuties :\n\nThe incumbent will be responsible for interviewing, investigating, diagnosing and overseeing the treatment of patients. Attendance of relevant administrative meeting like mortality meetings, near miss meetings and completing Medico legal documents timeously (e.g. Death certificate). Improving quality of care by providing appropriate clinical care. Reduce medical litigation by exercising good clinical ethos. Implement and monitor adherence to National Core Standards (Norms and Standard). Participating in all activities of the discipline in relations to teaching and research. Participate in multidisciplinary team to the management of patients. Performance of practical procedures relevant to the patients. Ensure that administration and record keeping is done in the department. Primaries in internal Medicine, HIV Diploma and experience will be an added advantage.\n\nNotes :\n\nApplications should be submitted strictly online at the following E-Recruitment portal: http://jobs.gauteng.gov.za. No hand-delivered, faxed, or emailed applications will be accepted. For assistance with online applications please email your query to healthjobqueries@gauteng.gov.za . NB: Where Driver\u2019s Licence is mandatory, exception will be granted for people with disabilities. Application should be accompanied by a fully completed and signed new Z83 application form obtainable from any Public Service Department or on the internet at www.dpsa.gov.za/documents plus a recently updated comprehensive Curriculum Vitae (CV), Registration Certificate with relevant professional body (HPCSA) and a proof of current registration (Annual Practicing Certificate/Card). Applications without proof of a new Z83 application form, a detailed CV, registration certificate and a proof of current registration card/certificate with relevant professional body will be disqualified. (Shortlisted candidates will receive communication from HR to submit certified copies of educational qualifications and other relevant documents not older than 6 months on or before the day of the interview). It is the applicant\u2019s responsibility to have foreign qualifications evaluated by the South African Qualifications Authority (SAQA). All foreign qualification must be accompanied by evaluation certificate from the South African Qualification Authority (SAQA). Correspondence will only be limited to shortlisted candidates. If you have not been contacted within 3 months of the closing date of this advertisement, please accept that your application was unsuccessful. Suitable candidates will be subjected to a personnel suitability check (criminal record, citizenship, credit record checks, qualification verification and employment verification). Where applicable, candidates will be subjected to a skills/knowledge test. The recommended candidate may be subjected to Medical Surveillance as required by the Occupational Health and Safety Act, Act 5/1993. It is Department\u2019s intention to promote representivity (race, gender, and disability) in the Public Service through the filling of these posts. The Department reserves the right not to appoint/fill this post. WOMEN AND PEOPLE WITH DISABILITY ARE ENCOURAGED TO APPLY.\n\nEmployer : Department of Health\n\nLocation : Pholosong Regional Hospital\n\nClosing Date : 16-01-2026\n\n\n\nCriteria Questions\nDo you have a MBCHB degree registered with HPCSA as a Medical Officer independent practitioner?\nDo you have active registration with the HPCSA for the current financial year?\n\n\n\nPlease Notes :\n\nDue to the large number of applications we envisage receiving, applications will not be acknowledged. If you do not receive any response within 3 months, please accept that your application was not successful.\n\n\nFind us\nAddress\n75 Fox Street, Mashalltown\nJohannesburg\n2000\n\nCall us\n\nPhone\n080 022 8827\nEmail\nsupport@gauteng.gov.za\n\nQuick Links\nAll Jobs\nAbout Us\n\n\u00a9 Gauteng Provincial Government 2026 . Powered by Department of e-Government"
  },
  {
    "position": "MEDICAL OFFICER GRADE 1 - RADIOLOGY",
    "location": "Pholosong Regional Hospital",
    "package": "Grade 1: R 949 146 \u2013 R 1 021 911 per annum, (all-inclusive package), Grade 2: R 1 082 988 \u2013 R 1 182 13 per annum, (all-inclusive package), Grade 3: R 1 253 415 \u2013 R 1 561 734 per annum, (all-inclusive package)",
    "closing_date": "2026/01/16",
    "link": "https://jobs.gauteng.gov.za/Public/ViewJob.aspx?u=E7CSZ5GRR4FUQVpbYVlVvA==",
    "title": "MEDICAL OFFICER GRADE 1 - RADIOLOGY",
    "reference_number": "refs/034946",
    "directorate": "Medical",
    "centre": "Pholosong Regional Hospital",
    "package_detail": "Grade 1: R 949 146 \u2013 R 1 021 911 per annum, (all-inclusive package), Grade 2: R 1 082 988 \u2013 R 1 182 13 per annum, (all-inclusive package), Grade 3: R 1 253 415 \u2013 R 1 561 734 per annum, (all-inclusive package)",
    "closing_date_detail": "16-01-2026",
    "enquiries": "Dr. N Jwara Tel No- (011) 812 5163",
    "requirements": "MBCHB degree registered with HPCSA as a Medical Officer independent practice with annual registration to practice and registration as a Medical Officer independent practitioner.",
    "duties": "The incumbent will be responsible for interviewing, investigating, diagnosing and overseeing the treatment of patients. Attendance of relevant administrative meeting like mortality meetings, near miss meetings and completing Medico legal documents timeously (e.g. Death certificate). Improving quality of care by providing appropriate clinical care. Reduce medical litigation by exercising good clinical ethos. Implement and monitor adherence to National Core Standards (Norms and Standard). Participating in all activities of the discipline in relations to teaching and research. Participate in multidisciplinary team to the management of patients. Performance of practical procedures relevant to the patients. Ensure that administration and record keeping is done in the department. Primaries in radiology and experience in radiology are an added advantage.",
    "notes": "Applications should be submitted strictly online at the following E-Recruitment portal: http://jobs.gauteng.gov.za. No hand-delivered, faxed, or emailed applications will be accepted. For assistance with online applications please email your query to healthjobqueries@gauteng.gov.za . NB: Where Driver\u2019s Licence is mandatory, exception will be granted for people with disabilities. Application should be accompanied by a fully completed and signed new Z83 application form obtainable from any Public Service Department or on the internet at www.dpsa.gov.za/documents plus a recently updated comprehensive Curriculum Vitae (CV), Registration Certificate with relevant professional body (HPCSA) and a proof of current registration (Annual Practicing Certificate/Card). Applications without proof of a new Z83 application form, a detailed CV, registration certificate and a proof of current registration card/certificate with relevant professional body will be disqualified. (Shortlisted candidates will receive communication from HR to submit certified copies of educational qualifications and other relevant documents not older than 6 months on or before the day of the interview). It is the applicant\u2019s responsibility to have foreign qualifications evaluated by the South African Qualifications Authority (SAQA). All foreign qualification must be accompanied by evaluation certificate from the South African Qualification Authority (SAQA). Correspondence will only be limited to shortlisted candidates. If you have not been contacted within 3 months of the closing date of this advertisement, please accept that your application was unsuccessful. Suitable candidates will be subjected to a personnel suitability check (criminal record, citizenship, credit record checks, qualification verification and employment verification). Where applicable, candidates will be subjected to a skills/knowledge test. The recommended candidate may be subjected to Medical Surveillance as required by the Occupational Health and Safety Act, Act 5/1993. It is Department\u2019s intention to promote representivity (race, gender, and disability) in the Public Service through the filling of these posts. The Department reserves the right not to appoint/fill this post. WOMEN AND PEOPLE WITH DISABILITY ARE ENCOURAGED TO APPLY.",
    "full_text": "HOME\nJOBS\nABOUT US\nACCOUNT\n\n\n\nJob Details\nDepartment of Health\nMEDICAL OFFICER GRADE 1 - RADIOLOGY\nReference Number : refs/034946\nDirectorate : Medical\nNumber of Posts : 1\nPackage : Grade 1: R 949 146 \u2013 R 1 021 911 per annum, (all-inclusive package), Grade 2: R 1 082 988 \u2013 R 1 182 13 per annum, (all-inclusive package), Grade 3: R 1 253 415 \u2013 R 1 561 734 per annum, (all-inclusive package)\nEnquiries : Dr. N Jwara Tel No- (011) 812 5163\n\nRequirements :\n\nMBCHB degree registered with HPCSA as a Medical Officer independent practice with annual registration to practice and registration as a Medical Officer independent practitioner.\n\nDuties :\n\nThe incumbent will be responsible for interviewing, investigating, diagnosing and overseeing the treatment of patients. Attendance of relevant administrative meeting like mortality meetings, near miss meetings and completing Medico legal documents timeously (e.g. Death certificate). Improving quality of care by providing appropriate clinical care. Reduce medical litigation by exercising good clinical ethos. Implement and monitor adherence to National Core Standards (Norms and Standard). Participating in all activities of the discipline in relations to teaching and research. Participate in multidisciplinary team to the management of patients. Performance of practical procedures relevant to the patients. Ensure that administration and record keeping is done in the department. Primaries in radiology and experience in radiology are an added advantage.\n\nNotes :\n\nApplications should be submitted strictly online at the following E-Recruitment portal: http://jobs.gauteng.gov.za. No hand-delivered, faxed, or emailed applications will be accepted. For assistance with online applications please email your query to healthjobqueries@gauteng.gov.za . NB: Where Driver\u2019s Licence is mandatory, exception will be granted for people with disabilities. Application should be accompanied by a fully completed and signed new Z83 application form obtainable from any Public Service Department or on the internet at www.dpsa.gov.za/documents plus a recently updated comprehensive Curriculum Vitae (CV), Registration Certificate with relevant professional body (HPCSA) and a proof of current registration (Annual Practicing Certificate/Card). Applications without proof of a new Z83 application form, a detailed CV, registration certificate and a proof of current registration card/certificate with relevant professional body will be disqualified. (Shortlisted candidates will receive communication from HR to submit certified copies of educational qualifications and other relevant documents not older than 6 months on or before the day of the interview). It is the applicant\u2019s responsibility to have foreign qualifications evaluated by the South African Qualifications Authority (SAQA). All foreign qualification must be accompanied by evaluation certificate from the South African Qualification Authority (SAQA). Correspondence will only be limited to shortlisted candidates. If you have not been contacted within 3 months of the closing date of this advertisement, please accept that your application was unsuccessful. Suitable candidates will be subjected to a personnel suitability check (criminal record, citizenship, credit record checks, qualification verification and employment verification). Where applicable, candidates will be subjected to a skills/knowledge test. The recommended candidate may be subjected to Medical Surveillance as required by the Occupational Health and Safety Act, Act 5/1993. It is Department\u2019s intention to promote representivity (race, gender, and disability) in the Public Service through the filling of these posts. The Department reserves the right not to appoint/fill this post. WOMEN AND PEOPLE WITH DISABILITY ARE ENCOURAGED TO APPLY.\n\nEmployer : Department of Health\n\nLocation : Pholosong Regional Hospital\n\nClosing Date : 16-01-2026\n\n\n\nCriteria Questions\nDo you have a MBCHB degree registered with HPCSA as a Medical Officer independent practice?\nDo you have annual registration to practice and registration as a Medical Officer independent practitioner?\n\n\n\nPlease Notes :\n\nDue to the large number of applications we envisage receiving, applications will not be acknowledged. If you do not receive any response within 3 months, please accept that your application was not successful.\n\n\nFind us\nAddress\n75 Fox Street, Mashalltown\nJohannesburg\n2000\n\nCall us\n\nPhone\n080 022 8827\nEmail\nsupport@gauteng.gov.za\n\nQuick Links\nAll Jobs\nAbout Us\n\n\u00a9 Gauteng Provincial Government 2026 . Powered by Department of e-Government"
  },
  {
    "position": "MEDICAL OFFICER GRADE 1- OBSTETRICS & GYNAECOLOGY",
    "location": "Pholosong Regional Hospital",
    "package": "Grade 1- R 949 146 \u2013 R 1 021 911 per annum, (all-inclusive package), Grade 2- R 1 082 988 \u2013 R 1 182 13 per annum, (all-inclusive package), Grade 3- R 1 253 415 \u2013 R 1 561 734 per annum, (all-inclusive package",
    "closing_date": "2026/01/16",
    "link": "https://jobs.gauteng.gov.za/Public/ViewJob.aspx?u=E7CSZ5GRR4G1L6qCBzaAHg==",
    "title": "MEDICAL OFFICER GRADE 1- OBSTETRICS & GYNAECOLOGY",
    "reference_number": "refs/034945",
    "directorate": "Medical",
    "centre": "Pholosong Regional Hospital",
    "package_detail": "Grade 1- R 949 146 \u2013 R 1 021 911 per annum, (all-inclusive package), Grade 2- R 1 082 988 \u2013 R 1 182 13 per annum, (all-inclusive package), Grade 3- R 1 253 415 \u2013 R 1 561 734 per annum, (all-inclusive package",
    "closing_date_detail": "16-01-2026",
    "enquiries": "Dr. L. Luthuli Tel No- (011) 812 5163",
    "requirements": "MBCHB degree registered with HPCSA as a Medical Officer independent practitioner. Active registration with the HPCSA for the current financial year.",
    "duties": "The incumbent will be responsible for interviewing, investigating, diagnosing and overseeing the treatment of patients. Attendance of relevant administrative meeting like mortality meetings, near miss meetings and completing Medico legal documents timeously (e.g. Death certificate). Improving quality of care by providing appropriate clinical care. Reduce medical litigation by exercising good clinical ethos. Implement and monitor adherence to National Core Standards (Norms and Standard). Participating in all activities of the discipline in relations to teaching and research. Participate in multidisciplinary team to the management of patients. Performance of practical procedures relevant to the patients. Ensure that administration and record keeping is done in the department. Experience and a diploma in obstetrics & gynaecology will be an added advantage",
    "notes": "Applications should be submitted strictly online at the following E-Recruitment portal: http://jobs.gauteng.gov.za. No hand-delivered, faxed, or emailed applications will be accepted. For assistance with online applications please email your query to healthjobqueries@gauteng.gov.za . NB: Where Driver\u2019s Licence is mandatory, exception will be granted for people with disabilities. Application should be accompanied by a fully completed and signed new Z83 application form obtainable from any Public Service Department or on the internet at www.dpsa.gov.za/documents plus a recently updated comprehensive Curriculum Vitae (CV), Registration Certificate with relevant professional body (HPCSA) and a proof of current registration (Annual Practicing Certificate/Card). Applications without proof of a new Z83 application form, a detailed CV, registration certificate and a proof of current registration card/certificate with relevant professional body will be disqualified. (Shortlisted candidates will receive communication from HR to submit certified copies of educational qualifications and other relevant documents not older than 6 months on or before the day of the interview). It is the applicant\u2019s responsibility to have foreign qualifications evaluated by the South African Qualifications Authority (SAQA). All foreign qualification must be accompanied by evaluation certificate from the South African Qualification Authority (SAQA). Correspondence will only be limited to shortlisted candidates. If you have not been contacted within 3 months of the closing date of this advertisement, please accept that your application was unsuccessful. Suitable candidates will be subjected to a personnel suitability check (criminal record, citizenship, credit record checks, qualification verification and employment verification). Where applicable, candidates will be subjected to a skills/knowledge test. The recommended candidate may be subjected to Medical Surveillance as required by the Occupational Health and Safety Act, Act 5/1993. It is Department\u2019s intention to promote representivity (race, gender, and disability) in the Public Service through the filling of these posts. The Department reserves the right not to appoint/fill this post. WOMEN AND PEOPLE WITH DISABILITY ARE ENCOURAGED TO APPLY.",
    "full_text": "HOME\nJOBS\nABOUT US\nACCOUNT\n\n\n\nJob Details\nDepartment of Health\nMEDICAL OFFICER GRADE 1- OBSTETRICS & GYNAECOLOGY\nReference Number : refs/034945\nDirectorate : Medical\nNumber of Posts : 2\nPackage : Grade 1- R 949 146 \u2013 R 1 021 911 per annum, (all-inclusive package), Grade 2- R 1 082 988 \u2013 R 1 182 13 per annum, (all-inclusive package), Grade 3- R 1 253 415 \u2013 R 1 561 734 per annum, (all-inclusive package\nEnquiries : Dr. L. Luthuli Tel No- (011) 812 5163\n\nRequirements :\n\nMBCHB degree registered with HPCSA as a Medical Officer independent practitioner. Active registration with the HPCSA for the current financial year.\n\nDuties :\n\nThe incumbent will be responsible for interviewing, investigating, diagnosing and overseeing the treatment of patients. Attendance of relevant administrative meeting like mortality meetings, near miss meetings and completing Medico legal documents timeously (e.g. Death certificate). Improving quality of care by providing appropriate clinical care. Reduce medical litigation by exercising good clinical ethos. Implement and monitor adherence to National Core Standards (Norms and Standard). Participating in all activities of the discipline in relations to teaching and research. Participate in multidisciplinary team to the management of patients. Performance of practical procedures relevant to the patients. Ensure that administration and record keeping is done in the department. Experience and a diploma in obstetrics & gynaecology will be an added advantage\n\nNotes :\n\nApplications should be submitted strictly online at the following E-Recruitment portal: http://jobs.gauteng.gov.za. No hand-delivered, faxed, or emailed applications will be accepted. For assistance with online applications please email your query to healthjobqueries@gauteng.gov.za . NB: Where Driver\u2019s Licence is mandatory, exception will be granted for people with disabilities. Application should be accompanied by a fully completed and signed new Z83 application form obtainable from any Public Service Department or on the internet at www.dpsa.gov.za/documents plus a recently updated comprehensive Curriculum Vitae (CV), Registration Certificate with relevant professional body (HPCSA) and a proof of current registration (Annual Practicing Certificate/Card). Applications without proof of a new Z83 application form, a detailed CV, registration certificate and a proof of current registration card/certificate with relevant professional body will be disqualified. (Shortlisted candidates will receive communication from HR to submit certified copies of educational qualifications and other relevant documents not older than 6 months on or before the day of the interview). It is the applicant\u2019s responsibility to have foreign qualifications evaluated by the South African Qualifications Authority (SAQA). All foreign qualification must be accompanied by evaluation certificate from the South African Qualification Authority (SAQA). Correspondence will only be limited to shortlisted candidates. If you have not been contacted within 3 months of the closing date of this advertisement, please accept that your application was unsuccessful. Suitable candidates will be subjected to a personnel suitability check (criminal record, citizenship, credit record checks, qualification verification and employment verification). Where applicable, candidates will be subjected to a skills/knowledge test. The recommended candidate may be subjected to Medical Surveillance as required by the Occupational Health and Safety Act, Act 5/1993. It is Department\u2019s intention to promote representivity (race, gender, and disability) in the Public Service through the filling of these posts. The Department reserves the right not to appoint/fill this post. WOMEN AND PEOPLE WITH DISABILITY ARE ENCOURAGED TO APPLY.\n\nEmployer : Department of Health\n\nLocation : Pholosong Regional Hospital\n\nClosing Date : 16-01-2026\n\n\n\nCriteria Questions\nDo you have a MBCHB degree registered with HPCSA as a Medical Officer independent practitioner?\nDo you have active registration with the HPCSA for the current financial year?\n\n\n\nPlease Notes :\n\nDue to the large number of applications we envisage receiving, applications will not be acknowledged. If you do not receive any response within 3 months, please accept that your application was not successful.\n\n\nFind us\nAddress\n75 Fox Street, Mashalltown\nJohannesburg\n2000\n\nCall us\n\nPhone\n080 022 8827\nEmail\nsupport@gauteng.gov.za\n\nQuick Links\nAll Jobs\nAbout Us\n\n\u00a9 Gauteng Provincial Government 2026 . Powered by Department of e-Government"
  },
  {
    "position": "MEDICAL OFFICER GRADE 1 - PAEDIATRICS",
    "location": "Pholosong Regional Hospital",
    "package": "Grade 1- R 949 146 \u2013 R 1 021 911 per annum, (all-inclusive package), Grade 2- R 1 082 988 \u2013 R 1 182 13 per annum, (all-inclusive package), Grade 3- R 1 253 415 \u2013 R 1 561 734 per annum, (all-inclusive package)",
    "closing_date": "2026/01/16",
    "link": "https://jobs.gauteng.gov.za/Public/ViewJob.aspx?u=57glvgJbW+Lb7T/8R1xyjA==",
    "title": "MEDICAL OFFICER GRADE 1 - PAEDIATRICS",
    "reference_number": "REFS/034944",
    "directorate": "Medical",
    "centre": "Pholosong Regional Hospital",
    "package_detail": "Grade 1- R 949 146 \u2013 R 1 021 911 per annum, (all-inclusive package), Grade 2- R 1 082 988 \u2013 R 1 182 13 per annum, (all-inclusive package), Grade 3- R 1 253 415 \u2013 R 1 561 734 per annum, (all-inclusive package)",
    "closing_date_detail": "16-01-2026",
    "enquiries": "Dr L Luthuli Tel No- (011) 812 5163",
    "requirements": "MBCHB degree registered with HPCSA as a Medical Officer independent practitioner. Active registration to with the HPCSA for the current financial year.",
    "duties": "The incumbent will be responsible for interviewing, investigating, diagnosing and overseeing the treatment of patients. Attendance of relevant administrative meeting like mortality meetings, near miss meetings and completing Medico legal documents timeously (e.g. Death certificate). Improving quality of care by providing appropriate clinical care. Reduce medical litigation by exercising good clinical ethos. Implement and monitor adherence to National Core Standards (Norms and Standard). Participating in all activities of the discipline in relations to teaching and research. Participate in multidisciplinary team to the management of patients. Performance of practical procedures relevant to the patients. Ensure that administration and record keeping is done in the department. A diploma in Child health and experience working in paediatrics department will be an added advantage",
    "notes": "Applications should be submitted strictly online at the following E-Recruitment portal: http://jobs.gauteng.gov.za. No hand-delivered, faxed, or emailed applications will be accepted. For assistance with online applications please email your query to healthjobqueries@gauteng.gov.za . NB: Where Driver\u2019s Licence is mandatory, exception will be granted for people with disabilities. Application should be accompanied by a fully completed and signed new Z83 application form obtainable from any Public Service Department or on the internet at www.dpsa.gov.za/documents plus a recently updated comprehensive Curriculum Vitae (CV), Registration Certificate with relevant professional body (HPCSA) and a proof of current registration (Annual Practicing Certificate/Card). Applications without proof of a new Z83 application form, a detailed CV, registration certificate and a proof of current registration card/certificate with relevant professional body will be disqualified. (Shortlisted candidates will receive communication from HR to submit certified copies of educational qualifications and other relevant documents not older than 6 months on or before the day of the interview). It is the applicant\u2019s responsibility to have foreign qualifications evaluated by the South African Qualifications Authority (SAQA). All foreign qualification must be accompanied by evaluation certificate from the South African Qualification Authority (SAQA). Correspondence will only be limited to shortlisted candidates. If you have not been contacted within 3 months of the closing date of this advertisement, please accept that your application was unsuccessful. Suitable candidates will be subjected to a personnel suitability check (criminal record, citizenship, credit record checks, qualification verification and employment verification). Where applicable, candidates will be subjected to a skills/knowledge test. The recommended candidate may be subjected to Medical Surveillance as required by the Occupational Health and Safety Act, Act 5/1993. It is Department\u2019s intention to promote representivity (race, gender, and disability) in the Public Service through the filling of these posts. The Department reserves the right not to appoint/fill this post. WOMEN AND PEOPLE WITH DISABILITY ARE ENCOURAGED TO APPLY.",
    "full_text": "HOME\nJOBS\nABOUT US\nACCOUNT\n\n\n\nJob Details\nDepartment of Health\nMEDICAL OFFICER GRADE 1 - PAEDIATRICS\nReference Number : REFS/034944\nDirectorate : Medical\nNumber of Posts : 2\nPackage : Grade 1- R 949 146 \u2013 R 1 021 911 per annum, (all-inclusive package), Grade 2- R 1 082 988 \u2013 R 1 182 13 per annum, (all-inclusive package), Grade 3- R 1 253 415 \u2013 R 1 561 734 per annum, (all-inclusive package)\nEnquiries : Dr L Luthuli Tel No- (011) 812 5163\n\nRequirements :\n\nMBCHB degree registered with HPCSA as a Medical Officer independent practitioner. Active registration to with the HPCSA for the current financial year.\n\nDuties :\n\nThe incumbent will be responsible for interviewing, investigating, diagnosing and overseeing the treatment of patients. Attendance of relevant administrative meeting like mortality meetings, near miss meetings and completing Medico legal documents timeously (e.g. Death certificate). Improving quality of care by providing appropriate clinical care. Reduce medical litigation by exercising good clinical ethos. Implement and monitor adherence to National Core Standards (Norms and Standard). Participating in all activities of the discipline in relations to teaching and research. Participate in multidisciplinary team to the management of patients. Performance of practical procedures relevant to the patients. Ensure that administration and record keeping is done in the department. A diploma in Child health and experience working in paediatrics department will be an added advantage\n\nNotes :\n\nApplications should be submitted strictly online at the following E-Recruitment portal: http://jobs.gauteng.gov.za. No hand-delivered, faxed, or emailed applications will be accepted. For assistance with online applications please email your query to healthjobqueries@gauteng.gov.za . NB: Where Driver\u2019s Licence is mandatory, exception will be granted for people with disabilities. Application should be accompanied by a fully completed and signed new Z83 application form obtainable from any Public Service Department or on the internet at www.dpsa.gov.za/documents plus a recently updated comprehensive Curriculum Vitae (CV), Registration Certificate with relevant professional body (HPCSA) and a proof of current registration (Annual Practicing Certificate/Card). Applications without proof of a new Z83 application form, a detailed CV, registration certificate and a proof of current registration card/certificate with relevant professional body will be disqualified. (Shortlisted candidates will receive communication from HR to submit certified copies of educational qualifications and other relevant documents not older than 6 months on or before the day of the interview). It is the applicant\u2019s responsibility to have foreign qualifications evaluated by the South African Qualifications Authority (SAQA). All foreign qualification must be accompanied by evaluation certificate from the South African Qualification Authority (SAQA). Correspondence will only be limited to shortlisted candidates. If you have not been contacted within 3 months of the closing date of this advertisement, please accept that your application was unsuccessful. Suitable candidates will be subjected to a personnel suitability check (criminal record, citizenship, credit record checks, qualification verification and employment verification). Where applicable, candidates will be subjected to a skills/knowledge test. The recommended candidate may be subjected to Medical Surveillance as required by the Occupational Health and Safety Act, Act 5/1993. It is Department\u2019s intention to promote representivity (race, gender, and disability) in the Public Service through the filling of these posts. The Department reserves the right not to appoint/fill this post. WOMEN AND PEOPLE WITH DISABILITY ARE ENCOURAGED TO APPLY.\n\nEmployer : Department of Health\n\nLocation : Pholosong Regional Hospital\n\nClosing Date : 16-01-2026\n\n\n\nCriteria Questions\nDo you have an appropriate qualification(degree/ equivalent qualification) that allows for the required registration with the Health Professionals Council of South Africa (HPCSA)?\nDo you have active registration with the HPCSA for the current financial year?\n\n\n\nPlease Notes :\n\nDue to the large number of applications we envisage receiving, applications will not be acknowledged. If you do not receive any response within 3 months, please accept that your application was not successful.\n\n\nFind us\nAddress\n75 Fox Street, Mashalltown\nJohannesburg\n2000\n\nCall us\n\nPhone\n080 022 8827\nEmail\nsupport@gauteng.gov.za\n\nQuick Links\nAll Jobs\nAbout Us\n\n\u00a9 Gauteng Provincial Government 2026 . Powered by Department of e-Government"
  },
  {
    "position": "Assistant Director: Communication Officer",
    "location": "Charlotte Maxeke Johannesburg Academic Hospital",
    "package": "R468 459.00 per annum (plus benefits)",
    "closing_date": "2026/01/09",
    "link": "https://jobs.gauteng.gov.za/Public/ViewJob.aspx?u=Awpj99fb8YVHG3pp3CfR6A==",
    "title": "Assistant Director: Communication Officer",
    "reference_number": "REFS/024369",
    "directorate": "Communications",
    "centre": "Charlotte Maxeke Johannesburg Academic Hospital",
    "package_detail": "R468 459.00 per annum (plus benefits)",
    "closing_date_detail": "09-01-2026",
    "enquiries": "Ms G Bogoshi TEL 011 488 3792 Ms L Maseko Tel 011 488 3711",
    "requirements": "Matric and appropriate three (3) year National Diploma or Degree from a recognized SAQA accredited tertiary institution in Public Relations/ Communication Science/ Communication management or Journalism. At least three (3) years\u2019 experience as Communication Officer. Skills: sound interpersonal relations, project planning skills, ability to prepare reports. Good communication skills both verbal and written. Must be computer literate. Knowledge: Good understanding and knowledge of communication must have a valid driver\u2019s licence.",
    "duties": "Plan, implement and oversee both internal and external communication. Formulate and implement communication strategies. Coordinate outreach and communication activities. Manage effectively and economically the hospital resources for public education, public relations, media services and stakeholder relations. Drive and coordinate generation of good news to cater for various media platforms and formats inclusive of corporate publications, media statements, electronics media, social media, visual and audio, live interviews. Coordinate responses to media enquiries and legislature Reponses. Provide communication support to the various department\u2019s events and activities. Ensure that hospital has adequate communication materials and publications at all times. Publish quarterly internal newsletters, coordination of the annual open day events. Manage and develop content for hospital\u2019s social media accounts. Carry out photo coverage in all events, implement social media strategy in line with departmental corporate identity with cooperate identity manual. Secretary and liaison between hospital board.",
    "notes": "Kindly note that No payment of any kind is required when applying for posts advertised by the Gauteng Department of Health. The Department reserves the right not to fill any advertised posts. Applications should be submitted strictly online at the following E-Recruitment portal: https://jobs.gauteng.gov.za.No hand-delivered, faxed, or emailed applications will be accepted. For assistance with online applications please email your query to healthjobqueries@gauteng.gov.za. Application should be accompanied by a fully completed and signed new Z83 form obtainable from any Public Service Department or on the internet at www.dpsa.gov.za/documents.The Z83 form must be fully completed and singed by the applicant. The following must be considered in relation to the completion of the Z83 by applicant. All the fields in Part A, Part C and Part D must be completed. Leave the following question blank if they are not possession of such: \u201dIf your profession or occupation requires official registration, provide date and particulars of registration\u201d. Application without proof of a new Z83 application form and detailed CV will be disqualified. Application must indicate the post reference number on their application. Shortlisted candidates will receive communication from HR Unit to submit certified copies of educational qualifications and other relevant documents not older than 6 months on or before the day of the interview). Personnel Suitability Checks (criminal checks, citizenship checks, qualification verification, company directorship, social media, financial record checks, reference checks) must be conducted prior appointment. Candidates in possession of a foreign qualification must furnish the Department with an evaluation certificate from the South African Qualification Authority (SAQA). Applicants with foreign qualification remain responsible for ensuring that their qualification are evaluated by the South African Qualification Authority (SAQA). The recommended candidate may be subjected to medical surveillance as require by the Occupational Health and Safety Act 5/1993. The Gauteng Department of Health is guided by the principles of Employment Equity. People with disabilities are encouraged to apply.",
    "full_text": "HOME\nJOBS\nABOUT US\nACCOUNT\n\n\n\nJob Details\nDepartment of Health\nAssistant Director: Communication Officer\nReference Number : REFS/024369\nDirectorate : Communications\nNumber of Posts : 1\nPackage : R468 459.00 per annum (plus benefits)\nEnquiries : Ms G Bogoshi TEL 011 488 3792 Ms L Maseko Tel 011 488 3711\n\nRequirements :\n\nMatric and appropriate three (3) year National Diploma or Degree from a recognized SAQA accredited tertiary institution in Public Relations/ Communication Science/ Communication management or Journalism. At least three (3) years\u2019 experience as Communication Officer. Skills: sound interpersonal relations, project planning skills, ability to prepare reports. Good communication skills both verbal and written. Must be computer literate. Knowledge: Good understanding and knowledge of communication must have a valid driver\u2019s licence.\n\nDuties :\n\nPlan, implement and oversee both internal and external communication. Formulate and implement communication strategies. Coordinate outreach and communication activities. Manage effectively and economically the hospital resources for public education, public relations, media services and stakeholder relations. Drive and coordinate generation of good news to cater for various media platforms and formats inclusive of corporate publications, media statements, electronics media, social media, visual and audio, live interviews. Coordinate responses to media enquiries and legislature Reponses. Provide communication support to the various department\u2019s events and activities. Ensure that hospital has adequate communication materials and publications at all times. Publish quarterly internal newsletters, coordination of the annual open day events. Manage and develop content for hospital\u2019s social media accounts. Carry out photo coverage in all events, implement social media strategy in line with departmental corporate identity with cooperate identity manual. Secretary and liaison between hospital board.\n\nNotes :\n\nKindly note that No payment of any kind is required when applying for posts advertised by the Gauteng Department of Health. The Department reserves the right not to fill any advertised posts. Applications should be submitted strictly online at the following E-Recruitment portal: https://jobs.gauteng.gov.za.No hand-delivered, faxed, or emailed applications will be accepted. For assistance with online applications please email your query to healthjobqueries@gauteng.gov.za. Application should be accompanied by a fully completed and signed new Z83 form obtainable from any Public Service Department or on the internet at www.dpsa.gov.za/documents.The Z83 form must be fully completed and singed by the applicant. The following must be considered in relation to the completion of the Z83 by applicant. All the fields in Part A, Part C and Part D must be completed. Leave the following question blank if they are not possession of such: \u201dIf your profession or occupation requires official registration, provide date and particulars of registration\u201d. Application without proof of a new Z83 application form and detailed CV will be disqualified. Application must indicate the post reference number on their application. Shortlisted candidates will receive communication from HR Unit to submit certified copies of educational qualifications and other relevant documents not older than 6 months on or before the day of the interview). Personnel Suitability Checks (criminal checks, citizenship checks, qualification verification, company directorship, social media, financial record checks, reference checks) must be conducted prior appointment. Candidates in possession of a foreign qualification must furnish the Department with an evaluation certificate from the South African Qualification Authority (SAQA). Applicants with foreign qualification remain responsible for ensuring that their qualification are evaluated by the South African Qualification Authority (SAQA). The recommended candidate may be subjected to medical surveillance as require by the Occupational Health and Safety Act 5/1993. The Gauteng Department of Health is guided by the principles of Employment Equity. People with disabilities are encouraged to apply.\n\nEmployer : Department of Health\n\nLocation : Charlotte Maxeke Johannesburg Academic Hospital\n\nClosing Date : 09-01-2026\n\n\n\nCriteria Questions\nDo you have a Matric and appropriate three (3) year National Diploma or Degree from a recognized SAQA accredited tertiary institution in Public Relations/ Communication Science/ Communication management or Journalism?\nDo you have at least three (3) years\u2019 experience as Communication Officer?\n\n\n\nPlease Notes :\n\nDue to the large number of applications we envisage receiving, applications will not be acknowledged. If you do not receive any response within 3 months, please accept that your application was not successful.\n\n\nFind us\nAddress\n75 Fox Street, Mashalltown\nJohannesburg\n2000\n\nCall us\n\nPhone\n080 022 8827\nEmail\nsupport@gauteng.gov.za\n\nQuick Links\nAll Jobs\nAbout Us\n\n\u00a9 Gauteng Provincial Government 2026 . Powered by Department of e-Government"
  },
  {
    "position": "Administration Officer",
    "location": "Charlotte Maxeke Johannesburg Academic Hospital",
    "package": "R 325 101.00 (per annum) plus benefits",
    "closing_date": "2026/01/09",
    "link": "https://jobs.gauteng.gov.za/Public/ViewJob.aspx?u=Awpj99fb8YV8QdedcWDXEw==",
    "title": "Administration Officer",
    "reference_number": "REFS/024368",
    "directorate": "Risk Management and Internal Control",
    "centre": "Charlotte Maxeke Johannesburg Academic Hospital",
    "package_detail": "R 325 101.00 (per annum) plus benefits",
    "closing_date_detail": "09-01-2026",
    "enquiries": "Ms. M. Dikamotse Tel No - 011 488 4841 Ms L Maseko Tel No - 011 488 3711",
    "requirements": "Grade 12 or equivalent with more than 10 years in Auditing, Accounting or Risk Management experience or National Diploma or Degree from a recognized SAQA tertiary institution in Auditing, Accounting or Risk Management between 0 and 2 years in Auditing, Accounting or Risk Management experience. Knowledge: Sound knowledge of Auditing, Accounting or Risk Management. In-basic knowledge and insight in Treasury Regulations and Public Finance Management Act. Customer relations. Computer literacy- MS Office (Word, Excel, Outlook & PowerPoint), a range of work procedures such as Finance, HR matters, Safety, Labour Matters. Administration procedures relating to specific working environment including norms and standards. Reporting procedures, procurement directives and procedures. Skills: Planning and organising, sound analytical thinking, good interpersonal relation, problem solving, decision-making and maintaining discipline. Conflict resolution, Good verbal communication and report writing skills. Ability to liaise with internal and external stakeholders (i.e. Auditor General of South Africa, Gauteng Audit Service and any other stakeholders). Loyal and strongly orientated towards teamwork, ability to operate independently, must hold high level of professionalism, confidentiality, integrity and ethical conduct. The following will be an added advantage: Supervision skills, previous experience in audit environment or completed audit articles.",
    "duties": "Monitor incidents and emerging risk reported. Monitor implementation of audit action plans. Prepare risk-based audits, financial and non-financial pre-audits and internal control assessments. Facilitate and monitor operational risk registers for all hospital business units. Monitor strategic risk register under manager\u2019s supervision. Orientate new staff on audit, risk and ethics. Conduct risk awareness campaigns. Delegated to various committees. Be abreast with legislative laws, regulations and guidelines as well as Department\u2019s circulars, policies and procedure manuals. Render Departmental administrative support service. Compile and draft management reports. (With recommendation were necessary).",
    "notes": "Kindly note that No payment of any kind is required when applying for posts advertised by the Gauteng Department of Health. The Department reserves the right not to fill any advertised posts. Applications should be submitted strictly online at the following E-Recruitment portal: https://jobs.gauteng.gov.za.No hand-delivered, faxed, or emailed applications will be accepted. For assistance with online applications please email your query to healthjobqueries@gauteng.gov.za. Application should be accompanied by a fully completed and signed new Z83 form obtainable from any Public Service Department or on the internet at www.dpsa.gov.za/documents.The Z83 form must be fully completed and singed by the applicant. The following must be considered in relation to the completion of the Z83 by applicant. All the fields in Part A, Part C and Part D must be completed. Leave the following question blank if they are not possession of such: \u201dIf your profession or occupation requires official registration, provide date and particulars of registration\u201d. Application without proof of a new Z83 application form and detailed CV will be disqualified. Application must indicate the post reference number on their application. Shortlisted candidates will receive communication from HR Unit to submit certified copies of educational qualifications and other relevant documents not older than 6 months on or before the day of the interview). Personnel Suitability Checks (criminal checks, citizenship checks, qualification verification, company directorship, social media, financial record checks, reference checks) must be conducted prior appointment. Candidates in possession of a foreign qualification must furnish the Department with an evaluation certificate from the South African Qualification Authority (SAQA). Applicants with foreign qualification remain responsible for ensuring that their qualification are evaluated by the South African Qualification Authority (SAQA). The recommended candidate may be subjected to medical surveillance as require by the Occupational Health and Safety Act 5/1993. The Gauteng Department of Health is guided by the principles of Employment Equity. People with disabilities are encouraged to apply.",
    "full_text": "HOME\nJOBS\nABOUT US\nACCOUNT\n\n\n\nJob Details\nDepartment of Health\nAdministration Officer\nReference Number : REFS/024368\nDirectorate : Risk Management and Internal Control\nNumber of Posts : 1\nPackage : R 325 101.00 (per annum) plus benefits\nEnquiries : Ms. M. Dikamotse Tel No - 011 488 4841 Ms L Maseko Tel No - 011 488 3711\n\nRequirements :\n\nGrade 12 or equivalent with more than 10 years in Auditing, Accounting or Risk Management experience or National Diploma or Degree from a recognized SAQA tertiary institution in Auditing, Accounting or Risk Management between 0 and 2 years in Auditing, Accounting or Risk Management experience. Knowledge: Sound knowledge of Auditing, Accounting or Risk Management. In-basic knowledge and insight in Treasury Regulations and Public Finance Management Act. Customer relations. Computer literacy- MS Office (Word, Excel, Outlook & PowerPoint), a range of work procedures such as Finance, HR matters, Safety, Labour Matters. Administration procedures relating to specific working environment including norms and standards. Reporting procedures, procurement directives and procedures. Skills: Planning and organising, sound analytical thinking, good interpersonal relation, problem solving, decision-making and maintaining discipline. Conflict resolution, Good verbal communication and report writing skills. Ability to liaise with internal and external stakeholders (i.e. Auditor General of South Africa, Gauteng Audit Service and any other stakeholders). Loyal and strongly orientated towards teamwork, ability to operate independently, must hold high level of professionalism, confidentiality, integrity and ethical conduct. The following will be an added advantage: Supervision skills, previous experience in audit environment or completed audit articles.\n\nDuties :\n\nMonitor incidents and emerging risk reported. Monitor implementation of audit action plans. Prepare risk-based audits, financial and non-financial pre-audits and internal control assessments. Facilitate and monitor operational risk registers for all hospital business units. Monitor strategic risk register under manager\u2019s supervision. Orientate new staff on audit, risk and ethics. Conduct risk awareness campaigns. Delegated to various committees. Be abreast with legislative laws, regulations and guidelines as well as Department\u2019s circulars, policies and procedure manuals. Render Departmental administrative support service. Compile and draft management reports. (With recommendation were necessary).\n\nNotes :\n\nKindly note that No payment of any kind is required when applying for posts advertised by the Gauteng Department of Health. The Department reserves the right not to fill any advertised posts. Applications should be submitted strictly online at the following E-Recruitment portal: https://jobs.gauteng.gov.za.No hand-delivered, faxed, or emailed applications will be accepted. For assistance with online applications please email your query to healthjobqueries@gauteng.gov.za. Application should be accompanied by a fully completed and signed new Z83 form obtainable from any Public Service Department or on the internet at www.dpsa.gov.za/documents.The Z83 form must be fully completed and singed by the applicant. The following must be considered in relation to the completion of the Z83 by applicant. All the fields in Part A, Part C and Part D must be completed. Leave the following question blank if they are not possession of such: \u201dIf your profession or occupation requires official registration, provide date and particulars of registration\u201d. Application without proof of a new Z83 application form and detailed CV will be disqualified. Application must indicate the post reference number on their application. Shortlisted candidates will receive communication from HR Unit to submit certified copies of educational qualifications and other relevant documents not older than 6 months on or before the day of the interview). Personnel Suitability Checks (criminal checks, citizenship checks, qualification verification, company directorship, social media, financial record checks, reference checks) must be conducted prior appointment. Candidates in possession of a foreign qualification must furnish the Department with an evaluation certificate from the South African Qualification Authority (SAQA). Applicants with foreign qualification remain responsible for ensuring that their qualification are evaluated by the South African Qualification Authority (SAQA). The recommended candidate may be subjected to medical surveillance as require by the Occupational Health and Safety Act 5/1993. The Gauteng Department of Health is guided by the principles of Employment Equity. People with disabilities are encouraged to apply.\n\nEmployer : Department of Health\n\nLocation : Charlotte Maxeke Johannesburg Academic Hospital\n\nClosing Date : 09-01-2026\n\n\n\nCriteria Questions\nDo you have Grade 12 or equivalent with more than 10 years in Auditing, Accounting or Risk Management experience or National Diploma or Degree from a recognized SAQA tertiary institution in Auditing, Accounting Risk Management between 0 and 2 years in Auditing, Accounting or Risk Management experience?\n\n\n\nPlease Notes :\n\nDue to the large number of applications we envisage receiving, applications will not be acknowledged. If you do not receive any response within 3 months, please accept that your application was not successful.\n\n\nFind us\nAddress\n75 Fox Street, Mashalltown\nJohannesburg\n2000\n\nCall us\n\nPhone\n080 022 8827\nEmail\nsupport@gauteng.gov.za\n\nQuick Links\nAll Jobs\nAbout Us\n\n\u00a9 Gauteng Provincial Government 2026 . Powered by Department of e-Government"
  },
  {
    "position": "Secretary",
    "location": "Charlotte Maxeke Johannesburg Academic Hospital",
    "package": "R 228 321.00 per annum (plus benefits)",
    "closing_date": "2026/01/09",
    "link": "https://jobs.gauteng.gov.za/Public/ViewJob.aspx?u=Awpj99fb8YXS4HUP1T7+ww==",
    "title": "Secretary",
    "reference_number": "REFS/024367",
    "directorate": "Clinical Support",
    "centre": "Charlotte Maxeke Johannesburg Academic Hospital",
    "package_detail": "R 228 321.00 per annum (plus benefits)",
    "closing_date_detail": "09-01-2026",
    "enquiries": "Ms. N Mzila Tel No - 011 488 3365 Ms L Maseko Tel No - 011 488 3711",
    "requirements": "A Grade 12 or equivalent qualification no experience required. Knowledge- Patient Rights and Batho Pele Principles. Skills- computer literacy, experience in Ms. (Word, Excel and PowerPoint), Typing skills, Good interpersonal skills and telephone etiquette. Ability to function under pressure. Be assertive and presentable. The following will be an added advantage: At least 12 months\u2019 experience as a secretary. Secretarial internship experience in a hospital environment. Secretarial or Administration Diploma or equivalent.",
    "duties": "Responsible for overall administration of the manager\u2019s office. Diary management and co-ordination of office activities. Management of all incoming and outgoing correspondence. Co-ordination and preparation for meetings, workshop and typing of document. Provide reception services including call screening, receiving as well as attending to messages and provide hospitable reception of visitors to the manager\u2019s office. Making travel and accommodation arrangements as well as processing of all substance and travel claims. Handling of confidential documents. Operate standard office equipment (fax, photocopy machine and telephone). Type correspondence such as reports, submissions and letters. Perform administrative tasks such as taking minutes and arranging /serving refreshment and understanding of cost containment.",
    "notes": "Applications should be submitted strictly online at the following E-Recruitment portal: http://jobs.gauteng.gov.za. No hand-delivered, faxed, or emailed applications will be accepted. For assistance with online applications please email your query to healthjobqueries@gauteng.gov.za. NB: Where Driver\u2019s Licence is mandatory, exception will be granted for people with disabilities. Application should be accompanied by a fully completed and signed new Z83 application form obtainable from any Public Service Department or on the internet at www.dpsa.gov.za/documents plus a recently updated comprehensive Curriculum Vitae (CV). Applications without proof of a new Z83 application form and detailed CV will be disqualified. (Shortlisted candidates will receive communication from HR to submit certified copies of educational qualifications and other relevant documents not older than 6 months on or before the day of the interview). It is the applicant\u2019s responsibility to have foreign qualifications evaluated by the South African Qualifications Authority (SAQA). All foreign qualification must be accompanied by evaluation certificate from the South African Qualification Authority (SAQA). Correspondence will only be limited to shortlisted candidates. Suitable candidates will be subjected to a personnel suitability check (criminal record, citizenship, credit record checks, qualification verification and employment verification). Where applicable, candidates will be subjected to a skills/knowledge test. The recommended candidate may be subjected to Medical Surveillance as required by the Occupational Health and Safety Act, Act 5/1993. It is Department\u2019s intention to promote representivity (race, gender, and disability) in the Public Service through the filling of these posts. The Department reserves the right not to appoint/fill this post. WOMEN AND PEOPLE WITH DISABILITY ARE ENCOURAGED TO APPLY.",
    "full_text": "HOME\nJOBS\nABOUT US\nACCOUNT\n\n\n\nJob Details\nDepartment of Health\nSecretary\nReference Number : REFS/024367\nDirectorate : Clinical Support\nNumber of Posts : 2\nPackage : R 228 321.00 per annum (plus benefits)\nEnquiries : Ms. N Mzila Tel No - 011 488 3365 Ms L Maseko Tel No - 011 488 3711\n\nRequirements :\n\nA Grade 12 or equivalent qualification no experience required. Knowledge- Patient Rights and Batho Pele Principles. Skills- computer literacy, experience in Ms. (Word, Excel and PowerPoint), Typing skills, Good interpersonal skills and telephone etiquette. Ability to function under pressure. Be assertive and presentable. The following will be an added advantage: At least 12 months\u2019 experience as a secretary. Secretarial internship experience in a hospital environment. Secretarial or Administration Diploma or equivalent.\n\nDuties :\n\nResponsible for overall administration of the manager\u2019s office. Diary management and co-ordination of office activities. Management of all incoming and outgoing correspondence. Co-ordination and preparation for meetings, workshop and typing of document. Provide reception services including call screening, receiving as well as attending to messages and provide hospitable reception of visitors to the manager\u2019s office. Making travel and accommodation arrangements as well as processing of all substance and travel claims. Handling of confidential documents. Operate standard office equipment (fax, photocopy machine and telephone). Type correspondence such as reports, submissions and letters. Perform administrative tasks such as taking minutes and arranging /serving refreshment and understanding of cost containment.\n\nNotes :\n\nApplications should be submitted strictly online at the following E-Recruitment portal: http://jobs.gauteng.gov.za. No hand-delivered, faxed, or emailed applications will be accepted. For assistance with online applications please email your query to healthjobqueries@gauteng.gov.za. NB: Where Driver\u2019s Licence is mandatory, exception will be granted for people with disabilities. Application should be accompanied by a fully completed and signed new Z83 application form obtainable from any Public Service Department or on the internet at www.dpsa.gov.za/documents plus a recently updated comprehensive Curriculum Vitae (CV). Applications without proof of a new Z83 application form and detailed CV will be disqualified. (Shortlisted candidates will receive communication from HR to submit certified copies of educational qualifications and other relevant documents not older than 6 months on or before the day of the interview). It is the applicant\u2019s responsibility to have foreign qualifications evaluated by the South African Qualifications Authority (SAQA). All foreign qualification must be accompanied by evaluation certificate from the South African Qualification Authority (SAQA). Correspondence will only be limited to shortlisted candidates. Suitable candidates will be subjected to a personnel suitability check (criminal record, citizenship, credit record checks, qualification verification and employment verification). Where applicable, candidates will be subjected to a skills/knowledge test. The recommended candidate may be subjected to Medical Surveillance as required by the Occupational Health and Safety Act, Act 5/1993. It is Department\u2019s intention to promote representivity (race, gender, and disability) in the Public Service through the filling of these posts. The Department reserves the right not to appoint/fill this post. WOMEN AND PEOPLE WITH DISABILITY ARE ENCOURAGED TO APPLY.\n\nEmployer : Department of Health\n\nLocation : Charlotte Maxeke Johannesburg Academic Hospital\n\nClosing Date : 09-01-2026\n\n\n\nCriteria Questions\nDio you have a Grade 12 Certificate?\nAre you computer literate?\n\n\n\nPlease Notes :\n\nDue to the large number of applications we envisage receiving, applications will not be acknowledged. If you do not receive any response within 3 months, please accept that your application was not successful.\n\n\nFind us\nAddress\n75 Fox Street, Mashalltown\nJohannesburg\n2000\n\nCall us\n\nPhone\n080 022 8827\nEmail\nsupport@gauteng.gov.za\n\nQuick Links\nAll Jobs\nAbout Us\n\n\u00a9 Gauteng Provincial Government 2026 . Powered by Department of e-Government"
  },
  {
    "position": "ASSISTANT MANAGER NURSING AREA (PHC SPECIALITY)",
    "location": "Johannesburg Health District",
    "package": "R 755 355,00 per annum (plus benefits)",
    "closing_date": "2026/01/09",
    "link": "https://jobs.gauteng.gov.za/Public/ViewJob.aspx?u=Awpj99fb8YWugNimNJxXaA==",
    "title": "ASSISTANT MANAGER NURSING AREA (PHC SPECIALITY)",
    "reference_number": "REFS/024366",
    "directorate": "NURSING",
    "centre": "Johannesburg Health District",
    "package_detail": "R 755 355,00 per annum (plus benefits)",
    "closing_date_detail": "09-01-2026",
    "enquiries": "Mrs. L Matlala 011 694 3708",
    "requirements": "A Basic R425 qualification (i.e., Diploma/ degree in nursing) or equivalent qualification that allows registration with SANC as professional nurse. A Post basic qualification with a duration of at least 1 year accredited with the SANC in the specialty relevant to PHC setting. A Health Service Management or Nursing Administration qualification with duration of at least 01 year, accredited with SANC. A minimum of 10 years appropriate/recognisable nursing experience after registration as Professional Nurse with the SANC in General Nursing. At least 6 years of the period referred to above must be appropriate/ recognizable experience in the PHC setting after obtaining the 1 year post basic qualification in the relevant specialty. At least 3 years of the period referred to above must be appropriate/ recognizable experience at management level. Other skills/requirement: Knowledge of the application of nursing act, Public Service Regulations, Basic Condition of Employment Act, Labour Relations Act, Public Finance Management Act, Treasury Regulations, Human resource management; Leadership, organizational, decision making and problem-solving skills. Understanding the application of Batho Pele Principle. Patient\u2019s Rights Charter and quality assurance system. Ability to communicate (verbally and written). Good people management and presentation skills. interpersonal social mobilisation, networking and repot writing as well as Team building and Policy formulation. Computer literacy and a valid Driver\u2019s license are essential",
    "duties": "To ensure that a comprehensive quality nursing treatment and care service is delivered to patients in a cost effective, efficient, and equitable manner by the facilities. To always ensure compliance to professional and ethical standards. Promote quality of nursing care and ethos as directed by the professional scope of practice and standards as determined by SANC. Facilitate provision of a comprehensive package of service at PHC level and ensure that the facilities adhere to the principles of Batho Pele. Ensure effective implementation of Service and Quality Improvement Plans, Occupational Health, and Safety as well as Quality Assurance Program etc. Ensure compliance with ideal clinic, clinical guidelines and protocols, norms and standards within the facilities. Adhere to Office of the Health Standard Compliance and ensure effective achievement on Ministerial Priorities, Ideal Clinic Compliance and support PHC re-engineering program implementation. Ensure management and control of human, financial and material resources. Monitor utilization of budget to ensure that the clinic functions within the allocated budget. Supervise and monitor staff performance in accordance with Performance Management and Development System (PMDS); develop and implement staff training plan. Attend to grievances of staff and administer discipline; and ensure that absenteeism and abscondment of staff is effectively controlled. Ensure submission of day, weekly, monthly, quarterly and annual reports. General administration duties and management soft skills is mandatory.",
    "notes": "Applications should be submitted strictly online at the following E-Recruitment portal: http://jobs.gauteng.gov.za. No hand-delivered, faxed, or emailed applications will be accepted. For assistance with online applications please email your query to healthjobqueries@gauteng.gov.za . NB: Where Driver\u2019s Licence is mandatory, exception will be granted for people with disabilities. Application should be accompanied by a fully completed and signed new Z83 application form obtainable from any Public Service Department or on the internet at www.dpsa.gov.za/documents plus a recently updated comprehensive Curriculum Vitae (CV), Registration Certificate with relevant professional body (SANC) and a proof of current registration (Annual Practicing Certificate/Card). Applications without proof of a new Z83 application form, a detailed CV, registration certificate and a proof of current registration card/certificate with relevant professional body will be disqualified. (Shortlisted candidates will receive communication from HR to submit certified copies of educational qualifications and other relevant documents not older than 6 months on or before the day of the interview). It is the applicant\u2019s responsibility to have foreign qualifications evaluated by the South African Qualifications Authority (SAQA). All foreign qualification must be accompanied by evaluation certificate from the South African Qualification Authority (SAQA). Correspondence will only be limited to shortlisted candidates. If you have not been contacted within 3 months of the closing date of this advertisement, please accept that your application was unsuccessful. Suitable candidates will be subjected to a personnel suitability check (criminal record, citizenship, credit record checks, qualification verification and employment verification). Where applicable, candidates will be subjected to a skills/knowledge test. The recommended candidate may be subjected to Medical Surveillance as required by the Occupational Health and Safety Act, Act 5/1993. It is Department\u2019s intention to promote representivity (race, gender, and disability) in the Public Service through the filling of these posts. The Department reserves the right not to appoint/fill this post. WOMEN AND PEOPLE WITH DISABILITY ARE ENCOURAGED TO APPLY.",
    "full_text": "HOME\nJOBS\nABOUT US\nACCOUNT\n\n\n\nJob Details\nDepartment of Health\nASSISTANT MANAGER NURSING AREA (PHC SPECIALITY)\nReference Number : REFS/024366\nDirectorate : NURSING\nNumber of Posts : 1\nPackage : R 755 355,00 per annum (plus benefits)\nEnquiries : Mrs. L Matlala 011 694 3708\n\nRequirements :\n\nA Basic R425 qualification (i.e., Diploma/ degree in nursing) or equivalent qualification that allows registration with SANC as professional nurse. A Post basic qualification with a duration of at least 1 year accredited with the SANC in the specialty relevant to PHC setting. A Health Service Management or Nursing Administration qualification with duration of at least 01 year, accredited with SANC. A minimum of 10 years appropriate/recognisable nursing experience after registration as Professional Nurse with the SANC in General Nursing. At least 6 years of the period referred to above must be appropriate/ recognizable experience in the PHC setting after obtaining the 1 year post basic qualification in the relevant specialty. At least 3 years of the period referred to above must be appropriate/ recognizable experience at management level. Other skills/requirement: Knowledge of the application of nursing act, Public Service Regulations, Basic Condition of Employment Act, Labour Relations Act, Public Finance Management Act, Treasury Regulations, Human resource management; Leadership, organizational, decision making and problem-solving skills. Understanding the application of Batho Pele Principle. Patient\u2019s Rights Charter and quality assurance system. Ability to communicate (verbally and written). Good people management and presentation skills. interpersonal social mobilisation, networking and repot writing as well as Team building and Policy formulation. Computer literacy and a valid Driver\u2019s license are essential\n\nDuties :\n\nTo ensure that a comprehensive quality nursing treatment and care service is delivered to patients in a cost effective, efficient, and equitable manner by the facilities. To always ensure compliance to professional and ethical standards. Promote quality of nursing care and ethos as directed by the professional scope of practice and standards as determined by SANC. Facilitate provision of a comprehensive package of service at PHC level and ensure that the facilities adhere to the principles of Batho Pele. Ensure effective implementation of Service and Quality Improvement Plans, Occupational Health, and Safety as well as Quality Assurance Program etc. Ensure compliance with ideal clinic, clinical guidelines and protocols, norms and standards within the facilities. Adhere to Office of the Health Standard Compliance and ensure effective achievement on Ministerial Priorities, Ideal Clinic Compliance and support PHC re-engineering program implementation. Ensure management and control of human, financial and material resources. Monitor utilization of budget to ensure that the clinic functions within the allocated budget. Supervise and monitor staff performance in accordance with Performance Management and Development System (PMDS); develop and implement staff training plan. Attend to grievances of staff and administer discipline; and ensure that absenteeism and abscondment of staff is effectively controlled. Ensure submission of day, weekly, monthly, quarterly and annual reports. General administration duties and management soft skills is mandatory.\n\nNotes :\n\nApplications should be submitted strictly online at the following E-Recruitment portal: http://jobs.gauteng.gov.za. No hand-delivered, faxed, or emailed applications will be accepted. For assistance with online applications please email your query to healthjobqueries@gauteng.gov.za . NB: Where Driver\u2019s Licence is mandatory, exception will be granted for people with disabilities. Application should be accompanied by a fully completed and signed new Z83 application form obtainable from any Public Service Department or on the internet at www.dpsa.gov.za/documents plus a recently updated comprehensive Curriculum Vitae (CV), Registration Certificate with relevant professional body (SANC) and a proof of current registration (Annual Practicing Certificate/Card). Applications without proof of a new Z83 application form, a detailed CV, registration certificate and a proof of current registration card/certificate with relevant professional body will be disqualified. (Shortlisted candidates will receive communication from HR to submit certified copies of educational qualifications and other relevant documents not older than 6 months on or before the day of the interview). It is the applicant\u2019s responsibility to have foreign qualifications evaluated by the South African Qualifications Authority (SAQA). All foreign qualification must be accompanied by evaluation certificate from the South African Qualification Authority (SAQA). Correspondence will only be limited to shortlisted candidates. If you have not been contacted within 3 months of the closing date of this advertisement, please accept that your application was unsuccessful. Suitable candidates will be subjected to a personnel suitability check (criminal record, citizenship, credit record checks, qualification verification and employment verification). Where applicable, candidates will be subjected to a skills/knowledge test. The recommended candidate may be subjected to Medical Surveillance as required by the Occupational Health and Safety Act, Act 5/1993. It is Department\u2019s intention to promote representivity (race, gender, and disability) in the Public Service through the filling of these posts. The Department reserves the right not to appoint/fill this post. WOMEN AND PEOPLE WITH DISABILITY ARE ENCOURAGED TO APPLY.\n\nEmployer : Department of Health\n\nLocation : Johannesburg Health District\n\nClosing Date : 09-01-2026\n\n\n\nCriteria Questions\nDo you have A Basic R425 qualification (i.e., Diploma/ degree in nursing) or equivalent qualification that allows registration with SANC as professional nurse?\nDo you have A Post basic qualification with a duration of at least 1 year accredited with the SANC in the specialty relevant to PHC setting?\n\n\n\nPlease Notes :\n\nDue to the large number of applications we envisage receiving, applications will not be acknowledged. If you do not receive any response within 3 months, please accept that your application was not successful.\n\n\nFind us\nAddress\n75 Fox Street, Mashalltown\nJohannesburg\n2000\n\nCall us\n\nPhone\n080 022 8827\nEmail\nsupport@gauteng.gov.za\n\nQuick Links\nAll Jobs\nAbout Us\n\n\u00a9 Gauteng Provincial Government 2026 . Powered by Department of e-Government"
  },
  {
    "position": "ASSISTANT MANAGER NURSING (PHC SPECIALITY)",
    "location": "Johannesburg Health District",
    "package": "R 755 355,00 per annum (plus benefits)",
    "closing_date": "2026/01/09",
    "link": "https://jobs.gauteng.gov.za/Public/ViewJob.aspx?u=Awpj99fb8YWjOGHEhoNlVQ==",
    "title": "ASSISTANT MANAGER NURSING (PHC SPECIALITY)",
    "reference_number": "REFS/024365",
    "directorate": "NURSING",
    "centre": "Johannesburg Health District",
    "package_detail": "R 755 355,00 per annum (plus benefits)",
    "closing_date_detail": "09-01-2026",
    "enquiries": "Mrs. L Matlala 011 694 3708",
    "requirements": "A Basic R425 qualification (i.e., Diploma/ degree in nursing) or equivalent qualification that allows registration with SANC as professional nurse. A Post basic qualification with a duration of at least 1 year accredited with the SANC in the specialty relevant to PHC setting. A Health Service Management or Nursing Administration qualification with duration of at least 01 year, accredited with SANC. A minimum of 10 years appropriate/recognisable nursing experience after registration as Professional Nurse with the SANC in General Nursing. At least 6 years of the period referred to above must be appropriate/ recognizable experience in the PHC setting after obtaining the 1 year post basic qualification in the relevant specialty. At least 3 years of the period referred to above must be appropriate/ recognizable experience at management level. Other skills/requirement: Knowledge of the application of nursing act, Public Service Regulations, Basic Condition of Employment Act, Labour Relations Act, Public Finance Management Act, Treasury Regulations, Human resource management; Leadership, organizational, decision making and problem-solving skills. Understanding the application of Batho Pele Principle. Patient\u2019s Rights Charter and quality assurance system. Ability to communicate (verbally and written). Good people management and presentation skills. interpersonal social mobilisation, networking and repot writing as well as Team building and Policy formulation. Computer literacy and a valid Driver\u2019s license are essential.",
    "duties": "To ensure that a comprehensive quality nursing treatment and care service is delivered to patients in a cost effective, efficient, and equitable manner by the facilities. To always ensure compliance to professional and ethical standards. Promote quality of nursing care and ethos as directed by the professional scope of practice and standards as determined by SANC. Facilitate provision of a comprehensive package of service at PHC level and ensure that the facilities adhere to the principles of Batho Pele. Ensure effective implementation of Service and Quality Improvement Plans, Occupational Health, and Safety as well as Quality Assurance Program etc. Ensure compliance with ideal clinic, clinical guidelines and protocols, norms and standards within the facilities. Adhere to Office of the Health Standard Compliance and ensure effective achievement on Ministerial Priorities, Ideal Clinic Compliance and support PHC re-engineering program implementation. Ensure management and control of human, financial and material resources. Monitor utilization of budget to ensure that the clinic functions within the allocated budget. Supervise and monitor staff performance in accordance with Performance Management and Development System (PMDS); develop and implement staff training plan. Attend to grievances of staff and administer discipline; and ensure that absenteeism and abscondment of staff is effectively controlled. Ensure submission of day, weekly, monthly, quarterly and annual reports. General administration duties and management soft skills is mandatory.",
    "notes": "Applications should be submitted strictly online at the following E-Recruitment portal: http://jobs.gauteng.gov.za. No hand-delivered, faxed, or emailed applications will be accepted. For assistance with online applications please email your query to healthjobqueries@gauteng.gov.za . NB: Where Driver\u2019s Licence is mandatory, exception will be granted for people with disabilities. Application should be accompanied by a fully completed and signed new Z83 application form obtainable from any Public Service Department or on the internet at www.dpsa.gov.za/documents plus a recently updated comprehensive Curriculum Vitae (CV), Registration Certificate with relevant professional body (SANC) and a proof of current registration (Annual Practicing Certificate/Card). Applications without proof of a new Z83 application form, a detailed CV, registration certificate and a proof of current registration card/certificate with relevant professional body will be disqualified. (Shortlisted candidates will receive communication from HR to submit certified copies of educational qualifications and other relevant documents not older than 6 months on or before the day of the interview). It is the applicant\u2019s responsibility to have foreign qualifications evaluated by the South African Qualifications Authority (SAQA). All foreign qualification must be accompanied by evaluation certificate from the South African Qualification Authority (SAQA). Correspondence will only be limited to shortlisted candidates. If you have not been contacted within 3 months of the closing date of this advertisement, please accept that your application was unsuccessful. Suitable candidates will be subjected to a personnel suitability check (criminal record, citizenship, credit record checks, qualification verification and employment verification). Where applicable, candidates will be subjected to a skills/knowledge test. The recommended candidate may be subjected to Medical Surveillance as required by the Occupational Health and Safety Act, Act 5/1993. It is Department\u2019s intention to promote representivity (race, gender, and disability) in the Public Service through the filling of these posts. The Department reserves the right not to appoint/fill this post. WOMEN AND PEOPLE WITH DISABILITY ARE ENCOURAGED TO APPLY.",
    "full_text": "HOME\nJOBS\nABOUT US\nACCOUNT\n\n\n\nJob Details\nDepartment of Health\nASSISTANT MANAGER NURSING (PHC SPECIALITY)\nReference Number : REFS/024365\nDirectorate : NURSING\nNumber of Posts : 2\nPackage : R 755 355,00 per annum (plus benefits)\nEnquiries : Mrs. L Matlala 011 694 3708\n\nRequirements :\n\nA Basic R425 qualification (i.e., Diploma/ degree in nursing) or equivalent qualification that allows registration with SANC as professional nurse. A Post basic qualification with a duration of at least 1 year accredited with the SANC in the specialty relevant to PHC setting. A Health Service Management or Nursing Administration qualification with duration of at least 01 year, accredited with SANC. A minimum of 10 years appropriate/recognisable nursing experience after registration as Professional Nurse with the SANC in General Nursing. At least 6 years of the period referred to above must be appropriate/ recognizable experience in the PHC setting after obtaining the 1 year post basic qualification in the relevant specialty. At least 3 years of the period referred to above must be appropriate/ recognizable experience at management level. Other skills/requirement: Knowledge of the application of nursing act, Public Service Regulations, Basic Condition of Employment Act, Labour Relations Act, Public Finance Management Act, Treasury Regulations, Human resource management; Leadership, organizational, decision making and problem-solving skills. Understanding the application of Batho Pele Principle. Patient\u2019s Rights Charter and quality assurance system. Ability to communicate (verbally and written). Good people management and presentation skills. interpersonal social mobilisation, networking and repot writing as well as Team building and Policy formulation. Computer literacy and a valid Driver\u2019s license are essential.\n\nDuties :\n\nTo ensure that a comprehensive quality nursing treatment and care service is delivered to patients in a cost effective, efficient, and equitable manner by the facilities. To always ensure compliance to professional and ethical standards. Promote quality of nursing care and ethos as directed by the professional scope of practice and standards as determined by SANC. Facilitate provision of a comprehensive package of service at PHC level and ensure that the facilities adhere to the principles of Batho Pele. Ensure effective implementation of Service and Quality Improvement Plans, Occupational Health, and Safety as well as Quality Assurance Program etc. Ensure compliance with ideal clinic, clinical guidelines and protocols, norms and standards within the facilities. Adhere to Office of the Health Standard Compliance and ensure effective achievement on Ministerial Priorities, Ideal Clinic Compliance and support PHC re-engineering program implementation. Ensure management and control of human, financial and material resources. Monitor utilization of budget to ensure that the clinic functions within the allocated budget. Supervise and monitor staff performance in accordance with Performance Management and Development System (PMDS); develop and implement staff training plan. Attend to grievances of staff and administer discipline; and ensure that absenteeism and abscondment of staff is effectively controlled. Ensure submission of day, weekly, monthly, quarterly and annual reports. General administration duties and management soft skills is mandatory.\n\nNotes :\n\nApplications should be submitted strictly online at the following E-Recruitment portal: http://jobs.gauteng.gov.za. No hand-delivered, faxed, or emailed applications will be accepted. For assistance with online applications please email your query to healthjobqueries@gauteng.gov.za . NB: Where Driver\u2019s Licence is mandatory, exception will be granted for people with disabilities. Application should be accompanied by a fully completed and signed new Z83 application form obtainable from any Public Service Department or on the internet at www.dpsa.gov.za/documents plus a recently updated comprehensive Curriculum Vitae (CV), Registration Certificate with relevant professional body (SANC) and a proof of current registration (Annual Practicing Certificate/Card). Applications without proof of a new Z83 application form, a detailed CV, registration certificate and a proof of current registration card/certificate with relevant professional body will be disqualified. (Shortlisted candidates will receive communication from HR to submit certified copies of educational qualifications and other relevant documents not older than 6 months on or before the day of the interview). It is the applicant\u2019s responsibility to have foreign qualifications evaluated by the South African Qualifications Authority (SAQA). All foreign qualification must be accompanied by evaluation certificate from the South African Qualification Authority (SAQA). Correspondence will only be limited to shortlisted candidates. If you have not been contacted within 3 months of the closing date of this advertisement, please accept that your application was unsuccessful. Suitable candidates will be subjected to a personnel suitability check (criminal record, citizenship, credit record checks, qualification verification and employment verification). Where applicable, candidates will be subjected to a skills/knowledge test. The recommended candidate may be subjected to Medical Surveillance as required by the Occupational Health and Safety Act, Act 5/1993. It is Department\u2019s intention to promote representivity (race, gender, and disability) in the Public Service through the filling of these posts. The Department reserves the right not to appoint/fill this post. WOMEN AND PEOPLE WITH DISABILITY ARE ENCOURAGED TO APPLY.\n\nEmployer : Department of Health\n\nLocation : Johannesburg Health District\n\nClosing Date : 09-01-2026\n\n\n\nCriteria Questions\nDo you have A Basic R425 qualification (i.e., Diploma/ degree in nursing) or equivalent qualification that allows registration with SANC as professional nurse?\nDo you have A Post basic qualification with a duration of at least 1 year accredited with the SANC in the specialty relevant to PHC setting?\n\n\n\nPlease Notes :\n\nDue to the large number of applications we envisage receiving, applications will not be acknowledged. If you do not receive any response within 3 months, please accept that your application was not successful.\n\n\nFind us\nAddress\n75 Fox Street, Mashalltown\nJohannesburg\n2000\n\nCall us\n\nPhone\n080 022 8827\nEmail\nsupport@gauteng.gov.za\n\nQuick Links\nAll Jobs\nAbout Us\n\n\u00a9 Gauteng Provincial Government 2026 . Powered by Department of e-Government"
  },
  {
    "position": "MEDICAL REGISTRAR",
    "location": "Johannesburg Health District",
    "package": "R1 001 349.00 PER ANNUM (ALL-INCLUSIVE PACKAGE)",
    "closing_date": "2026/01/09",
    "link": "https://jobs.gauteng.gov.za/Public/ViewJob.aspx?u=Awpj99fb8YV95mS07SJZJw==",
    "title": "MEDICAL REGISTRAR",
    "reference_number": "REFS/024364",
    "directorate": "Public Health Unit",
    "centre": "Johannesburg Health District",
    "package_detail": "R1 001 349.00 PER ANNUM (ALL-INCLUSIVE PACKAGE)",
    "closing_date_detail": "09-01-2026",
    "enquiries": "Ms M Mogorosi Tel No- 011 694 3823 / Prof M Kawonga -Tel No 011 717257",
    "requirements": "An appropriate qualification that allows for registration with HPCSA as a Medical Practitioner. Registration with the HPCSA as Medical Practitioner and current registration. The following will be added advantages: At least two years of relevant work experience after registration with the HPCSA as an independent Medical Practitioner post-community service, and a relevant post-graduate master\u2019s qualification.",
    "duties": "The Registrar post is a training post. The registrar training programme runs over four years. The training includes working, as part of experiential learning, at rotation sites that include the Johannesburg health district, national health institutes and other service delivery sites within, and affiliated to, the Gauteng Department of Health. It also includes further training withing the Department of Community Health, School of Public Health, University of the Witwatersrand, to facilitate completion of a Master of Medicine (MMed) in Public Health Medicine as well as other requirements directed by the Colleges of Medicine of South Africa, to become a Fellow (Specialist) of the College of Public Health Medicine (CPHM) upon successful completion of FCPHM exams. The successful candidate will be expected to participate in the Department's academic program and any related teaching and research activities. There are opportunities to perform overtime work in another area within the Gauteng Department of Health.",
    "notes": "Applications should be submitted strictly online at the following E-Recruitment portal: http://jobs.gauteng.gov.za. No hand-delivered, faxed, or emailed applications will be accepted. For assistance with online applications please email your query to healthjobqueries@gauteng.gov.za . NB: Where Driver\u2019s Licence is mandatory, exception will be granted for people with disabilities. Application should be accompanied by a fully completed and signed new Z83 application form obtainable from any Public Service Department or on the internet at www.dpsa.gov.za/documents plus a recently updated comprehensive Curriculum Vitae (CV), Registration Certificate with relevant professional body (HPCSA) and a proof of current registration (Annual Practicing Certificate/Card). Applications without proof of a new Z83 application form, a detailed CV, registration certificate and a proof of current registration card/certificate with relevant professional body will be disqualified. (Shortlisted candidates will receive communication from HR to submit certified copies of educational qualifications and other relevant documents not older than 6 months on or before the day of the interview). It is the applicant\u2019s responsibility to have foreign qualifications evaluated by the South African Qualifications Authority (SAQA). All foreign qualification must be accompanied by evaluation certificate from the South African Qualification Authority (SAQA). Correspondence will only be limited to shortlisted candidates. If you have not been contacted within 3 months of the closing date of this advertisement, please accept that your application was unsuccessful. Suitable candidates will be subjected to a personnel suitability check (criminal record, citizenship, credit record checks, qualification verification and employment verification). Where applicable, candidates will be subjected to a skills/knowledge test. The recommended candidate may be subjected to Medical Surveillance as required by the Occupational Health and Safety Act, Act 5/1993. It is Department\u2019s intention to promote representivity (race, gender, and disability) in the Public Service through the filling of these posts. The Department reserves the right not to appoint/fill this post. WOMEN AND PEOPLE WITH DISABILITY ARE ENCOURAGED TO APPLY.",
    "full_text": "HOME\nJOBS\nABOUT US\nACCOUNT\n\n\n\nJob Details\nDepartment of Health\nMEDICAL REGISTRAR\nReference Number : REFS/024364\nDirectorate : Public Health Unit\nNumber of Posts : 1\nPackage : R1 001 349.00 PER ANNUM (ALL-INCLUSIVE PACKAGE)\nEnquiries : Ms M Mogorosi Tel No- 011 694 3823 / Prof M Kawonga -Tel No 011 717257\n\nRequirements :\n\nAn appropriate qualification that allows for registration with HPCSA as a Medical Practitioner. Registration with the HPCSA as Medical Practitioner and current registration. The following will be added advantages: At least two years of relevant work experience after registration with the HPCSA as an independent Medical Practitioner post-community service, and a relevant post-graduate master\u2019s qualification.\n\nDuties :\n\nThe Registrar post is a training post. The registrar training programme runs over four years. The training includes working, as part of experiential learning, at rotation sites that include the Johannesburg health district, national health institutes and other service delivery sites within, and affiliated to, the Gauteng Department of Health. It also includes further training withing the Department of Community Health, School of Public Health, University of the Witwatersrand, to facilitate completion of a Master of Medicine (MMed) in Public Health Medicine as well as other requirements directed by the Colleges of Medicine of South Africa, to become a Fellow (Specialist) of the College of Public Health Medicine (CPHM) upon successful completion of FCPHM exams. The successful candidate will be expected to participate in the Department's academic program and any related teaching and research activities. There are opportunities to perform overtime work in another area within the Gauteng Department of Health.\n\nNotes :\n\nApplications should be submitted strictly online at the following E-Recruitment portal: http://jobs.gauteng.gov.za. No hand-delivered, faxed, or emailed applications will be accepted. For assistance with online applications please email your query to healthjobqueries@gauteng.gov.za . NB: Where Driver\u2019s Licence is mandatory, exception will be granted for people with disabilities. Application should be accompanied by a fully completed and signed new Z83 application form obtainable from any Public Service Department or on the internet at www.dpsa.gov.za/documents plus a recently updated comprehensive Curriculum Vitae (CV), Registration Certificate with relevant professional body (HPCSA) and a proof of current registration (Annual Practicing Certificate/Card). Applications without proof of a new Z83 application form, a detailed CV, registration certificate and a proof of current registration card/certificate with relevant professional body will be disqualified. (Shortlisted candidates will receive communication from HR to submit certified copies of educational qualifications and other relevant documents not older than 6 months on or before the day of the interview). It is the applicant\u2019s responsibility to have foreign qualifications evaluated by the South African Qualifications Authority (SAQA). All foreign qualification must be accompanied by evaluation certificate from the South African Qualification Authority (SAQA). Correspondence will only be limited to shortlisted candidates. If you have not been contacted within 3 months of the closing date of this advertisement, please accept that your application was unsuccessful. Suitable candidates will be subjected to a personnel suitability check (criminal record, citizenship, credit record checks, qualification verification and employment verification). Where applicable, candidates will be subjected to a skills/knowledge test. The recommended candidate may be subjected to Medical Surveillance as required by the Occupational Health and Safety Act, Act 5/1993. It is Department\u2019s intention to promote representivity (race, gender, and disability) in the Public Service through the filling of these posts. The Department reserves the right not to appoint/fill this post. WOMEN AND PEOPLE WITH DISABILITY ARE ENCOURAGED TO APPLY.\n\nEmployer : Department of Health\n\nLocation : Johannesburg Health District\n\nClosing Date : 09-01-2026\n\n\n\nCriteria Questions\nDo you have an appropriate qualification that allows for registration with HPCSA as a Medical Practitioner.\nDo you have two years of relevant work experience after registration with the HPCSA as an independent Medical Practitioner post-community service, and a relevant post-graduate master\u2019s qualification.\n\n\n\nPlease Notes :\n\nDue to the large number of applications we envisage receiving, applications will not be acknowledged. If you do not receive any response within 3 months, please accept that your application was not successful.\n\n\nFind us\nAddress\n75 Fox Street, Mashalltown\nJohannesburg\n2000\n\nCall us\n\nPhone\n080 022 8827\nEmail\nsupport@gauteng.gov.za\n\nQuick Links\nAll Jobs\nAbout Us\n\n\u00a9 Gauteng Provincial Government 2026 . Powered by Department of e-Government"
  },
  {
    "position": "MEDICAL SPECIALIST RADIOLOGY",
    "location": "Helen Joseph Hospital",
    "package": "R1 341 855,00 per annum, (all-inclusive package)",
    "closing_date": "2026/01/09",
    "link": "https://jobs.gauteng.gov.za/Public/ViewJob.aspx?u=Awpj99fb8YVziEKv/Tfy9Q==",
    "title": "MEDICAL SPECIALIST RADIOLOGY",
    "reference_number": "REFS/024363",
    "directorate": "RADIOLOGY",
    "centre": "Helen Joseph Hospital",
    "package_detail": "R1 341 855,00 per annum, (all-inclusive package)",
    "closing_date_detail": "09-01-2026",
    "enquiries": "Dr M. Modisane - Tel No- (011) 489 1070",
    "requirements": "Appropriate qualification that allows registration with the HPCSA as Medical Specialist in a normal specialty. Registration with the HPCSA as a Medical Specialist in a Radiology and current registration for 2025/2026.",
    "duties": "The incumbent will be responsible to interview, investigate, diagnose and oversee the treatment of patients. Improve quality of care by providing appropriate clinical care supervising of junior medical staff. Willing to do commuted overtime rendering of after-hour (night, weekend and public holiday) duties to provide continuous uninterrupted care of patients. Attendance of relevant administrative meetings like mortality meetings, near miss meetings and completing MEDICO Legal Documents timeously (e.g. Death certificate). Participation in academic program in the hospital and all activities of Radiology department in relation to teaching and research. Ensure proper and accurate record keeping as legally and ethically required. Reporting to the head of unit on service delivery, clinical audits and where necessary quality improvement plans. Assist the HOU to monitor, implement and adhere to the compliance to National Core Standards within their specific outreach programs. Preparing and writing of reports. Assist the Clinical Head with Administration responsibilities.",
    "notes": "Kindly note that No payment of any kind is required when applying for posts advertised by the Gauteng Department of Health. The Department reserves the right not to fill any advertised posts. Applications should be submitted strictly online at the following E-Recruitment portal: https://jobs.gauteng.gov.za.No hand-delivered, faxed, or emailed applications will be accepted. For assistance with online applications please email your query to healthjobqueries@gauteng.gov.za. Application should be accompanied by a fully completed and signed new Z83 form obtainable from any Public Service Department or on the internet at www.dpsa.gov.za/documents.The Z83 form must be fully completed and singed by the applicant. The following must be considered in relation to the completion of the Z83 by applicant. All the fields in Part A, Part C and Part D must be completed. Leave the following question blank if they are not possession of such: \u201dIf your profession or occupation requires official registration, provide date and particulars of registration\u201d. Application without proof of a new Z83 application form and detailed CV will be disqualified. Application must indicate the post reference number on their application. Shortlisted candidates will receive communication from HR Unit to submit certified copies of educational qualifications and other relevant documents not older than 6 months on or before the day of the interview). Personnel Suitability Checks (criminal checks, citizenship checks, qualification verification, company directorship, social media, financial record checks, reference checks) must be conducted prior appointment. Candidates in possession of a foreign qualification must furnish the Department with an evaluation certificate from the South African Qualification Authority (SAQA). Applicants with foreign qualification remain responsible for ensuring that their qualification are evaluated by the South African Qualification Authority (SAQA). The recommended candidate may be subjected to medical surveillance as require by the Occupational Health and Safety Act 5/1993. The Gauteng Department of Health is guided by the principles of Employment Equity. People with disabilities are encouraged to apply.",
    "full_text": "HOME\nJOBS\nABOUT US\nACCOUNT\n\n\n\nJob Details\nDepartment of Health\nMEDICAL SPECIALIST RADIOLOGY\nReference Number : REFS/024363\nDirectorate : RADIOLOGY\nNumber of Posts : 3\nPackage : R1 341 855,00 per annum, (all-inclusive package)\nEnquiries : Dr M. Modisane - Tel No- (011) 489 1070\n\nRequirements :\n\nAppropriate qualification that allows registration with the HPCSA as Medical Specialist in a normal specialty. Registration with the HPCSA as a Medical Specialist in a Radiology and current registration for 2025/2026.\n\nDuties :\n\nThe incumbent will be responsible to interview, investigate, diagnose and oversee the treatment of patients. Improve quality of care by providing appropriate clinical care supervising of junior medical staff. Willing to do commuted overtime rendering of after-hour (night, weekend and public holiday) duties to provide continuous uninterrupted care of patients. Attendance of relevant administrative meetings like mortality meetings, near miss meetings and completing MEDICO Legal Documents timeously (e.g. Death certificate). Participation in academic program in the hospital and all activities of Radiology department in relation to teaching and research. Ensure proper and accurate record keeping as legally and ethically required. Reporting to the head of unit on service delivery, clinical audits and where necessary quality improvement plans. Assist the HOU to monitor, implement and adhere to the compliance to National Core Standards within their specific outreach programs. Preparing and writing of reports. Assist the Clinical Head with Administration responsibilities.\n\nNotes :\n\nKindly note that No payment of any kind is required when applying for posts advertised by the Gauteng Department of Health. The Department reserves the right not to fill any advertised posts. Applications should be submitted strictly online at the following E-Recruitment portal: https://jobs.gauteng.gov.za.No hand-delivered, faxed, or emailed applications will be accepted. For assistance with online applications please email your query to healthjobqueries@gauteng.gov.za. Application should be accompanied by a fully completed and signed new Z83 form obtainable from any Public Service Department or on the internet at www.dpsa.gov.za/documents.The Z83 form must be fully completed and singed by the applicant. The following must be considered in relation to the completion of the Z83 by applicant. All the fields in Part A, Part C and Part D must be completed. Leave the following question blank if they are not possession of such: \u201dIf your profession or occupation requires official registration, provide date and particulars of registration\u201d. Application without proof of a new Z83 application form and detailed CV will be disqualified. Application must indicate the post reference number on their application. Shortlisted candidates will receive communication from HR Unit to submit certified copies of educational qualifications and other relevant documents not older than 6 months on or before the day of the interview). Personnel Suitability Checks (criminal checks, citizenship checks, qualification verification, company directorship, social media, financial record checks, reference checks) must be conducted prior appointment. Candidates in possession of a foreign qualification must furnish the Department with an evaluation certificate from the South African Qualification Authority (SAQA). Applicants with foreign qualification remain responsible for ensuring that their qualification are evaluated by the South African Qualification Authority (SAQA). The recommended candidate may be subjected to medical surveillance as require by the Occupational Health and Safety Act 5/1993. The Gauteng Department of Health is guided by the principles of Employment Equity. People with disabilities are encouraged to apply.\n\nEmployer : Department of Health\n\nLocation : Helen Joseph Hospital\n\nClosing Date : 09-01-2026\n\n\n\nCriteria Questions\nDo you have an appropriate qualification that allows registration with the HPCSA as Medical Specialist in a normal specialty?\nAre you currently registered with the HPCSA as a Medical Specialist in a Radiology?\n\n\n\nPlease Notes :\n\nDue to the large number of applications we envisage receiving, applications will not be acknowledged. If you do not receive any response within 3 months, please accept that your application was not successful.\n\n\nFind us\nAddress\n75 Fox Street, Mashalltown\nJohannesburg\n2000\n\nCall us\n\nPhone\n080 022 8827\nEmail\nsupport@gauteng.gov.za\n\nQuick Links\nAll Jobs\nAbout Us\n\n\u00a9 Gauteng Provincial Government 2026 . Powered by Department of e-Government"
  },
  {
    "position": "MEDICAL OFFICER",
    "location": "Helen Joseph Hospital",
    "package": "R1 001 349.00 per annum (all-inclusive package)",
    "closing_date": "2026/01/09",
    "link": "https://jobs.gauteng.gov.za/Public/ViewJob.aspx?u=Awpj99fb8YX/QCJGpybYkg==",
    "title": "MEDICAL OFFICER",
    "reference_number": "REFS/024361",
    "directorate": "Radiology",
    "centre": "Helen Joseph Hospital",
    "package_detail": "R1 001 349.00 per annum (all-inclusive package)",
    "closing_date_detail": "09-01-2026",
    "enquiries": "Dr N Chaane - Tel No - (011) 489 1011 (Speed dial 52598)",
    "requirements": "MBChB, appropriate qualification that allows registration with the HPCSA as Medical Practitioner, HPCSA registration as an independent medical practitioner and must be post Community Service. Preference will be given to those who have completed Part 1 of the FCRad examination.",
    "duties": "The incumbent will be responsible to interview, investigate, diagnose and oversee the treatment of patient related administrative duties, participating in all activities of the discipline in relation to teaching, participating in departmental audit activates, preparing and writing of reports, liaison and communication services and community liaison. Supervising junior doctors is required (undergraduate students, interns and community service doctors). Performance of commuted overtime may be requested. Attendance of relevant administrative meeting like multi-disciplinary team meetings, near miss meeting and completing MEDICO Legal Documents timeously (e.g. Death certificate) is required. Improve quality of care by providing appropriate clinical care. Reduce medical litigation by exercising good clinical ethos. Implement and monitor adherence to National Core Standards (norms and standards). Participate in multidisciplinary team to the management of patients. Performance of practical procedures relevant to the care of patients. Participation in departmental meetings, journal clubs, case presentations, lectures and ward rounds. Ensure that administration and record keeping is done in the department. Rendering of after-hour (night, weekend and public holiday) duties to provide continuous uninterrupted care of patients. Medical Officers will inter alia be responsible for rendering of clinical services, assessment and treatment of patients. Medical Officers will be rotated through related departments in the hospitals. Medical Officers will also be expected to rotate to Rahima Moosa Mother and Child Hospital.",
    "notes": "Kindly note that No payment of any kind is required when applying for posts advertised by the Gauteng Department of Health. The Department reserves the right not to fill any advertised posts. Applications should be submitted strictly online at the following E-Recruitment portal: https://jobs.gauteng.gov.za.No hand-delivered, faxed, or emailed applications will be accepted .For assistance with online applications please email your query to healthjobqueries@gauteng.gov.za. Application should be accompanied by a fully completed and signed new Z83 form obtainable from any Public Service Department or on the internet at www.dpsa.gov.za/documents.The Z83 form must be fully completed and singed by the applicant. The following must be considered in relation to the completion of the Z83 by applicant. All the fields in Part A, Part C and Part D must be completed. Leave the following question blank if they are not possession of such: \u201dIf your profession or occupation requires official registration, provide date and particulars of registration\u201d. Application without proof of a new Z83 application form and detailed CV will be be disqualified. Application must indicate the post reference number on their application. Shortlisted candidates will receive communication from HR Unit to submit certified copies of educational qualifications and other relevant documents not older than 6 months on or before the day of the interview). Personnel Suitability Checks (criminal checks, citizenship checks, qualification verification, company directorship, social media, financial record checks, reference checks) must be conducted prior appointment. Candidates in possession of a foreign qualification must furnish the Department with an evaluation certificate from the South African Qualification Authority (SAQA). Applicants with foreign qualification remain responsible for ensuring that their qualification are evaluated by the South African Qualification Authority (SAQA). The recommended candidate may be subjected to medical surveillance as require by the Occupational Health and Safety Act 5/1993. The Gauteng Department of Health is guided by the principles of Employment Equity. People with disabilities are encouraged to apply.",
    "full_text": "HOME\nJOBS\nABOUT US\nACCOUNT\n\n\n\nJob Details\nDepartment of Health\nMEDICAL OFFICER\nReference Number : REFS/024361\nDirectorate : Radiology\nNumber of Posts : 1\nPackage : R1 001 349.00 per annum (all-inclusive package)\nEnquiries : Dr N Chaane - Tel No - (011) 489 1011 (Speed dial 52598)\n\nRequirements :\n\nMBChB, appropriate qualification that allows registration with the HPCSA as Medical Practitioner, HPCSA registration as an independent medical practitioner and must be post Community Service. Preference will be given to those who have completed Part 1 of the FCRad examination.\n\nDuties :\n\nThe incumbent will be responsible to interview, investigate, diagnose and oversee the treatment of patient related administrative duties, participating in all activities of the discipline in relation to teaching, participating in departmental audit activates, preparing and writing of reports, liaison and communication services and community liaison. Supervising junior doctors is required (undergraduate students, interns and community service doctors). Performance of commuted overtime may be requested. Attendance of relevant administrative meeting like multi-disciplinary team meetings, near miss meeting and completing MEDICO Legal Documents timeously (e.g. Death certificate) is required. Improve quality of care by providing appropriate clinical care. Reduce medical litigation by exercising good clinical ethos. Implement and monitor adherence to National Core Standards (norms and standards). Participate in multidisciplinary team to the management of patients. Performance of practical procedures relevant to the care of patients. Participation in departmental meetings, journal clubs, case presentations, lectures and ward rounds. Ensure that administration and record keeping is done in the department. Rendering of after-hour (night, weekend and public holiday) duties to provide continuous uninterrupted care of patients. Medical Officers will inter alia be responsible for rendering of clinical services, assessment and treatment of patients. Medical Officers will be rotated through related departments in the hospitals. Medical Officers will also be expected to rotate to Rahima Moosa Mother and Child Hospital.\n\nNotes :\n\nKindly note that No payment of any kind is required when applying for posts advertised by the Gauteng Department of Health. The Department reserves the right not to fill any advertised posts. Applications should be submitted strictly online at the following E-Recruitment portal: https://jobs.gauteng.gov.za.No hand-delivered, faxed, or emailed applications will be accepted .For assistance with online applications please email your query to healthjobqueries@gauteng.gov.za. Application should be accompanied by a fully completed and signed new Z83 form obtainable from any Public Service Department or on the internet at www.dpsa.gov.za/documents.The Z83 form must be fully completed and singed by the applicant. The following must be considered in relation to the completion of the Z83 by applicant. All the fields in Part A, Part C and Part D must be completed. Leave the following question blank if they are not possession of such: \u201dIf your profession or occupation requires official registration, provide date and particulars of registration\u201d. Application without proof of a new Z83 application form and detailed CV will be be disqualified. Application must indicate the post reference number on their application. Shortlisted candidates will receive communication from HR Unit to submit certified copies of educational qualifications and other relevant documents not older than 6 months on or before the day of the interview). Personnel Suitability Checks (criminal checks, citizenship checks, qualification verification, company directorship, social media, financial record checks, reference checks) must be conducted prior appointment. Candidates in possession of a foreign qualification must furnish the Department with an evaluation certificate from the South African Qualification Authority (SAQA). Applicants with foreign qualification remain responsible for ensuring that their qualification are evaluated by the South African Qualification Authority (SAQA). The recommended candidate may be subjected to medical surveillance as require by the Occupational Health and Safety Act 5/1993. The Gauteng Department of Health is guided by the principles of Employment Equity. People with disabilities are encouraged to apply.\n\nEmployer : Department of Health\n\nLocation : Helen Joseph Hospital\n\nClosing Date : 09-01-2026\n\n\n\nCriteria Questions\nDo you have a MBChB, appropriate qualification that allows registration with the HPCSA as Medical Practitioner?\nAre you currently registered with HPCSA as an independent Medical Practitioner?\n\n\n\nPlease Notes :\n\nDue to the large number of applications we envisage receiving, applications will not be acknowledged. If you do not receive any response within 3 months, please accept that your application was not successful.\n\n\nFind us\nAddress\n75 Fox Street, Mashalltown\nJohannesburg\n2000\n\nCall us\n\nPhone\n080 022 8827\nEmail\nsupport@gauteng.gov.za\n\nQuick Links\nAll Jobs\nAbout Us\n\n\u00a9 Gauteng Provincial Government 2026 . Powered by Department of e-Government"
  },
  {
    "position": "OPERATIONAL MANAGER NURSING (PHC SPECIALITY)",
    "location": "Johannesburg Health District Services",
    "package": "R 693 096,00 Per annum (plus benefits)",
    "closing_date": "2026/01/09",
    "link": "https://jobs.gauteng.gov.za/Public/ViewJob.aspx?u=Awpj99fb8YU1junbJU3cuQ==",
    "title": "OPERATIONAL MANAGER NURSING (PHC SPECIALITY)",
    "reference_number": "REFS/024360",
    "directorate": "NURSING",
    "centre": "Johannesburg Health District Services",
    "package_detail": "R 693 096,00 Per annum (plus benefits)",
    "closing_date_detail": "09-01-2026",
    "enquiries": "Mrs. L Matlala 011 694 3708",
    "requirements": "A Basic R425 qualification (i.e. diploma/ degree in nursing) or equivalent qualification that allows registration with the South African Nursing Council (SANC) as Professional Nurse. Registration with the SANC as Professional Nurse. A post-basic nursing qualification with duration of at least 01 year, accredited with SANC in the specialty relevant to PHC setting. A Health Service Management or Nursing Administration qualification with duration of at least 01 year, accredited with SANC. A minimum of 09 years appropriate/ recognizable experience in nursing after registration as Professional Nurse with the SANC in General Nursing. At least 5 years of the period referred to above must be appropriate/ recognizable experience in the PHC setting after obtaining the 1 year post basic qualification in the relevant specialty. 2 years\u2019 experience at management / supervisory level will be an added advantage. Other skills/requirement: Financial management and human resource management; leadership, decision making and problem-solving skills; Sound knowledge of public service policies, Code of Conduct, Team building and Policy formulation. Computer literacy and a valid driver\u2019s license are essential.",
    "duties": "To ensure that a comprehensive nursing treatment and care service is delivered to patients in a cost effective, efficient and equitable manner by the facility. To ensure compliance to professional and ethical standards at all times. Promote quality of nursing care as directed by the professional scope of practice and standards as determined by relevant health facility. Facilitate provision of a comprehensive package of service at PHC level and ensure that the unit adheres to the principles of Batho Pele. Ensure effective implementation of Service and Quality Improvement Plans, Occupational Health and Safety as well as Quality Assurance Program etc. Ensure compliance with clinical protocols, norms and standards within the clinic. Adhere to the Office of the Health Standards Compliance requirements and ensure effective achievement on ministerial priorities, Ideal clinic 127 compliance and support PHC re-engineering program implementation. Ensure management and control of human, financial and material resources. Monitor utilization of budget to ensure that the clinic functions within the allocated budget. Supervise and monitor staff performance in accordance with Performance Management and Development System (PMDS), develop and implement staff training plan. Attend to grievances of staff and administer discipline and ensure that absenteeism and abscondment of staff is effectively controlled. Ensure submission of daily, weekly, monthly, quarterly and annual reports. General administration duties and management soft skills is mandatory",
    "notes": "Applications should be submitted strictly online at the following E-Recruitment portal: http://jobs.gauteng.gov.za. No hand-delivered, faxed, or emailed applications will be accepted. For assistance with online applications please email your query to healthjobqueries@gauteng.gov.za . NB: Where Driver\u2019s Licence is mandatory, exception will be granted for people with disabilities. Application should be accompanied by a fully completed and signed new Z83 application form obtainable from any Public Service Department or on the internet at www.dpsa.gov.za/documents plus a recently updated comprehensive Curriculum Vitae (CV), Registration Certificate with relevant professional body (SANC) and a proof of current registration (Annual Practicing Certificate/Card). Applications without proof of a new Z83 application form, a detailed CV, registration certificate and a proof of current registration card/certificate with relevant professional body will be disqualified. (Shortlisted candidates will receive communication from HR to submit certified copies of educational qualifications and other relevant documents not older than 6 months on or before the day of the interview). It is the applicant\u2019s responsibility to have foreign qualifications evaluated by the South African Qualifications Authority (SAQA). All foreign qualification must be accompanied by evaluation certificate from the South African Qualification Authority (SAQA). Correspondence will only be limited to shortlisted candidates. If you have not been contacted within 3 months of the closing date of this advertisement, please accept that your application was unsuccessful. Suitable candidates will be subjected to a personnel suitability check (criminal record, citizenship, credit record checks, qualification verification and employment verification). Where applicable, candidates will be subjected to a skills/knowledge test. The recommended candidate may be subjected to Medical Surveillance as required by the Occupational Health and Safety Act, Act 5/1993. It is Department\u2019s intention to promote representivity (race, gender, and disability) in the Public Service through the filling of these posts. The Department reserves the right not to appoint/fill this post. WOMEN AND PEOPLE WITH DISABILITY ARE ENCOURAGED TO APPLY.",
    "full_text": "HOME\nJOBS\nABOUT US\nACCOUNT\n\n\n\nJob Details\nDepartment of Health\nOPERATIONAL MANAGER NURSING (PHC SPECIALITY)\nReference Number : REFS/024360\nDirectorate : NURSING\nNumber of Posts : 4\nPackage : R 693 096,00 Per annum (plus benefits)\nEnquiries : Mrs. L Matlala 011 694 3708\n\nRequirements :\n\nA Basic R425 qualification (i.e. diploma/ degree in nursing) or equivalent qualification that allows registration with the South African Nursing Council (SANC) as Professional Nurse. Registration with the SANC as Professional Nurse. A post-basic nursing qualification with duration of at least 01 year, accredited with SANC in the specialty relevant to PHC setting. A Health Service Management or Nursing Administration qualification with duration of at least 01 year, accredited with SANC. A minimum of 09 years appropriate/ recognizable experience in nursing after registration as Professional Nurse with the SANC in General Nursing. At least 5 years of the period referred to above must be appropriate/ recognizable experience in the PHC setting after obtaining the 1 year post basic qualification in the relevant specialty. 2 years\u2019 experience at management / supervisory level will be an added advantage. Other skills/requirement: Financial management and human resource management; leadership, decision making and problem-solving skills; Sound knowledge of public service policies, Code of Conduct, Team building and Policy formulation. Computer literacy and a valid driver\u2019s license are essential.\n\nDuties :\n\nTo ensure that a comprehensive nursing treatment and care service is delivered to patients in a cost effective, efficient and equitable manner by the facility. To ensure compliance to professional and ethical standards at all times. Promote quality of nursing care as directed by the professional scope of practice and standards as determined by relevant health facility. Facilitate provision of a comprehensive package of service at PHC level and ensure that the unit adheres to the principles of Batho Pele. Ensure effective implementation of Service and Quality Improvement Plans, Occupational Health and Safety as well as Quality Assurance Program etc. Ensure compliance with clinical protocols, norms and standards within the clinic. Adhere to the Office of the Health Standards Compliance requirements and ensure effective achievement on ministerial priorities, Ideal clinic 127 compliance and support PHC re-engineering program implementation. Ensure management and control of human, financial and material resources. Monitor utilization of budget to ensure that the clinic functions within the allocated budget. Supervise and monitor staff performance in accordance with Performance Management and Development System (PMDS), develop and implement staff training plan. Attend to grievances of staff and administer discipline and ensure that absenteeism and abscondment of staff is effectively controlled. Ensure submission of daily, weekly, monthly, quarterly and annual reports. General administration duties and management soft skills is mandatory\n\nNotes :\n\nApplications should be submitted strictly online at the following E-Recruitment portal: http://jobs.gauteng.gov.za. No hand-delivered, faxed, or emailed applications will be accepted. For assistance with online applications please email your query to healthjobqueries@gauteng.gov.za . NB: Where Driver\u2019s Licence is mandatory, exception will be granted for people with disabilities. Application should be accompanied by a fully completed and signed new Z83 application form obtainable from any Public Service Department or on the internet at www.dpsa.gov.za/documents plus a recently updated comprehensive Curriculum Vitae (CV), Registration Certificate with relevant professional body (SANC) and a proof of current registration (Annual Practicing Certificate/Card). Applications without proof of a new Z83 application form, a detailed CV, registration certificate and a proof of current registration card/certificate with relevant professional body will be disqualified. (Shortlisted candidates will receive communication from HR to submit certified copies of educational qualifications and other relevant documents not older than 6 months on or before the day of the interview). It is the applicant\u2019s responsibility to have foreign qualifications evaluated by the South African Qualifications Authority (SAQA). All foreign qualification must be accompanied by evaluation certificate from the South African Qualification Authority (SAQA). Correspondence will only be limited to shortlisted candidates. If you have not been contacted within 3 months of the closing date of this advertisement, please accept that your application was unsuccessful. Suitable candidates will be subjected to a personnel suitability check (criminal record, citizenship, credit record checks, qualification verification and employment verification). Where applicable, candidates will be subjected to a skills/knowledge test. The recommended candidate may be subjected to Medical Surveillance as required by the Occupational Health and Safety Act, Act 5/1993. It is Department\u2019s intention to promote representivity (race, gender, and disability) in the Public Service through the filling of these posts. The Department reserves the right not to appoint/fill this post. WOMEN AND PEOPLE WITH DISABILITY ARE ENCOURAGED TO APPLY.\n\nEmployer : Department of Health\n\nLocation : Johannesburg Health District Services\n\nClosing Date : 09-01-2026\n\n\n\nCriteria Questions\nDo you have A Basic R425 qualification (i.e. diploma/ degree in nursing) or equivalent qualification that allows registration with the South African Nursing Council (SANC) as Professional Nurse?\nAre you currently registeredwith the SANC as Professional Nurse?\n\n\n\nPlease Notes :\n\nDue to the large number of applications we envisage receiving, applications will not be acknowledged. If you do not receive any response within 3 months, please accept that your application was not successful.\n\n\nFind us\nAddress\n75 Fox Street, Mashalltown\nJohannesburg\n2000\n\nCall us\n\nPhone\n080 022 8827\nEmail\nsupport@gauteng.gov.za\n\nQuick Links\nAll Jobs\nAbout Us\n\n\u00a9 Gauteng Provincial Government 2026 . Powered by Department of e-Government"
  },
  {
    "position": "Assistant Manager Nursing Communicable Disease Control",
    "location": "Johannesburg Health District",
    "package": "R 755 355,00 per annum (plus benefits)",
    "closing_date": "2026/01/09",
    "link": "https://jobs.gauteng.gov.za/Public/ViewJob.aspx?u=Awpj99fb8YVv4ckdW1A04A==",
    "title": "Assistant Manager Nursing Communicable Disease Control",
    "reference_number": "REFS/024359",
    "directorate": "Public Health or Primary Health Care",
    "centre": "Johannesburg Health District",
    "package_detail": "R 755 355,00 per annum (plus benefits)",
    "closing_date_detail": "09-01-2026",
    "enquiries": "Ms Matlhodi Mogorosi -082 857 1917",
    "requirements": "R425 Diploma / Degree in Nursing that allows registration with South African Nursing Council (SANC) as a Professional Nurse. A post- basic nursing qualification with duration of at least one year, accredited with SANC in one of the specialties R2598 (Clinical Nursing Science Health Assessment, Treatment and Care). A Health Service Management or Nursing Administration qualification with duration of at least 01 year, accredited with SANC. Healthcare management or public health would be an advantage. A minimum of 9 years appropriate/ recognizable experience in nursing after registration as a Professional Nurse with SANC in General Nursing. At least 4 years of the period referred to above must be appropriate/ recognizable experience at Communicable Disease Control/Disease Surveillance coordinated programme level. Background in project management (added advantage), disease surveillance, infection prevention and control, health information systems including monitoring and evaluation. A valid driver\u2019s license and computer literacy are required. Demonstrate in-depth understanding of nursing legislation and related legal and ethical nursing practices. Demonstrate basic understanding of Human Resource and Financial policies and practices. Knowledge of relevant legislative governing the public service. Good communication and writing skills. Good human relations.",
    "duties": "Ability to plan and organize own work, time, and that of support teams to ensure proper implementation of the programme. Alert Health care workers and Managers on Surveillance activities. Support, Monitor and Evaluate Notifiable disease surveillance in the District. Liaise with Provincial Surveillance officers, EPI /CDC, programs (Environmental and Port Health, Infection Prevention and Control, Health Promotion and Nutrition), Facility Managers, hospitals including NICD particularly for tests and results when necessary. Support activities to improve quality of surveillance for targeted EPI /CDC priority conditions (conduct record reviews, obtaining clinical notes, cold chain maintenance) Conduct regular active surveillance visits to health Facilities within the district according to the priority level of facilities. Coordinate case investigation and outbreak response. Ensure effective management of data (collect, capture, collate, analyze, and interpret surveillance data) Participate in monitoring impact of vaccination, surveillance, and disease trends, EPI and vaccine preventable and communicable diseases research as required. Ensure processing of case investigation reports. Monitor progress towards Polio Eradication and NNT elimination against WHO indicators. Participate in developing training materials for notifiable diseases, capacitate District health officers through training and support visits. Participate in planning and other activities for surveillance improvement, to reach District, Provincial and National objectives. Evaluate and monitor compliance to National Core Standards. Ensure attendance to meetings of communicable Diseases and Outbreak response unit in the district and provincial office, provide feedback from meetings. Provide compiled monthly update on notifiable diseases, follow upon pending cases, line listing of reported cases and provide feedback to sub-districts. Ensure adherence to prescribed scheduled submission of quarterly reports to sub-districts and other stake holders through the EPI Team meeting. Be able to work under pressure and support all activities of the district Perform all other duties delegated by Supervisor/ Manager.",
    "notes": "Applications should be submitted strictly online at the following E-Recruitment portal: http://jobs.gauteng.gov.za. No hand-delivered, faxed, or emailed applications will be accepted. For assistance with online applications please email your query to healthjobqueries@gauteng.gov.za . NB: Where Driver\u2019s Licence is mandatory, exception will be granted for people with disabilities. Application should be accompanied by a fully completed and signed new Z83 application form obtainable from any Public Service Department or on the internet at www.dpsa.gov.za/documents plus a recently updated comprehensive Curriculum Vitae (CV), Registration Certificate with relevant professional body (HPCSA) and a proof of current registration (Annual Practicing Certificate/Card). Applications without proof of a new Z83 application form, a detailed CV, registration certificate and a proof of current registration card/certificate with relevant professional body will be disqualified. (Shortlisted candidates will receive communication from HR to submit certified copies of educational qualifications and other relevant documents not older than 6 months on or before the day of the interview). It is the applicant\u2019s responsibility to have foreign qualifications evaluated by the South African Qualifications Authority (SAQA). All foreign qualification must be accompanied by evaluation certificate from the South African Qualification Authority (SAQA). Correspondence will only be limited to shortlisted candidates. If you have not been contacted within 3 months of the closing date of this advertisement, please accept that your application was unsuccessful. Suitable candidates will be subjected to a personnel suitability check (criminal record, citizenship, credit record checks, qualification verification and employment verification). Where applicable, candidates will be subjected to a skills/knowledge test. The recommended candidate may be subjected to Medical Surveillance as required by the Occupational Health and Safety Act, Act 5/1993. It is Department\u2019s intention to promote representivity (race, gender, and disability) in the Public Service through the filling of these posts. The Department reserves the right not to appoint/fill this post. WOMEN AND PEOPLE WITH DISABILITY ARE ENCOURAGED TO APPLY.",
    "full_text": "HOME\nJOBS\nABOUT US\nACCOUNT\n\n\n\nJob Details\nDepartment of Health\nAssistant Manager Nursing Communicable Disease Control\nReference Number : REFS/024359\nDirectorate : Public Health or Primary Health Care\nNumber of Posts : 1\nPackage : R 755 355,00 per annum (plus benefits)\nEnquiries : Ms Matlhodi Mogorosi -082 857 1917\n\nRequirements :\n\nR425 Diploma / Degree in Nursing that allows registration with South African Nursing Council (SANC) as a Professional Nurse. A post- basic nursing qualification with duration of at least one year, accredited with SANC in one of the specialties R2598 (Clinical Nursing Science Health Assessment, Treatment and Care). A Health Service Management or Nursing Administration qualification with duration of at least 01 year, accredited with SANC. Healthcare management or public health would be an advantage. A minimum of 9 years appropriate/ recognizable experience in nursing after registration as a Professional Nurse with SANC in General Nursing. At least 4 years of the period referred to above must be appropriate/ recognizable experience at Communicable Disease Control/Disease Surveillance coordinated programme level. Background in project management (added advantage), disease surveillance, infection prevention and control, health information systems including monitoring and evaluation. A valid driver\u2019s license and computer literacy are required. Demonstrate in-depth understanding of nursing legislation and related legal and ethical nursing practices. Demonstrate basic understanding of Human Resource and Financial policies and practices. Knowledge of relevant legislative governing the public service. Good communication and writing skills. Good human relations.\n\nDuties :\n\nAbility to plan and organize own work, time, and that of support teams to ensure proper implementation of the programme. Alert Health care workers and Managers on Surveillance activities. Support, Monitor and Evaluate Notifiable disease surveillance in the District. Liaise with Provincial Surveillance officers, EPI /CDC, programs (Environmental and Port Health, Infection Prevention and Control, Health Promotion and Nutrition), Facility Managers, hospitals including NICD particularly for tests and results when necessary. Support activities to improve quality of surveillance for targeted EPI /CDC priority conditions (conduct record reviews, obtaining clinical notes, cold chain maintenance) Conduct regular active surveillance visits to health Facilities within the district according to the priority level of facilities. Coordinate case investigation and outbreak response. Ensure effective management of data (collect, capture, collate, analyze, and interpret surveillance data) Participate in monitoring impact of vaccination, surveillance, and disease trends, EPI and vaccine preventable and communicable diseases research as required. Ensure processing of case investigation reports. Monitor progress towards Polio Eradication and NNT elimination against WHO indicators. Participate in developing training materials for notifiable diseases, capacitate District health officers through training and support visits. Participate in planning and other activities for surveillance improvement, to reach District, Provincial and National objectives. Evaluate and monitor compliance to National Core Standards. Ensure attendance to meetings of communicable Diseases and Outbreak response unit in the district and provincial office, provide feedback from meetings. Provide compiled monthly update on notifiable diseases, follow upon pending cases, line listing of reported cases and provide feedback to sub-districts. Ensure adherence to prescribed scheduled submission of quarterly reports to sub-districts and other stake holders through the EPI Team meeting. Be able to work under pressure and support all activities of the district Perform all other duties delegated by Supervisor/ Manager.\n\nNotes :\n\nApplications should be submitted strictly online at the following E-Recruitment portal: http://jobs.gauteng.gov.za. No hand-delivered, faxed, or emailed applications will be accepted. For assistance with online applications please email your query to healthjobqueries@gauteng.gov.za . NB: Where Driver\u2019s Licence is mandatory, exception will be granted for people with disabilities. Application should be accompanied by a fully completed and signed new Z83 application form obtainable from any Public Service Department or on the internet at www.dpsa.gov.za/documents plus a recently updated comprehensive Curriculum Vitae (CV), Registration Certificate with relevant professional body (HPCSA) and a proof of current registration (Annual Practicing Certificate/Card). Applications without proof of a new Z83 application form, a detailed CV, registration certificate and a proof of current registration card/certificate with relevant professional body will be disqualified. (Shortlisted candidates will receive communication from HR to submit certified copies of educational qualifications and other relevant documents not older than 6 months on or before the day of the interview). It is the applicant\u2019s responsibility to have foreign qualifications evaluated by the South African Qualifications Authority (SAQA). All foreign qualification must be accompanied by evaluation certificate from the South African Qualification Authority (SAQA). Correspondence will only be limited to shortlisted candidates. If you have not been contacted within 3 months of the closing date of this advertisement, please accept that your application was unsuccessful. Suitable candidates will be subjected to a personnel suitability check (criminal record, citizenship, credit record checks, qualification verification and employment verification). Where applicable, candidates will be subjected to a skills/knowledge test. The recommended candidate may be subjected to Medical Surveillance as required by the Occupational Health and Safety Act, Act 5/1993. It is Department\u2019s intention to promote representivity (race, gender, and disability) in the Public Service through the filling of these posts. The Department reserves the right not to appoint/fill this post. WOMEN AND PEOPLE WITH DISABILITY ARE ENCOURAGED TO APPLY.\n\nEmployer : Department of Health\n\nLocation : Johannesburg Health District\n\nClosing Date : 09-01-2026\n\n\n\nCriteria Questions\nDo you have R425 Diploma / Degree in Nursing that allows registration with South African Nursing Council (SANC) as a Professional Nurse.\nDo you have a minimum of 9 years appropriate/ recognizable experience in nursing after registration as a Professional Nurse with SANC in General Nursing.\n\n\n\nPlease Notes :\n\nDue to the large number of applications we envisage receiving, applications will not be acknowledged. If you do not receive any response within 3 months, please accept that your application was not successful.\n\n\nFind us\nAddress\n75 Fox Street, Mashalltown\nJohannesburg\n2000\n\nCall us\n\nPhone\n080 022 8827\nEmail\nsupport@gauteng.gov.za\n\nQuick Links\nAll Jobs\nAbout Us\n\n\u00a9 Gauteng Provincial Government 2026 . Powered by Department of e-Government"
  },
  {
    "position": "ASSISTANT MANAGER NURSING (Quality Assurance)",
    "location": "Johannesburg Health District",
    "package": "R 693 096.00 per annum plus benefits",
    "closing_date": "2026/01/09",
    "link": "https://jobs.gauteng.gov.za/Public/ViewJob.aspx?u=Awpj99fb8YVwhNvln9CbvQ==",
    "title": "ASSISTANT MANAGER NURSING (Quality Assurance)",
    "reference_number": "REFS/024358",
    "directorate": "Quality Assurance",
    "centre": "Johannesburg Health District",
    "package_detail": "R 693 096.00 per annum plus benefits",
    "closing_date_detail": "09-01-2026",
    "enquiries": "Mrs Midiaifani Mudau Tel No- 011 694 3848/17",
    "requirements": "Grade 12 or equivalent. Basic R425 qualification (Diploma/ Degree in nursing) that allows registration with the SANC as Professional Nurse. Proof of registration with SANC as a Professional Nurse. A Health Service Management or Nursing Administration qualification with duration of at least 01 year, accredited with SANC. A minimum of 8 years appropriate/recognizable nursing experience after registration as Professional Nurse with the SANC in General Nursing. At least 3 years of the period referred to above must be appropriate/ recognisable experience at management level. At least 1 year experience in Quality Assurance environment. Applicant must be in a possession of a valid South African driver\u2019s license and able to drive. Computer Literacy (i.e. MS Word, PowerPoint and Excel). Knowledge and understanding of Healthcare Quality Assurance program (Patient Safety Incident (PSI) Management, Customer Care Services, Regulated Norms and Standard, Ideal Clinic/ CHC Framework) etc. Knowledge of related Guidelines Health Regulations, Policies and Acts. Ability to work independently in a multidisciplinary context. Ability to handle multiple projects and activities simultaneously. Analytical thinking, independent decision-making and problem-solving skills. Report writing skills. Good work ethics, integrity and honesty. The following will be an added advantage: A qualification in Total Quality Management.",
    "duties": "Manage the Operational requirements for Quality Assurance Programme. Develop an Operational Plan aligned to the Departmental Strategic Plan. Develop Quality Improvement Plans, Protocols, and SOP\u2019s. Ensure compliance to indicators with regards to Complaints, PSI, PEC, Ideal Clinic/CHC Framework, Regulated Norms and Standards and Clinical Audits. Promote compliance, implementation, monitoring of National Guidelines and Policies. Support the unit in the investigation of Complaints and PSI, conduct QA meetings and Clinical Audits. Conducts support visits to the facilities in the District. Collate and consolidate monthly, quarterly, and annual reports. Monitor compliance of Quality Assurance Indicators as per Annual Performance Plan. Analyse data, establish and monitor trends. Plan and facilitate relevant trainings on Quality Assurance program. Liaise with relevant internal and external stakeholders. Excellent written communication skills, including the ability to prepare documents and display the capacity in human resource planning and people management.",
    "notes": "Applications should be submitted strictly online at the following E-Recruitment portal: http://jobs.gauteng.gov.za. No hand-delivered, faxed, or emailed applications will be accepted. For assistance with online applications please email your query to healthjobqueries@gauteng.gov.za . NB: Where Driver\u2019s Licence is mandatory, exception will be granted for people with disabilities. Application should be accompanied by a fully completed and signed new Z83 application form obtainable from any Public Service Department or on the internet at www.dpsa.gov.za/documents plus a recently updated comprehensive Curriculum Vitae (CV), Registration Certificate with relevant professional body (HPCSA) and a proof of current registration (Annual Practicing Certificate/Card). Applications without proof of a new Z83 application form, a detailed CV, registration certificate and a proof of current registration card/certificate with relevant professional body will be disqualified. (Shortlisted candidates will receive communication from HR to submit certified copies of educational qualifications and other relevant documents not older than 6 months on or before the day of the interview). It is the applicant\u2019s responsibility to have foreign qualifications evaluated by the South African Qualifications Authority (SAQA). All foreign qualification must be accompanied by evaluation certificate from the South African Qualification Authority (SAQA). Correspondence will only be limited to shortlisted candidates. If you have not been contacted within 3 months of the closing date of this advertisement, please accept that your application was unsuccessful. Suitable candidates will be subjected to a personnel suitability check (criminal record, citizenship, credit record checks, qualification verification and employment verification). Where applicable, candidates will be subjected to a skills/knowledge test. The recommended candidate may be subjected to Medical Surveillance as required by the Occupational Health and Safety Act, Act 5/1993. It is Department\u2019s intention to promote representivity (race, gender, and disability) in the Public Service through the filling of these posts. The Department reserves the right not to appoint/fill this post. WOMEN AND PEOPLE WITH DISABILITY ARE ENCOURAGED TO APPLY.",
    "full_text": "HOME\nJOBS\nABOUT US\nACCOUNT\n\n\n\nJob Details\nDepartment of Health\nASSISTANT MANAGER NURSING (Quality Assurance)\nReference Number : REFS/024358\nDirectorate : Quality Assurance\nNumber of Posts : 1\nPackage : R 693 096.00 per annum plus benefits\nEnquiries : Mrs Midiaifani Mudau Tel No- 011 694 3848/17\n\nRequirements :\n\nGrade 12 or equivalent. Basic R425 qualification (Diploma/ Degree in nursing) that allows registration with the SANC as Professional Nurse. Proof of registration with SANC as a Professional Nurse. A Health Service Management or Nursing Administration qualification with duration of at least 01 year, accredited with SANC. A minimum of 8 years appropriate/recognizable nursing experience after registration as Professional Nurse with the SANC in General Nursing. At least 3 years of the period referred to above must be appropriate/ recognisable experience at management level. At least 1 year experience in Quality Assurance environment. Applicant must be in a possession of a valid South African driver\u2019s license and able to drive. Computer Literacy (i.e. MS Word, PowerPoint and Excel). Knowledge and understanding of Healthcare Quality Assurance program (Patient Safety Incident (PSI) Management, Customer Care Services, Regulated Norms and Standard, Ideal Clinic/ CHC Framework) etc. Knowledge of related Guidelines Health Regulations, Policies and Acts. Ability to work independently in a multidisciplinary context. Ability to handle multiple projects and activities simultaneously. Analytical thinking, independent decision-making and problem-solving skills. Report writing skills. Good work ethics, integrity and honesty. The following will be an added advantage: A qualification in Total Quality Management.\n\nDuties :\n\nManage the Operational requirements for Quality Assurance Programme. Develop an Operational Plan aligned to the Departmental Strategic Plan. Develop Quality Improvement Plans, Protocols, and SOP\u2019s. Ensure compliance to indicators with regards to Complaints, PSI, PEC, Ideal Clinic/CHC Framework, Regulated Norms and Standards and Clinical Audits. Promote compliance, implementation, monitoring of National Guidelines and Policies. Support the unit in the investigation of Complaints and PSI, conduct QA meetings and Clinical Audits. Conducts support visits to the facilities in the District. Collate and consolidate monthly, quarterly, and annual reports. Monitor compliance of Quality Assurance Indicators as per Annual Performance Plan. Analyse data, establish and monitor trends. Plan and facilitate relevant trainings on Quality Assurance program. Liaise with relevant internal and external stakeholders. Excellent written communication skills, including the ability to prepare documents and display the capacity in human resource planning and people management.\n\nNotes :\n\nApplications should be submitted strictly online at the following E-Recruitment portal: http://jobs.gauteng.gov.za. No hand-delivered, faxed, or emailed applications will be accepted. For assistance with online applications please email your query to healthjobqueries@gauteng.gov.za . NB: Where Driver\u2019s Licence is mandatory, exception will be granted for people with disabilities. Application should be accompanied by a fully completed and signed new Z83 application form obtainable from any Public Service Department or on the internet at www.dpsa.gov.za/documents plus a recently updated comprehensive Curriculum Vitae (CV), Registration Certificate with relevant professional body (HPCSA) and a proof of current registration (Annual Practicing Certificate/Card). Applications without proof of a new Z83 application form, a detailed CV, registration certificate and a proof of current registration card/certificate with relevant professional body will be disqualified. (Shortlisted candidates will receive communication from HR to submit certified copies of educational qualifications and other relevant documents not older than 6 months on or before the day of the interview). It is the applicant\u2019s responsibility to have foreign qualifications evaluated by the South African Qualifications Authority (SAQA). All foreign qualification must be accompanied by evaluation certificate from the South African Qualification Authority (SAQA). Correspondence will only be limited to shortlisted candidates. If you have not been contacted within 3 months of the closing date of this advertisement, please accept that your application was unsuccessful. Suitable candidates will be subjected to a personnel suitability check (criminal record, citizenship, credit record checks, qualification verification and employment verification). Where applicable, candidates will be subjected to a skills/knowledge test. The recommended candidate may be subjected to Medical Surveillance as required by the Occupational Health and Safety Act, Act 5/1993. It is Department\u2019s intention to promote representivity (race, gender, and disability) in the Public Service through the filling of these posts. The Department reserves the right not to appoint/fill this post. WOMEN AND PEOPLE WITH DISABILITY ARE ENCOURAGED TO APPLY.\n\nEmployer : Department of Health\n\nLocation : Johannesburg Health District\n\nClosing Date : 09-01-2026\n\n\n\nCriteria Questions\nDo you have a basic R425 qualification (Diploma/ Degree in nursing) that allows registration with the SANC as Professional Nurse.\nDo you have a minimum of 8 years appropriate/recognizable nursing experience after registration as Professional Nurse with the SANC in General Nursing.\n\n\n\nPlease Notes :\n\nDue to the large number of applications we envisage receiving, applications will not be acknowledged. If you do not receive any response within 3 months, please accept that your application was not successful.\n\n\nFind us\nAddress\n75 Fox Street, Mashalltown\nJohannesburg\n2000\n\nCall us\n\nPhone\n080 022 8827\nEmail\nsupport@gauteng.gov.za\n\nQuick Links\nAll Jobs\nAbout Us\n\n\u00a9 Gauteng Provincial Government 2026 . Powered by Department of e-Government"
  },
  {
    "position": "DEPUTY MANAGER - PRIMARY HEALTH CARE",
    "location": "Johannesburg Health District (Sub District D)",
    "package": "R1 028 091.00 per annum",
    "closing_date": "2026/01/09",
    "link": "https://jobs.gauteng.gov.za/Public/ViewJob.aspx?u=Awpj99fb8YUknpzUttUCHA==",
    "title": "DEPUTY MANAGER - PRIMARY HEALTH CARE",
    "reference_number": "REFS/024357",
    "directorate": "Nursing",
    "centre": "Johannesburg Health District (Sub District D)",
    "package_detail": "R1 028 091.00 per annum",
    "closing_date_detail": "09-01-2026",
    "enquiries": "Ms L. Matlala Tel No: (011) 694 3708 (Monday to Friday ONLY) from 08h00 to 16h00)",
    "requirements": "Basic qualification (Diploma/Degree in Nursing) or equivalent qualification that allows registration with the South African Nursing Council [SANC], Post basic qualification {will be an added advantage}. A Health Service Management or Nursing Administration qualification with duration of at least 01 year, accredited with SANC. Current registration with the SANC. A minimum of 09 years appropriate/recognizable Nursing experience after registration SANC in General Nursing. Must have worked as Assistant Manager Nursing in Management capacity in the public health field at least four(04)years Recognized Experience. Other Skills/Requirements: Administrative and advanced Computer literacy to write reports plus District Health Management to be able to develop the Regional Health and Project Management, more experience in the Primary Health Care setting. Knowledge of the application of the relevant statutes and policies governing the public service and health care sciences. Knowledge of the Performance Management and Development System. Knowledge and application of the Constitution; National Health Act; Public Service Act, Public Service Regulations, Basic Conditions of Employment Act, Labour Relations Act, Public Finance Management Act and Treasury Regulations. Understanding the application of the Batho-Pele principles, Patients\u2019 rights charter and quality assurance system. Well-developed communication, presentation, negotiation and research skills. Strategic, operational and people management skills. Ability to interact with diverse stakeholders and health users and givers. Facilitation and co-ordination skills. Problem solving, planning and organizing skills. Computer literacy and report writing skills. Applicants to possess Valid driver\u2019s license. NB: A practical test relating to key areas of knowledge and skills may form part of the selection process for this position. Correspondence & engagement will only be entered into with shortlisted candidates who meet the requirements. Additional advantageous skills include project management.",
    "duties": "The essential role is to provide leadership, coordinate, plan, manage, and supply effective administration support to the Primary Health Care and Health Programmes in the sub-district. Ensure implementation of the District Health System using the PHC approach including Community Based and Outreach Services with the National and Provincial framework. Plan for the implementation of National Health Insurance (NHI). The key performance areas (KPA\u2019s): Preserve good working conditions; optimum resource utilization; process improvement; safety and prevention planning and control; and regularly work within the legislative, regulation and policies frameworks. the key results areas (KPA\u2019s): Patient and staff satisfaction always; smooth service management; secure operational cost control; and quality checks occur uninterrupted; and maintain record keeping. the supervision and leadership acumen: Strive to have the ability or quality to motivate and inspire others to achieve the set goal; and command the process of planning, organizing, implementing, coordinating, and controlling activities. Excellent written communication skills, including the ability to prepare documents; and display the capacity in human resource planning, and people management.",
    "notes": "Applications should be submitted strictly online at the following E-Recruitment portal: https://jobs.gauteng.gov.za. No hand-delivered, faxed, or emailed applications will be accepted. For assistance with online applications please email your query to healthjobqueries@gauteng.gov.za. NB: Where Driver\u2019s Licence is mandatory, exception will be granted for people with disabilities. Application should be accompanied by a fully completed and signed new Z83 application form obtainable from any Public Service Department or on the internet at www.dpsa.gov.za/documents plus a recently updated comprehensive Curriculum Vitae (CV), Registration Certificate with relevant professional body (HPCSA) and a proof of current registration (Annual Practicing Certificate/Card). Applications without proof of a new Z83 application form, a detailed CV, registration certificate and a proof of current registration card/certificate with relevant professional body will be disqualified. (Shortlisted candidates will receive communication from HR to submit certified copies of educational qualifications and other relevant documents not older than 6 months on or before the day of the interview). It is the applicant\u2019s responsibility to have foreign qualifications evaluated by the South African Qualifications Authority (SAQA). All foreign qualification must be accompanied by evaluation certificate from the South African Qualification Authority (SAQA). Correspondence will only be limited to shortlisted candidates. If you have not been contacted within 3 months of the closing date of this advertisement, please accept that your application was unsuccessful. Suitable candidates will be subjected to a personnel suitability check (criminal record, citizenship, credit record checks, qualification verification and employment verification). Where applicable, candidates will be subjected to a skills/knowledge test. The recommended candidate may be subjected to Medical Surveillance as required by the Occupational Health and Safety Act, Act 5/1993. It is Department\u2019s intention to promote representivity (race, gender, and disability) in the Public Service through the filling of these posts. The Department reserves the right not to appoint/fill this post. WOMEN AND PEOPLE WITH DISABILITY ARE ENCOURAGED TO APPLY.",
    "full_text": "HOME\nJOBS\nABOUT US\nACCOUNT\n\n\n\nJob Details\nDepartment of Health\nDEPUTY MANAGER - PRIMARY HEALTH CARE\nReference Number : REFS/024357\nDirectorate : Nursing\nNumber of Posts : 1\nPackage : R1 028 091.00 per annum\nEnquiries : Ms L. Matlala Tel No: (011) 694 3708 (Monday to Friday ONLY) from 08h00 to 16h00)\n\nRequirements :\n\nBasic qualification (Diploma/Degree in Nursing) or equivalent qualification that allows registration with the South African Nursing Council [SANC], Post basic qualification {will be an added advantage}. A Health Service Management or Nursing Administration qualification with duration of at least 01 year, accredited with SANC. Current registration with the SANC. A minimum of 09 years appropriate/recognizable Nursing experience after registration SANC in General Nursing. Must have worked as Assistant Manager Nursing in Management capacity in the public health field at least four(04)years Recognized Experience. Other Skills/Requirements: Administrative and advanced Computer literacy to write reports plus District Health Management to be able to develop the Regional Health and Project Management, more experience in the Primary Health Care setting. Knowledge of the application of the relevant statutes and policies governing the public service and health care sciences. Knowledge of the Performance Management and Development System. Knowledge and application of the Constitution; National Health Act; Public Service Act, Public Service Regulations, Basic Conditions of Employment Act, Labour Relations Act, Public Finance Management Act and Treasury Regulations. Understanding the application of the Batho-Pele principles, Patients\u2019 rights charter and quality assurance system. Well-developed communication, presentation, negotiation and research skills. Strategic, operational and people management skills. Ability to interact with diverse stakeholders and health users and givers. Facilitation and co-ordination skills. Problem solving, planning and organizing skills. Computer literacy and report writing skills. Applicants to possess Valid driver\u2019s license. NB: A practical test relating to key areas of knowledge and skills may form part of the selection process for this position. Correspondence & engagement will only be entered into with shortlisted candidates who meet the requirements. Additional advantageous skills include project management.\n\nDuties :\n\nThe essential role is to provide leadership, coordinate, plan, manage, and supply effective administration support to the Primary Health Care and Health Programmes in the sub-district. Ensure implementation of the District Health System using the PHC approach including Community Based and Outreach Services with the National and Provincial framework. Plan for the implementation of National Health Insurance (NHI). The key performance areas (KPA\u2019s): Preserve good working conditions; optimum resource utilization; process improvement; safety and prevention planning and control; and regularly work within the legislative, regulation and policies frameworks. the key results areas (KPA\u2019s): Patient and staff satisfaction always; smooth service management; secure operational cost control; and quality checks occur uninterrupted; and maintain record keeping. the supervision and leadership acumen: Strive to have the ability or quality to motivate and inspire others to achieve the set goal; and command the process of planning, organizing, implementing, coordinating, and controlling activities. Excellent written communication skills, including the ability to prepare documents; and display the capacity in human resource planning, and people management.\n\nNotes :\n\nApplications should be submitted strictly online at the following E-Recruitment portal: https://jobs.gauteng.gov.za. No hand-delivered, faxed, or emailed applications will be accepted. For assistance with online applications please email your query to healthjobqueries@gauteng.gov.za. NB: Where Driver\u2019s Licence is mandatory, exception will be granted for people with disabilities. Application should be accompanied by a fully completed and signed new Z83 application form obtainable from any Public Service Department or on the internet at www.dpsa.gov.za/documents plus a recently updated comprehensive Curriculum Vitae (CV), Registration Certificate with relevant professional body (HPCSA) and a proof of current registration (Annual Practicing Certificate/Card). Applications without proof of a new Z83 application form, a detailed CV, registration certificate and a proof of current registration card/certificate with relevant professional body will be disqualified. (Shortlisted candidates will receive communication from HR to submit certified copies of educational qualifications and other relevant documents not older than 6 months on or before the day of the interview). It is the applicant\u2019s responsibility to have foreign qualifications evaluated by the South African Qualifications Authority (SAQA). All foreign qualification must be accompanied by evaluation certificate from the South African Qualification Authority (SAQA). Correspondence will only be limited to shortlisted candidates. If you have not been contacted within 3 months of the closing date of this advertisement, please accept that your application was unsuccessful. Suitable candidates will be subjected to a personnel suitability check (criminal record, citizenship, credit record checks, qualification verification and employment verification). Where applicable, candidates will be subjected to a skills/knowledge test. The recommended candidate may be subjected to Medical Surveillance as required by the Occupational Health and Safety Act, Act 5/1993. It is Department\u2019s intention to promote representivity (race, gender, and disability) in the Public Service through the filling of these posts. The Department reserves the right not to appoint/fill this post. WOMEN AND PEOPLE WITH DISABILITY ARE ENCOURAGED TO APPLY.\n\nEmployer : Department of Health\n\nLocation : Johannesburg Health District (Sub District D)\n\nClosing Date : 09-01-2026\n\n\n\nCriteria Questions\nDo you have basic qualification (Diploma/Degree in Nursing) or equivalent qualification that allows registration with the South African Nursing Council [SANC]?\nDo you have a minimum of 09 years appropriate/recognizable Nursing experience after registration SANC in General Nursing?\n\n\n\nPlease Notes :\n\nDue to the large number of applications we envisage receiving, applications will not be acknowledged. If you do not receive any response within 3 months, please accept that your application was not successful.\n\n\nFind us\nAddress\n75 Fox Street, Mashalltown\nJohannesburg\n2000\n\nCall us\n\nPhone\n080 022 8827\nEmail\nsupport@gauteng.gov.za\n\nQuick Links\nAll Jobs\nAbout Us\n\n\u00a9 Gauteng Provincial Government 2026 . Powered by Department of e-Government"
  }
]